Sheet: Inst. (1-1)~(1-4)
A1: Inst. (1-1) | B1: O | C1: D | D1: Number of passengers (person) | E1: Reservation slot 1 | F1: Reservation slot 2 | G1: Volume of goods (ton) | H1: Reservation slot 1 | I1: Reservation slot 2 | J1: Distance by rail
A2: 0 | B2: 0 | C2: 1 | D2: =SUM(RC[1]:RC[2]) -> 276 | E2: 184 | F2: 92 | G2: =SUM(RC[1]:RC[2]) -> 10 | H2: 6 | I2: 4 | J2: 50
A3: 1 | B3: 0 | C3: 2 | D3: =SUM(RC[1]:RC[2]) -> 310 | E3: 152 | F3: 158 | G3: =SUM(RC[1]:RC[2]) -> 17 | H3: 10 | I3: 7 | J3: 83
A4: 2 | B4: 0 | C4: 3 | D4: =SUM(RC[1]:RC[2]) -> 388 | E4: 142 | F4: 246 | G4: =SUM(RC[1]:RC[2]) -> 8 | H4: 8 | I4: 0 | J4: 126
A5: 3 | B5: 0 | C5: 4 | D5: =SUM(RC[1]:RC[2]) -> 374 | E5: 198 | F5: 176 | G5: =SUM(RC[1]:RC[2]) -> 16 | H5: 6 | I5: 10 | J5: 165
A6: 4 | B6: 1 | C6: 2 | D6: =SUM(RC[1]:RC[2]) -> 288 | E6: 174 | F6: 114 | G6: =SUM(RC[1]:RC[2]) -> 18 | H6: 16 | I6: 2 | J6: 33
A7: 5 | B7: 1 | C7: 3 | D7: =SUM(RC[1]:RC[2]) -> 292 | E7: 142 | F7: 150 | G7: =SUM(RC[1]:RC[2]) -> 16 | H7: 7 | I7: 9 | J7: 76
A8: 6 | B8: 1 | C8: 4 | D8: =SUM(RC[1]:RC[2]) -> 212 | E8: 212 | F8: 0 | G8: =SUM(RC[1]:RC[2]) -> 12 | H8: 0 | I8: 12 | J8: 115
A9: 7 | B9: 2 | C9: 3 | D9: =SUM(RC[1]:RC[2]) -> 396 | E9: 226 | F9: 170 | G9: =SUM(RC[1]:RC[2]) -> 17 | H9: 13 | I9: 4 | J9: 43
A10: 8 | B10: 2 | C10: 4 | D10: =SUM(RC[1]:RC[2]) -> 244 | E10: 172 | F10: 72 | G10: =SUM(RC[1]:RC[2]) -> 20 | H10: 10 | I10: 10 | J10: 82
A11: 9 | B11: 3 | C11: 4 | D11: =SUM(RC[1]:RC[2]) -> 220 | E11: 0 | F11: 220 | G11: =SUM(RC[1]:RC[2]) -> 16 | H11: 10 | I11: 6 | J11: 39
A12: Total | D12: =SUM(R[-10]C:R[-1]C) -> 3000 | E12: — | F12: — | G12: =SUM(R[-10]C:R[-1]C) -> 150 | H12: — | I12: —
A14: Inst. (1-2) | B14: O | C14: D | D14: Number of passengers (person) | E14: Reservation slot 1 | F14: Reservation slot 2 | G14: Reservation slot 3 | H14: Volume of goods (ton) | I14: Reservation slot 1 | J14: Reservation slot 2 | K14: Reservation slot 3 | L14: Distance by rail
A15: 0 | B15: 0 | C15: 1 | D15: =SUM(RC[1]:RC[3]) -> 416 | E15: 184 | F15: 92 | G15: 140 | H15: =SUM(RC[1]:RC[3]) -> 18 | I15: 6 | J15: 4 | K15: 8 | L15: 50
A16: 1 | B16: 0 | C16: 2 | D16: =SUM(RC[1]:RC[3]) -> 504 | E16: 122 | F16: 158 | G16: 224 | H16: =SUM(RC[1]:RC[3]) -> 23 | I16: 10 | J16: 7 | K16: 6 | L16: 83
A17: 2 | B17: 0 | C17: 3 | D17: =SUM(RC[1]:RC[3]) -> 290 | E17: 142 | F17: 148 | G17: 0 | H17: =SUM(RC[1]:RC[3]) -> 10 | I17: 0 | J17: 8 | K17: 2 | L17: 126
A18: 3 | B18: 0 | C18: 4 | D18: =SUM(RC[1]:RC[3]) -> 153 | E18: 0 | F18: 153 | G18: 0 | H18: =SUM(RC[1]:RC[3]) -> 11 | I18: 6 | J18: 5 | K18: 0 | L18: 165
A19: 4 | B19: 1 | C19: 2 | D19: =SUM(RC[1]:RC[3]) -> 394 | E19: 70 | F19: 114 | G19: 210 | H19: =SUM(RC[1]:RC[3]) -> 24 | I19: 16 | J19: 0 | K19: 8 | L19: 33
A20: 5 | B20: 1 | C20: 3 | D20: =SUM(RC[1]:RC[3]) -> 300 | E20: 142 | F20: 0 | G20: 158 | H20: =SUM(RC[1]:RC[3]) -> 6 | I20: 2 | J20: 4 | K20: 0 | L20: 76
A21: 6 | B21: 1 | C21: 4 | D21: =SUM(RC[1]:RC[3]) -> 62 | E21: 0 | F21: 62 | G21: 0 | H21: =SUM(RC[1]:RC[3]) -> 12 | I21: 0 | J21: 12 | K21: 0 | L21: 115
A22: 7 | B22: 2 | C22: 3 | D22: =SUM(RC[1]:RC[3]) -> 392 | E22: 75 | F22: 170 | G22: 147 | H22: =SUM(RC[1]:RC[3]) -> 16 | I22: 7 | J22: 4 | K22: 5 | L22: 43
A23: 8 | B23: 2 | C23: 4 | D23: =SUM(RC[1]:RC[3]) -> 172 | E23: 172 | F23: 0 | G23: 0 | H23: =SUM(RC[1]:RC[3]) -> 20 | I23: 0 | J23: 10 | K23: 10 | L23: 82
A24: 9 | B24: 3 | C24: 4 | D24: =SUM(RC[1]:RC[3]) -> 317 | E24: 0 | F24: 201 | G24: 116 | H24: =SUM(RC[1]:RC[3]) -> 10 | I24: 0 | J24: 6 | K24: 4 | L24: 39
A25: Total | D25: =SUM(R[-10]C:R[-1]C) -> 3000 | E25: — | F25: — | G25: — | H25: =SUM(R[-10]C:R[-1]C) -> 150 | I25: — | J25: — | K25: —
A27: Inst. (1-3) | B27: O | C27: D | D27: Number of passengers (person) | E27: Reservation slot 1 | F27: Reservation slot 2 | G27: Reservation slot 3 | H27: Reservation slot 4 | I27: Volume of goods (ton) | J27: Reservation slot 1 | K27: Reservation slot 2 | L27: Reservation slot 3 | M27: Reservation slot 4 | N27: Distance by rail
A28: 0 | B28: 0 | C28: 1 | D28: =SUM(RC[1]:RC[4]) -> 360 | E28: 152 | F28: 68 | G28: 140 | H28: 0 | I28: =SUM(RC[1]:RC[4]) -> 18 | J28: 6 | K28: 6 | L28: 6 | M28: 0 | N28: 50
A29: 1 | B29: 0 | C29: 2 | D29: =SUM(RC[1]:RC[4]) -> 349 | E29: 105 | F29: 84 | G29: 160 | H29: 0 | I29: =SUM(RC[1]:RC[4]) -> 23 | J29: 10 | K29: 7 | L29: 6 | M29: 0 | N29: 83
A30: 2 | B30: 0 | C30: 3 | D30: =SUM(RC[1]:RC[4]) -> 124 | E30: 104 | F30: 20 | G30: 0 | H30: 0 | I30: =SUM(RC[1]:RC[4]) -> 11 | J30: 9 | K30: 0 | L30: 2 | M30: 0 | N30: 126
A31: 3 | B31: 0 | C31: 4 | D31: =SUM(RC[1]:RC[4]) -> 230 | E31: 70 | F31: 160 | G31: 0 | H31: 0 | I31: =SUM(RC[1]:RC[4]) -> 11 | J31: 6 | K31: 5 | L31: 0 | M31: 0 | N31: 165
A32: 4 | B32: 1 | C32: 2 | D32: =SUM(RC[1]:RC[4]) -> 382 | E32: 57 | F32: 98 | G32: 170 | H32: 57 | I32: =SUM(RC[1]:RC[4]) -> 19 | J32: 6 | K32: 4 | L32: 6 | M32: 3 | N32: 33
A33: 5 | B33: 1 | C33: 3 | D33: =SUM(RC[1]:RC[4]) -> 182 | E33: 0 | F33: 62 | G33: 82 | H33: 38 | I33: =SUM(RC[1]:RC[4]) -> 8 | J33: 2 | K33: 4 | L33: 0 | M33: 2 | N33: 76
A34: 6 | B34: 1 | C34: 4 | D34: =SUM(RC[1]:RC[4]) -> 135 | E34: 135 | F34: 0 | G34: 0 | H34: 0 | I34: =SUM(RC[1]:RC[4]) -> 8 | J34: 0 | K34: 8 | L34: 0 | M34: 0 | N34: 115
A35: 7 | B35: 2 | C35: 3 | D35: =SUM(RC[1]:RC[4]) -> 408 | E35: 71 | F35: 102 | G35: 130 | H35: 105 | I35: =SUM(RC[1]:RC[4]) -> 20 | J35: 10 | K35: 4 | L35: 4 | M35: 2 | N35: 43
A36: 8 | B36: 2 | C36: 4 | D36: =SUM(RC[1]:RC[4]) -> 390 | E36: 172 | F36: 146 | G36: 72 | H36: 0 | I36: =SUM(RC[1]:RC[4]) -> 21 | J36: 9 | K36: 10 | L36: 2 | M36: 0 | N36: 82
A37: 9 | B37: 3 | C37: 4 | D37: =SUM(RC[1]:RC[4]) -> 440 | E37: 175 | F37: 117 | G37: 0 | H37: 148 | I37: =SUM(RC[1]:RC[4]) -> 11 | J37: 0 | K37: 3 | L37: 5 | M37: 3 | N37: 39
A38: Total | D38: =SUM(R[-10]C:R[-1]C) -> 3000 | E38: — | F38: — | G38: — | H38: — | I38: =SUM(R[-10]C:R[-1]C) -> 150 | J38: — | K38: — | L38: — | M38: —
A40: Inst. (1-4) | B40: O | C40: D | D40: Number of passengers (person) | E40: Reservation slot 1 | F40: Reservation slot 2 | G40: Reservation slot 3 | H40: Reservation slot 4 | I40: Reservation slot 5 | J40: Reservation slot 6 | K40: Volume of goods (ton) | L40: Reservation slot 1 | M40: Reservation slot 2 | N40: Reservation slot 3 | O40: Reservation slot 4 | P40: Reservation slot 5 | Q40: Reservation slot 6 | R40: Distance by rail
A41: 0 | B41: 0 | C41: 1 | D41: =SUM(RC[1]:RC[6]) -> 244 | E41: 70 | F41: 114 | G41: 0 | H41: 60 | I41: 0 | J41: 0 | K41: =SUM(RC[1]:RC[6]) -> 17 | L41: 5 | M41: 4 | N41: 0 | O41: 5 | P41: 3 | Q41: 0 | R41: 50
A42: 1 | B42: 0 | C42: 2 | D42: =SUM(RC[1]:RC[6]) -> 360 | E42: 177 | F42: 92 | G42: 46 | H42: 45 | I42: 0 | J42: 0 | K42: =SUM(RC[1]:RC[6]) -> 22 | L42: 0 | M42: 10 | N42: 7 | O42: 5 | P42: 0 | Q42: 0 | R42: 83
A43: 2 | B43: 0 | C43: 3 | D43: =SUM(RC[1]:RC[6]) -> 335 | E43: 93 | F43: 86 | G43: 156 | H43: 0 | I43: 0 | J43: 0 | K43: =SUM(RC[1]:RC[6]) -> 0 | L43: 0 | M43: 0 | N43: 0 | O43: 0 | P43: 0 | Q43: 0 | R43: 126
A44: 3 | B44: 0 | C44: 4 | D44: =SUM(RC[1]:RC[6]) -> 0 | E44: 0 | F44: 0 | G44: 0 | H44: 0 | I44: 0 | J44: 0 | K44: =SUM(RC[1]:RC[6]) -> 0 | L44: 0 | M44: 0 | N44: 0 | O44: 0 | P44: 0 | Q44: 0 | R44: 165
A45: 4 | B45: 1 | C45: 2 | D45: =SUM(RC[1]:RC[6]) -> 505 | E45: 45 | F45: 65 | G45: 51 | H45: 62 | I45: 184 | J45: 98 | K45: =SUM(RC[1]:RC[6]) -> 24 | L45: 8 | M45: 8 | N45: 0 | O45: 0 | P45: 4 | Q45: 4 | R45: 33
A46: 5 | B46: 1 | C46: 3 | D46: =SUM(RC[1]:RC[6]) -> 298 | E46: 124 | F46: 64 | G46: 0 | H46: 110 | I46: 0 | J46: 0 | K46: =SUM(RC[1]:RC[6]) -> 16 | L46: 5 | M46: 0 | N46: 6 | O46: 0 | P46: 5 | Q46: 0 | R46: 76
A47: 6 | B47: 1 | C47: 4 | D47: =SUM(RC[1]:RC[6]) -> 0 | E47: 0 | F47: 0 | G47: 0 | H47: 0 | I47: 0 | J47: 0 | K47: =SUM(RC[1]:RC[6]) -> 0 | L47: 0 | M47: 0 | N47: 0 | O47: 0 | P47: 0 | Q47: 0 | R47: 115
A48: 7 | B48: 2 | C48: 3 | D48: =SUM(RC[1]:RC[6]) -> 456 | E48: 75 | F48: 75 | G48: 148 | H48: 0 | I48: 90 | J48: 68 | K48: =SUM(RC[1]:RC[6]) -> 36 | L48: 8 | M48: 0 | N48: 7 | O48: 3 | P48: 10 | Q48: 8 | R48: 43
A49: 8 | B49: 2 | C49: 4 | D49: =SUM(RC[1]:RC[6]) -> 407 | E49: 38 | F49: 150 | G49: 72 | H49: 147 | I49: 0 | J49: 0 | K49: =SUM(RC[1]:RC[6]) -> 31 | L49: 11 | M49: 0 | N49: 2 | O49: 4 | P49: 8 | Q49: 6 | R49: 82
A50: 9 | B50: 3 | C50: 4 | D50: =SUM(RC[1]:RC[6]) -> 395 | E50: 0 | F50: 0 | G50: 90 | H50: 80 | I50: 108 | J50: 117 | K50: =SUM(RC[1]:RC[6]) -> 4 | L50: 0 | M50: 0 | N50: 0 | O50: 0 | P50: 4 | Q50: 0 | R50: 39
A51: Total | D51: =SUM(R[-10]C:R[-1]C) -> 3000 | E51: — | F51: — | G51: — | H51: — | I51: — | J51: — | K51: =SUM(R[-10]C:R[-1]C) -> 150 | L51: — | M51: — | N51: — | O51: — | P51: — | Q51: —

Sheet: Inst. (2-1)~(2-4)
A1: Inst. (2-1) | B1: O | C1: D | D1: Number of passengers (person) | E1: Reservation slot 1 | F1: Reservation slot 2 | G1: Volume of goods (ton) | H1: Reservation slot 1 | I1: Reservation slot 2 | J1: Distance by rail
A2: 0 | B2: 0 | C2: 1 | D2: =SUM(RC[1]:RC[2]) -> 184 | E2: 123 | F2: 61 | G2: =SUM(RC[1]:RC[2]) -> 20 | H2: 13 | I2: 7 | J2: 50
A3: 1 | B3: 0 | C3: 2 | D3: =SUM(RC[1]:RC[2]) -> 206 | E3: 101 | F3: 105 | G3: =SUM(RC[1]:RC[2]) -> 34 | H3: 20 | I3: 14 | J3: 83
A4: 2 | B4: 0 | C4: 3 | D4: =SUM(RC[1]:RC[2]) -> 259 | E4: 95 | F4: 164 | G4: =SUM(RC[1]:RC[2]) -> 15 | H4: 15 | I4: 0 | J4: 126
A5: 3 | B5: 0 | C5: 4 | D5: =SUM(RC[1]:RC[2]) -> 249 | E5: 132 | F5: 117 | G5: =SUM(RC[1]:RC[2]) -> 32 | H5: 11 | I5: 21 | J5: 165
A6: 4 | B6: 1 | C6: 2 | D6: =SUM(RC[1]:RC[2]) -> 192 | E6: 116 | F6: 76 | G6: =SUM(RC[1]:RC[2]) -> 38 | H6: 33 | I6: 5 | J6: 33
A7: 5 | B7: 1 | C7: 3 | D7: =SUM(RC[1]:RC[2]) -> 195 | E7: 95 | F7: 100 | G7: =SUM(RC[1]:RC[2]) -> 32 | H7: 14 | I7: 18 | J7: 76
A8: 6 | B8: 1 | C8: 4 | D8: =SUM(RC[1]:RC[2]) -> 141 | E8: 141 | F8: 0 | G8: =SUM(RC[1]:RC[2]) -> 23 | H8: 0 | I8: 23 | J8: 115
A9: 7 | B9: 2 | C9: 3 | D9: =SUM(RC[1]:RC[2]) -> 264 | E9: 151 | F9: 113 | G9: =SUM(RC[1]:RC[2]) -> 35 | H9: 26 | I9: 9 | J9: 43
A10: 8 | B10: 2 | C10: 4 | D10: =SUM(RC[1]:RC[2]) -> 163 | E10: 115 | F10: 48 | G10: =SUM(RC[1]:RC[2]) -> 39 | H10: 19 | I10: 20 | J10: 82
A11: 9 | B11: 3 | C11: 4 | D11: =SUM(RC[1]:RC[2]) -> 147 | E11: 0 | F11: 147 | G11: =SUM(RC[1]:RC[2]) -> 32 | H11: 20 | I11: 12 | J11: 39
A12: Total | D12: =SUM(R[-10]C:R[-1]C) -> 2000 | E12: — | F12: — | G12: =SUM(R[-10]C:R[-1]C) -> 300 | H12: — | I12: —
A14: Inst. (2-2) | B14: O | C14: D | D14: Number of passengers (person) | E14: Reservation slot 1 | F14: Reservation slot 2 | G14: Reservation slot 3 | H14: Volume of goods (ton) | I14: Reservation slot 1 | J14: Reservation slot 2 | K14: Reservation slot 3 | L14: Distance by rail
A15: 0 | B15: 0 | C15: 1 | D15: =SUM(RC[1]:RC[3]) -> 277 | E15: 123 | F15: 61 | G15: 93 | H15: =SUM(RC[1]:RC[3]) -> 37 | I15: 13 | J15: 7 | K15: 17 | L15: 50
A16: 1 | B16: 0 | C16: 2 | D16: =SUM(RC[1]:RC[3]) -> 335 | E16: 81 | F16: 105 | G16: 149 | H16: =SUM(RC[1]:RC[3]) -> 46 | I16: 20 | J16: 14 | K16: 12 | L16: 83
A17: 2 | B17: 0 | C17: 3 | D17: =SUM(RC[1]:RC[3]) -> 194 | E17: 95 | F17: 99 | G17: 0 | H17: =SUM(RC[1]:RC[3]) -> 20 | I17: 0 | J17: 17 | K17: 3 | L17: 126
A18: 3 | B18: 0 | C18: 4 | D18: =SUM(RC[1]:RC[3]) -> 102 | E18: 0 | F18: 102 | G18: 0 | H18: =SUM(RC[1]:RC[3]) -> 21 | I18: 11 | J18: 10 | K18: 0 | L18: 165
A19: 4 | B19: 1 | C19: 2 | D19: =SUM(RC[1]:RC[3]) -> 263 | E19: 47 | F19: 76 | G19: 140 | H19: =SUM(RC[1]:RC[3]) -> 45 | I19: 33 | J19: 0 | K19: 12 | L19: 33
A20: 5 | B20: 1 | C20: 3 | D20: =SUM(RC[1]:RC[3]) -> 200 | E20: 95 | F20: 0 | G20: 105 | H20: =SUM(RC[1]:RC[3]) -> 16 | I20: 4 | J20: 8 | K20: 4 | L20: 76
A21: 6 | B21: 1 | C21: 4 | D21: =SUM(RC[1]:RC[3]) -> 41 | E21: 0 | F21: 41 | G21: 0 | H21: =SUM(RC[1]:RC[3]) -> 23 | I21: 0 | J21: 23 | K21: 0 | L21: 115
A22: 7 | B22: 2 | C22: 3 | D22: =SUM(RC[1]:RC[3]) -> 261 | E22: 50 | F22: 113 | G22: 98 | H22: =SUM(RC[1]:RC[3]) -> 25 | I22: 6 | J22: 9 | K22: 10 | L22: 43
A23: 8 | B23: 2 | C23: 4 | D23: =SUM(RC[1]:RC[3]) -> 115 | E23: 115 | F23: 0 | G23: 0 | H23: =SUM(RC[1]:RC[3]) -> 48 | I23: 8 | J23: 20 | K23: 20 | L23: 82
A24: 9 | B24: 3 | C24: 4 | D24: =SUM(RC[1]:RC[3]) -> 212 | E24: 0 | F24: 134 | G24: 78 | H24: =SUM(RC[1]:RC[3]) -> 19 | I24: 0 | J24: 12 | K24: 7 | L24: 39
A25: Total | D25: =SUM(R[-10]C:R[-1]C) -> 2000 | E25: — | F25: — | G25: — | H25: =SUM(R[-10]C:R[-1]C) -> 300 | I25: — | J25: — | K25: —
A27: Inst. (2-3) | B27: O | C27: D | D27: Number of passengers (person) | E27: Reservation slot 1 | F27: Reservation slot 2 | G27: Reservation slot 3 | H27: Reservation slot 4 | I27: Volume of goods (ton) | J27: Reservation slot 1 | K27: Reservation slot 2 | L27: Reservation slot 3 | M27: Reservation slot 4 | N27: Distance by rail
A28: 0 | B28: 0 | C28: 1 | D28: =SUM(RC[1]:RC[4]) -> 239 | E28: 101 | F28: 45 | G28: 93 | H28: 0 | I28: =SUM(RC[1]:RC[4]) -> 37 | J28: 13 | K28: 11 | L28: 13 | M28: 0 | N28: 50
A29: 1 | B29: 0 | C29: 2 | D29: =SUM(RC[1]:RC[4]) -> 233 | E29: 70 | F29: 56 | G29: 107 | H29: 0 | I29: =SUM(RC[1]:RC[4]) -> 46 | J29: 20 | K29: 14 | L29: 12 | M29: 0 | N29: 83
A30: 2 | B30: 0 | C30: 3 | D30: =SUM(RC[1]:RC[4]) -> 179 | E30: 69 | F30: 110 | G30: 0 | H30: 0 | I30: =SUM(RC[1]:RC[4]) -> 21 | J30: 18 | K30: 0 | L30: 3 | M30: 0 | N30: 126
A31: 3 | B31: 0 | C31: 4 | D31: =SUM(RC[1]:RC[4]) -> 154 | E31: 47 | F31: 107 | G31: 0 | H31: 0 | I31: =SUM(RC[1]:RC[4]) -> 21 | J31: 11 | K31: 10 | L31: 0 | M31: 0 | N31: 165
A32: 4 | B32: 1 | C32: 2 | D32: =SUM(RC[1]:RC[4]) -> 254 | E32: 38 | F32: 65 | G32: 113 | H32: 38 | I32: =SUM(RC[1]:RC[4]) -> 40 | J32: 13 | K32: 9 | L32: 12 | M32: 6 | N32: 33
A33: 5 | B33: 1 | C33: 3 | D33: =SUM(RC[1]:RC[4]) -> 121 | E33: 0 | F33: 41 | G33: 55 | H33: 25 | I33: =SUM(RC[1]:RC[4]) -> 17 | J33: 5 | K33: 8 | L33: 0 | M33: 4 | N33: 76
A34: 6 | B34: 1 | C34: 4 | D34: =SUM(RC[1]:RC[4]) -> 90 | E34: 90 | F34: 0 | G34: 0 | H34: 0 | I34: =SUM(RC[1]:RC[4]) -> 17 | J34: 0 | K34: 17 | L34: 0 | M34: 0 | N34: 115
A35: 7 | B35: 2 | C35: 3 | D35: =SUM(RC[1]:RC[4]) -> 273 | E35: 48 | F35: 68 | G35: 87 | H35: 70 | I35: =SUM(RC[1]:RC[4]) -> 39 | J35: 19 | K35: 7 | L35: 8 | M35: 5 | N35: 43
A36: 8 | B36: 2 | C36: 4 | D36: =SUM(RC[1]:RC[4]) -> 260 | E36: 115 | F36: 97 | G36: 48 | H36: 0 | I36: =SUM(RC[1]:RC[4]) -> 40 | J36: 18 | K36: 19 | L36: 3 | M36: 0 | N36: 82
A37: 9 | B37: 3 | C37: 4 | D37: =SUM(RC[1]:RC[4]) -> 197 | E37: 20 | F37: 78 | G37: 0 | H37: 99 | I37: =SUM(RC[1]:RC[4]) -> 22 | J37: 0 | K37: 6 | L37: 10 | M37: 6 | N37: 39
A38: Total | D38: =SUM(R[-10]C:R[-1]C) -> 2000 | E38: — | F38: — | G38: — | H38: — | I38: =SUM(R[-10]C:R[-1]C) -> 300 | J38: — | K38: — | L38: — | M38: —
A40: Inst. (2-4) | B40: O | C40: D | D40: Number of passengers (person) | E40: Reservation slot 1 | F40: Reservation slot 2 | G40: Reservation slot 3 | H40: Reservation slot 4 | I40: Reservation slot 5 | J40: Reservation slot 6 | K40: Volume of goods (ton) | L40: Reservation slot 1 | M40: Reservation slot 2 | N40: Reservation slot 3 | O40: Reservation slot 4 | P40: Reservation slot 5 | Q40: Reservation slot 6 | R40: Distance by rail
A41: 0 | B41: 0 | C41: 1 | D41: =SUM(RC[1]:RC[6]) -> 203 | E41: 47 | F41: 76 | G41: 40 | H41: 40 | I41: 0 | J41: 0 | K41: =SUM(RC[1]:RC[6]) -> 24 | L41: 10 | M41: 3 | N41: 0 | O41: 5 | P41: 6 | Q41: 0 | R41: 50
A42: 1 | B42: 0 | C42: 2 | D42: =SUM(RC[1]:RC[6]) -> 240 | E42: 118 | F42: 61 | G42: 31 | H42: 30 | I42: 0 | J42: 0 | K42: =SUM(RC[1]:RC[6]) -> 34 | L42: 0 | M42: 20 | N42: 14 | O42: 0 | P42: 0 | Q42: 0 | R42: 83
A43: 2 | B43: 0 | C43: 3 | D43: =SUM(RC[1]:RC[6]) -> 199 | E43: 62 | F43: 33 | G43: 104 | H43: 0 | I43: 0 | J43: 0 | K43: =SUM(RC[1]:RC[6]) -> 22 | L43: 14 | M43: 0 | N43: 5 | O43: 0 | P43: 3 | Q43: 0 | R43: 126
A44: 3 | B44: 0 | C44: 4 | D44: =SUM(RC[1]:RC[6]) -> 102 | E44: 0 | F44: 0 | G44: 102 | H44: 0 | I44: 0 | J44: 0 | K44: =SUM(RC[1]:RC[6]) -> 24 | L44: 9 | M44: 5 | N44: 3 | O44: 7 | P44: 0 | Q44: 0 | R44: 165
A45: 4 | B45: 1 | C45: 2 | D45: =SUM(RC[1]:RC[6]) -> 293 | E45: 30 | F45: 65 | G45: 34 | H45: 41 | I45: 123 | J45: 0 | K45: =SUM(RC[1]:RC[6]) -> 45 | L45: 17 | M45: 16 | N45: 0 | O45: 5 | P45: 7 | Q45: 0 | R45: 33
A46: 5 | B46: 1 | C46: 3 | D46: =SUM(RC[1]:RC[6]) -> 298 | E46: 83 | F46: 43 | G46: 0 | H46: 73 | I46: 0 | J46: 99 | K46: =SUM(RC[1]:RC[6]) -> 27 | L46: 10 | M46: 0 | N46: 8 | O46: 0 | P46: 9 | Q46: 0 | R46: 76
A47: 6 | B47: 1 | C47: 4 | D47: =SUM(RC[1]:RC[6]) -> 80 | E47: 0 | F47: 0 | G47: 80 | H47: 0 | I47: 0 | J47: 0 | K47: =SUM(RC[1]:RC[6]) -> 23 | L47: 0 | M47: 0 | N47: 13 | O47: 10 | P47: 0 | Q47: 0 | R47: 115
A48: 7 | B48: 2 | C48: 3 | D48: =SUM(RC[1]:RC[6]) -> 224 | E48: 28 | F48: 0 | G48: 0 | H48: 45 | I48: 108 | J48: 43 | K48: =SUM(RC[1]:RC[6]) -> 32 | L48: 0 | M48: 16 | N48: 9 | O48: 0 | P48: 7 | Q48: 0 | R48: 43
A49: 8 | B49: 2 | C49: 4 | D49: =SUM(RC[1]:RC[6]) -> 161 | E49: 15 | F49: 0 | G49: 48 | H49: 98 | I49: 0 | J49: 0 | K49: =SUM(RC[1]:RC[6]) -> 48 | L49: 8 | M49: 0 | N49: 14 | O49: 6 | P49: 20 | Q49: 0 | R49: 82
A50: 9 | B50: 3 | C50: 4 | D50: =SUM(RC[1]:RC[6]) -> 200 | E50: 0 | F50: 0 | G50: 47 | H50: 53 | I50: 0 | J50: 100 | K50: =SUM(RC[1]:RC[6]) -> 21 | L50: 0 | M50: 0 | N50: 5 | O50: 7 | P50: 9 | Q50: 0 | R50: 39
A51: Total | D51: =SUM(R[-10]C:R[-1]C) -> 2000 | E51: — | F51: — | G51: — | H51: — | I51: — | J51: — | K51: =SUM(R[-10]C:R[-1]C) -> 300 | L51: — | M51: — | N51: — | O51: — | P51: — | Q51: —

Sheet: Inst. (3-1)~(3-4)
A1: Inst. (3-1) | B1: O | C1: D | D1: Number of passengers (person) | E1: Reservation slot 1 | F1: Reservation slot 2 | G1: Volume of goods (ton) | H1: Reservation slot 1 | I1: Reservation slot 2 | J1: Distance by rail
A2: 0 | B2: 0 | C2: 1 | D2: =SUM(RC[1]:RC[2]) -> 92 | E2: 62 | F2: 30 | G2: =SUM(RC[1]:RC[2]) -> 30 | H2: 20 | I2: 10 | J2: 50
A3: 1 | B3: 0 | C3: 2 | D3: =SUM(RC[1]:RC[2]) -> 102 | E3: 50 | F3: 52 | G3: =SUM(RC[1]:RC[2]) -> 51 | H3: 30 | I3: 21 | J3: 83
A4: 2 | B4: 0 | C4: 3 | D4: =SUM(RC[1]:RC[2]) -> 130 | E4: 48 | F4: 82 | G4: =SUM(RC[1]:RC[2]) -> 22 | H4: 22 | I4: 0 | J4: 126
A5: 3 | B5: 0 | C5: 4 | D5: =SUM(RC[1]:RC[2]) -> 124 | E5: 66 | F5: 58 | G5: =SUM(RC[1]:RC[2]) -> 48 | H5: 16 | I5: 32 | J5: 165
A6: 4 | B6: 1 | C6: 2 | D6: =SUM(RC[1]:RC[2]) -> 96 | E6: 58 | F6: 38 | G6: =SUM(RC[1]:RC[2]) -> 58 | H6: 50 | I6: 8 | J6: 33
A7: 5 | B7: 1 | C7: 3 | D7: =SUM(RC[1]:RC[2]) -> 98 | E7: 48 | F7: 50 | G7: =SUM(RC[1]:RC[2]) -> 48 | H7: 21 | I7: 27 | J7: 76
A8: 6 | B8: 1 | C8: 4 | D8: =SUM(RC[1]:RC[2]) -> 70 | E8: 70 | F8: 0 | G8: =SUM(RC[1]:RC[2]) -> 34 | H8: 0 | I8: 34 | J8: 115
A9: 7 | B9: 2 | C9: 3 | D9: =SUM(RC[1]:RC[2]) -> 132 | E9: 76 | F9: 56 | G9: =SUM(RC[1]:RC[2]) -> 53 | H9: 39 | I9: 14 | J9: 43
A10: 8 | B10: 2 | C10: 4 | D10: =SUM(RC[1]:RC[2]) -> 82 | E10: 58 | F10: 24 | G10: =SUM(RC[1]:RC[2]) -> 58 | H10: 28 | I10: 30 | J10: 82
A11: 9 | B11: 3 | C11: 4 | D11: =SUM(RC[1]:RC[2]) -> 74 | E11: 0 | F11: 74 | G11: =SUM(RC[1]:RC[2]) -> 48 | H11: 30 | I11: 18 | J11: 39
A12: Total | D12: =SUM(R[-10]C:R[-1]C) -> 1000 | E12: — | F12: — | G12: =SUM(R[-10]C:R[-1]C) -> 450 | H12: — | I12: —
A14: Inst. (3-2) | B14: O | C14: D | D14: Number of passengers (person) | E14: Reservation slot 1 | F14: Reservation slot 2 | G14: Reservation slot 3 | H14: Volume of goods (ton) | I14: Reservation slot 1 | J14: Reservation slot 2 | K14: Reservation slot 3 | L14: Distance by rail
A15: 0 | B15: 0 | C15: 1 | D15: =SUM(RC[1]:RC[3]) -> 138 | E15: 62 | F15: 30 | G15: 46 | H15: =SUM(RC[1]:RC[3]) -> 56 | I15: 20 | J15: 10 | K15: 26 | L15: 50
A16: 1 | B16: 0 | C16: 2 | D16: =SUM(RC[1]:RC[3]) -> 167 | E16: 41 | F16: 52 | G16: 74 | H16: =SUM(RC[1]:RC[3]) -> 69 | I16: 30 | J16: 21 | K16: 18 | L16: 83
A17: 2 | B17: 0 | C17: 3 | D17: =SUM(RC[1]:RC[3]) -> 98 | E17: 48 | F17: 50 | G17: 0 | H17: =SUM(RC[1]:RC[3]) -> 26 | I17: 0 | J17: 26 | K17: 0 | L17: 126
A18: 3 | B18: 0 | C18: 4 | D18: =SUM(RC[1]:RC[3]) -> 51 | E18: 0 | F18: 51 | G18: 0 | H18: =SUM(RC[1]:RC[3]) -> 31 | I18: 16 | J18: 15 | K18: 0 | L18: 165
A19: 4 | B19: 1 | C19: 2 | D19: =SUM(RC[1]:RC[3]) -> 132 | E19: 24 | F19: 38 | G19: 70 | H19: =SUM(RC[1]:RC[3]) -> 68 | I19: 50 | J19: 0 | K19: 18 | L19: 33
A20: 5 | B20: 1 | C20: 3 | D20: =SUM(RC[1]:RC[3]) -> 100 | E20: 48 | F20: 0 | G20: 52 | H20: =SUM(RC[1]:RC[3]) -> 28 | I20: 10 | J20: 12 | K20: 6 | L20: 76
A21: 6 | B21: 1 | C21: 4 | D21: =SUM(RC[1]:RC[3]) -> 20 | E21: 0 | F21: 20 | G21: 0 | H21: =SUM(RC[1]:RC[3]) -> 34 | I21: 0 | J21: 34 | K21: 0 | L21: 115
A22: 7 | B22: 2 | C22: 3 | D22: =SUM(RC[1]:RC[3]) -> 130 | E22: 25 | F22: 56 | G22: 49 | H22: =SUM(RC[1]:RC[3]) -> 38 | I22: 9 | J22: 14 | K22: 15 | L22: 43
A23: 8 | B23: 2 | C23: 4 | D23: =SUM(RC[1]:RC[3]) -> 58 | E23: 58 | F23: 0 | G23: 0 | H23: =SUM(RC[1]:RC[3]) -> 72 | I23: 12 | J23: 30 | K23: 30 | L23: 82
A24: 9 | B24: 3 | C24: 4 | D24: =SUM(RC[1]:RC[3]) -> 106 | E24: 0 | F24: 67 | G24: 39 | H24: =SUM(RC[1]:RC[3]) -> 28 | I24: 0 | J24: 18 | K24: 10 | L24: 39
A25: Total | D25: =SUM(R[-10]C:R[-1]C) -> 1000 | E25: — | F25: — | G25: — | H25: =SUM(R[-10]C:R[-1]C) -> 450 | I25: — | J25: — | K25: —
A27: Inst. (3-3) | B27: O | C27: D | D27: Number of passengers (person) | E27: Reservation slot 1 | F27: Reservation slot 2 | G27: Reservation slot 3 | H27: Reservation slot 4 | I27: Volume of goods (ton) | J27: Reservation slot 1 | K27: Reservation slot 2 | L27: Reservation slot 3 | M27: Reservation slot 4 | N27: Distance by rail
A28: 0 | B28: 0 | C28: 1 | D28: =SUM(RC[1]:RC[4]) -> 118 | E28: 50 | F28: 22 | G28: 46 | H28: 0 | I28: =SUM(RC[1]:RC[4]) -> 56 | J28: 20 | K28: 16 | L28: 20 | M28: 0 | N28: 50
A29: 1 | B29: 0 | C29: 2 | D29: =SUM(RC[1]:RC[4]) -> 117 | E29: 35 | F29: 28 | G29: 54 | H29: 0 | I29: =SUM(RC[1]:RC[4]) -> 69 | J29: 30 | K29: 21 | L29: 18 | M29: 0 | N29: 83
A30: 2 | B30: 0 | C30: 3 | D30: =SUM(RC[1]:RC[4]) -> 89 | E30: 34 | F30: 55 | G30: 0 | H30: 0 | I30: =SUM(RC[1]:RC[4]) -> 31 | J30: 27 | K30: 0 | L30: 4 | M30: 0 | N30: 126
A31: 3 | B31: 0 | C31: 4 | D31: =SUM(RC[1]:RC[4]) -> 79 | E31: 25 | F31: 54 | G31: 0 | H31: 0 | I31: =SUM(RC[1]:RC[4]) -> 31 | J31: 16 | K31: 15 | L31: 0 | M31: 0 | N31: 165
A32: 4 | B32: 1 | C32: 2 | D32: =SUM(RC[1]:RC[4]) -> 126 | E32: 19 | F32: 32 | G32: 56 | H32: 19 | I32: =SUM(RC[1]:RC[4]) -> 61 | J32: 20 | K32: 14 | L32: 18 | M32: 9 | N32: 33
A33: 5 | B33: 1 | C33: 3 | D33: =SUM(RC[1]:RC[4]) -> 60 | E33: 0 | F33: 20 | G33: 28 | H33: 12 | I33: =SUM(RC[1]:RC[4]) -> 26 | J33: 8 | K33: 12 | L33: 0 | M33: 6 | N33: 76
A34: 6 | B34: 1 | C34: 4 | D34: =SUM(RC[1]:RC[4]) -> 45 | E34: 45 | F34: 0 | G34: 0 | H34: 0 | I34: =SUM(RC[1]:RC[4]) -> 26 | J34: 0 | K34: 26 | L34: 0 | M34: 0 | N34: 115
A35: 7 | B35: 2 | C35: 3 | D35: =SUM(RC[1]:RC[4]) -> 137 | E35: 24 | F35: 34 | G35: 44 | H35: 35 | I35: =SUM(RC[1]:RC[4]) -> 58 | J35: 28 | K35: 10 | L35: 12 | M35: 8 | N35: 43
A36: 8 | B36: 2 | C36: 4 | D36: =SUM(RC[1]:RC[4]) -> 130 | E36: 58 | F36: 48 | G36: 24 | H36: 0 | I36: =SUM(RC[1]:RC[4]) -> 59 | J36: 27 | K36: 28 | L36: 4 | M36: 0 | N36: 82
A37: 9 | B37: 3 | C37: 4 | D37: =SUM(RC[1]:RC[4]) -> 99 | E37: 10 | F37: 39 | G37: 0 | H37: 50 | I37: =SUM(RC[1]:RC[4]) -> 33 | J37: 0 | K37: 9 | L37: 15 | M37: 9 | N37: 39
A38: Total | D38: =SUM(R[-10]C:R[-1]C) -> 1000 | E38: — | F38: — | G38: — | H38: — | I38: =SUM(R[-10]C:R[-1]C) -> 450 | J38: — | K38: — | L38: — | M38: —
A40: Inst. (3-4) | B40: O | C40: D | D40: Number of passengers (person) | E40: Reservation slot 1 | F40: Reservation slot 2 | G40: Reservation slot 3 | H40: Reservation slot 4 | I40: Reservation slot 5 | J40: Reservation slot 6 | K40: Volume of goods (ton) | L40: Reservation slot 1 | M40: Reservation slot 2 | N40: Reservation slot 3 | O40: Reservation slot 4 | P40: Reservation slot 5 | Q40: Reservation slot 6 | R40: Distance by rail
A41: 0 | B41: 0 | C41: 1 | D41: =SUM(RC[1]:RC[6]) -> 134 | E41: 57 | F41: 38 | G41: 0 | H41: 39 | I41: 0 | J41: 0 | K41: =SUM(RC[1]:RC[6]) -> 41 | L41: 20 | M41: 13 | N41: 0 | O41: 8 | P41: 0 | Q41: 0 | R41: 50
A42: 1 | B42: 0 | C42: 2 | D42: =SUM(RC[1]:RC[6]) -> 120 | E42: 59 | F42: 30 | G42: 16 | H42: 15 | I42: 0 | J42: 0 | K42: =SUM(RC[1]:RC[6]) -> 66 | L42: 0 | M42: 30 | N42: 21 | O42: 15 | P42: 0 | Q42: 0 | R42: 83
A43: 2 | B43: 0 | C43: 3 | D43: =SUM(RC[1]:RC[6]) -> 0 | E43: 0 | F43: 0 | G43: 0 | H43: 0 | I43: 0 | J43: 0 | K43: =SUM(RC[1]:RC[6]) -> 28 | L43: 10 | M43: 0 | N43: 8 | O43: 10 | P43: 0 | Q43: 0 | R43: 126
A44: 3 | B44: 0 | C44: 4 | D44: =SUM(RC[1]:RC[6]) -> 0 | E44: 0 | F44: 0 | G44: 0 | H44: 0 | I44: 0 | J44: 0 | K44: =SUM(RC[1]:RC[6]) -> 0 | L44: 0 | M44: 0 | N44: 0 | O44: 0 | P44: 0 | Q44: 0 | R44: 165
A45: 4 | B45: 1 | C45: 2 | D45: =SUM(RC[1]:RC[6]) -> 159 | E45: 45 | F45: 15 | G45: 62 | H45: 20 | I45: 17 | J45: 0 | K45: =SUM(RC[1]:RC[6]) -> 60 | L45: 26 | M45: 24 | N45: 0 | O45: 0 | P45: 10 | Q45: 0 | R45: 33
A46: 5 | B46: 1 | C46: 3 | D46: =SUM(RC[1]:RC[6]) -> 129 | E46: 42 | F46: 51 | G46: 0 | H46: 36 | I46: 0 | J46: 0 | K46: =SUM(RC[1]:RC[6]) -> 27 | L46: 15 | M46: 0 | N46: 12 | O46: 0 | P46: 0 | Q46: 0 | R46: 76
A47: 6 | B47: 1 | C47: 4 | D47: =SUM(RC[1]:RC[6]) -> 0 | E47: 0 | F47: 0 | G47: 0 | H47: 0 | I47: 0 | J47: 0 | K47: =SUM(RC[1]:RC[6]) -> 0 | L47: 0 | M47: 0 | N47: 0 | O47: 0 | P47: 0 | Q47: 0 | R47: 115
A48: 7 | B48: 2 | C48: 3 | D48: =SUM(RC[1]:RC[6]) -> 173 | E48: 25 | F48: 32 | G48: 50 | H48: 0 | I48: 30 | J48: 36 | K48: =SUM(RC[1]:RC[6]) -> 104 | L48: 28 | M48: 0 | N48: 21 | O48: 9 | P48: 30 | Q48: 16 | R48: 43
A49: 8 | B49: 2 | C49: 4 | D49: =SUM(RC[1]:RC[6]) -> 135 | E49: 12 | F49: 50 | G49: 24 | H49: 49 | I49: 0 | J49: 0 | K49: =SUM(RC[1]:RC[6]) -> 97 | L49: 33 | M49: 0 | N49: 14 | O49: 10 | P49: 22 | Q49: 18 | R49: 82
A50: 9 | B50: 3 | C50: 4 | D50: =SUM(RC[1]:RC[6]) -> 150 | E50: 0 | F50: 0 | G50: 30 | H50: 45 | I50: 36 | J50: 39 | K50: =SUM(RC[1]:RC[6]) -> 27 | L50: 9 | M50: 0 | N50: 0 | O50: 0 | P50: 10 | Q50: 8 | R50: 39
A51: Total | D51: =SUM(R[-10]C:R[-1]C) -> 1000 | E51: — | F51: — | G51: — | H51: — | I51: — | J51: — | K51: =SUM(R[-10]C:R[-1]C) -> 450 | L51: — | M51: — | N51: — | O51: — | P51: — | Q51: —

Sheet: Time slot length 30~180
A1: 180min | B1: O | C1: D | D1: Number of passengers (person) | E1: Reservation slot 1 | F1: Volume of goods (ton) | G1: Reservation slot 1 | H1: Distance by rail
A2: 0 | B2: 0 | C2: 1 | D2: =SUM(RC[1]) -> 184 | E2: 184 | F2: =SUM(RC[1]) -> 20 | G2: 20 | H2: 50
A3: 1 | B3: 0 | C3: 2 | D3: =SUM(RC[1]) -> 206 | E3: 206 | F3: =SUM(RC[1]) -> 34 | G3: 34 | H3: 83
A4: 2 | B4: 0 | C4: 3 | D4: =SUM(RC[1]) -> 259 | E4: 259 | F4: =SUM(RC[1]) -> 15 | G4: 15 | H4: 126
A5: 3 | B5: 0 | C5: 4 | D5: =SUM(RC[1]) -> 249 | E5: 249 | F5: =SUM(RC[1]) -> 32 | G5: 32 | H5: 165
A6: 4 | B6: 1 | C6: 2 | D6: =SUM(RC[1]) -> 192 | E6: 192 | F6: =SUM(RC[1]) -> 38 | G6: 38 | H6: 33
A7: 5 | B7: 1 | C7: 3 | D7: =SUM(RC[1]) -> 195 | E7: 195 | F7: =SUM(RC[1]) -> 32 | G7: 32 | H7: 76
A8: 6 | B8: 1 | C8: 4 | D8: =SUM(RC[1]) -> 141 | E8: 141 | F8: =SUM(RC[1]) -> 23 | G8: 23 | H8: 115
A9: 7 | B9: 2 | C9: 3 | D9: =SUM(RC[1]) -> 264 | E9: 264 | F9: =SUM(RC[1]) -> 35 | G9: 35 | H9: 43
A10: 8 | B10: 2 | C10: 4 | D10: =SUM(RC[1]) -> 163 | E10: 163 | F10: =SUM(RC[1]) -> 39 | G10: 39 | H10: 82
A11: 9 | B11: 3 | C11: 4 | D11: =SUM(RC[1]) -> 147 | E11: 147 | F11: =SUM(RC[1]) -> 32 | G11: 32 | H11: 39
A12: Total | D12: =SUM(R[-10]C:R[-1]C) -> 2000 | E12: — | F12: =SUM(R[-10]C:R[-1]C) -> 300 | G12: —
A14: 90min | B14: O | C14: D | D14: Number of passengers (person) | E14: Reservation slot 1 | F14: Reservation slot 2 | G14: Volume of goods (ton) | H14: Reservation slot 1 | I14: Reservation slot 2 | J14: Distance by rail
A15: 0 | B15: 0 | C15: 1 | D15: =SUM(RC[1]:RC[2]) -> 184 | E15: 123 | F15: 61 | G15: =SUM(RC[1]:RC[2]) -> 20 | H15: 13 | I15: 7 | J15: 50
A16: 1 | B16: 0 | C16: 2 | D16: =SUM(RC[1]:RC[2]) -> 206 | E16: 101 | F16: 105 | G16: =SUM(RC[1]:RC[2]) -> 34 | H16: 20 | I16: 14 | J16: 83
A17: 2 | B17: 0 | C17: 3 | D17: =SUM(RC[1]:RC[2]) -> 259 | E17: 95 | F17: 164 | G17: =SUM(RC[1]:RC[2]) -> 15 | H17: 15 | I17: 0 | J17: 126
A18: 3 | B18: 0 | C18: 4 | D18: =SUM(RC[1]:RC[2]) -> 249 | E18: 132 | F18: 117 | G18: =SUM(RC[1]:RC[2]) -> 32 | H18: 11 | I18: 21 | J18: 165
A19: 4 | B19: 1 | C19: 2 | D19: =SUM(RC[1]:RC[2]) -> 192 | E19: 116 | F19: 76 | G19: =SUM(RC[1]:RC[2]) -> 38 | H19: 33 | I19: 5 | J19: 33
A20: 5 | B20: 1 | C20: 3 | D20: =SUM(RC[1]:RC[2]) -> 195 | E20: 95 | F20: 100 | G20: =SUM(RC[1]:RC[2]) -> 32 | H20: 14 | I20: 18 | J20: 76
A21: 6 | B21: 1 | C21: 4 | D21: =SUM(RC[1]:RC[2]) -> 141 | E21: 141 | F21: 0 | G21: =SUM(RC[1]:RC[2]) -> 23 | H21: 0 | I21: 23 | J21: 115
A22: 7 | B22: 2 | C22: 3 | D22: =SUM(RC[1]:RC[2]) -> 264 | E22: 151 | F22: 113 | G22: =SUM(RC[1]:RC[2]) -> 35 | H22: 26 | I22: 9 | J22: 43
A23: 8 | B23: 2 | C23: 4 | D23: =SUM(RC[1]:RC[2]) -> 163 | E23: 115 | F23: 48 | G23: =SUM(RC[1]:RC[2]) -> 39 | H23: 19 | I23: 20 | J23: 82
A24: 9 | B24: 3 | C24: 4 | D24: =SUM(RC[1]:RC[2]) -> 147 | E24: 0 | F24: 147 | G24: =SUM(RC[1]:RC[2]) -> 32 | H24: 20 | I24: 12 | J24: 39
A25: Total | D25: =SUM(R[-10]C:R[-1]C) -> 2000 | E25: — | F25: — | G25: =SUM(R[-10]C:R[-1]C) -> 300 | H25: — | I25: —
A27: 60min | B27: O | C27: D | D27: Number of passengers (person) | E27: Reservation slot 1 | F27: Reservation slot 2 | G27: Reservation slot 3 | H27: Volume of goods (ton) | I27: Reservation slot 1 | J27: Reservation slot 2 | K27: Reservation slot 3 | L27: Distance by rail
A28: 0 | B28: 0 | C28: 1 | D28: =SUM(RC[1]:RC[3]) -> 277 | E28: 123 | F28: 61 | G28: 93 | H28: =SUM(RC[1]:RC[3]) -> 37 | I28: 13 | J28: 7 | K28: 17 | L28: 50
A29: 1 | B29: 0 | C29: 2 | D29: =SUM(RC[1]:RC[3]) -> 335 | E29: 81 | F29: 105 | G29: 149 | H29: =SUM(RC[1]:RC[3]) -> 46 | I29: 20 | J29: 14 | K29: 12 | L29: 83
A30: 2 | B30: 0 | C30: 3 | D30: =SUM(RC[1]:RC[3]) -> 194 | E30: 95 | F30: 99 | G30: 0 | H30: =SUM(RC[1]:RC[3]) -> 20 | I30: 0 | J30: 17 | K30: 3 | L30: 126
A31: 3 | B31: 0 | C31: 4 | D31: =SUM(RC[1]:RC[3]) -> 102 | E31: 0 | F31: 102 | G31: 0 | H31: =SUM(RC[1]:RC[3]) -> 21 | I31: 11 | J31: 10 | K31: 0 | L31: 165
A32: 4 | B32: 1 | C32: 2 | D32: =SUM(RC[1]:RC[3]) -> 263 | E32: 47 | F32: 76 | G32: 140 | H32: =SUM(RC[1]:RC[3]) -> 45 | I32: 33 | J32: 0 | K32: 12 | L32: 33
A33: 5 | B33: 1 | C33: 3 | D33: =SUM(RC[1]:RC[3]) -> 200 | E33: 95 | F33: 0 | G33: 105 | H33: =SUM(RC[1]:RC[3]) -> 16 | I33: 4 | J33: 8 | K33: 4 | L33: 76
A34: 6 | B34: 1 | C34: 4 | D34: =SUM(RC[1]:RC[3]) -> 41 | E34: 0 | F34: 41 | G34: 0 | H34: =SUM(RC[1]:RC[3]) -> 23 | I34: 0 | J34: 23 | K34: 0 | L34: 115
A35: 7 | B35: 2 | C35: 3 | D35: =SUM(RC[1]:RC[3]) -> 261 | E35: 50 | F35: 113 | G35: 98 | H35: =SUM(RC[1]:RC[3]) -> 25 | I35: 6 | J35: 9 | K35: 10 | L35: 43
A36: 8 | B36: 2 | C36: 4 | D36: =SUM(RC[1]:RC[3]) -> 115 | E36: 115 | F36: 0 | G36: 0 | H36: =SUM(RC[1]:RC[3]) -> 48 | I36: 8 | J36: 20 | K36: 20 | L36: 82
A37: 9 | B37: 3 | C37: 4 | D37: =SUM(RC[1]:RC[3]) -> 212 | E37: 0 | F37: 134 | G37: 78 | H37: =SUM(RC[1]:RC[3]) -> 19 | I37: 0 | J37: 12 | K37: 7 | L37: 39
A38: Total | D38: =SUM(R[-10]C:R[-1]C) -> 2000 | E38: — | F38: — | G38: — | H38: =SUM(R[-10]C:R[-1]C) -> 300 | I38: — | J38: — | K38: —
A40: 45min | B40: O | C40: D | D40: Number of passengers (person) | E40: Reservation slot 1 | F40: Reservation slot 2 | G40: Reservation slot 3 | H40: Reservation slot 4 | I40: Volume of goods (ton) | J40: Reservation slot 1 | K40: Reservation slot 2 | L40: Reservation slot 3 | M40: Reservation slot 4 | N40: Distance by rail
A41: 0 | B41: 0 | C41: 1 | D41: =SUM(RC[1]:RC[4]) -> 239 | E41: 101 | F41: 45 | G41: 93 | H41: 0 | I41: =SUM(RC[1]:RC[4]) -> 37 | J41: 13 | K41: 11 | L41: 13 | M41: 0 | N41: 50
A42: 1 | B42: 0 | C42: 2 | D42: =SUM(RC[1]:RC[4]) -> 233 | E42: 70 | F42: 56 | G42: 107 | H42: 0 | I42: =SUM(RC[1]:RC[4]) -> 46 | J42: 20 | K42: 14 | L42: 12 | M42: 0 | N42: 83
A43: 2 | B43: 0 | C43: 3 | D43: =SUM(RC[1]:RC[4]) -> 179 | E43: 69 | F43: 110 | G43: 0 | H43: 0 | I43: =SUM(RC[1]:RC[4]) -> 21 | J43: 18 | K43: 0 | L43: 3 | M43: 0 | N43: 126
A44: 3 | B44: 0 | C44: 4 | D44: =SUM(RC[1]:RC[4]) -> 154 | E44: 47 | F44: 107 | G44: 0 | H44: 0 | I44: =SUM(RC[1]:RC[4]) -> 21 | J44: 11 | K44: 10 | L44: 0 | M44: 0 | N44: 165
A45: 4 | B45: 1 | C45: 2 | D45: =SUM(RC[1]:RC[4]) -> 254 | E45: 38 | F45: 65 | G45: 113 | H45: 38 | I45: =SUM(RC[1]:RC[4]) -> 40 | J45: 13 | K45: 9 | L45: 12 | M45: 6 | N45: 33
A46: 5 | B46: 1 | C46: 3 | D46: =SUM(RC[1]:RC[4]) -> 121 | E46: 0 | F46: 41 | G46: 55 | H46: 25 | I46: =SUM(RC[1]:RC[4]) -> 17 | J46: 5 | K46: 8 | L46: 0 | M46: 4 | N46: 76
A47: 6 | B47: 1 | C47: 4 | D47: =SUM(RC[1]:RC[4]) -> 90 | E47: 90 | F47: 0 | G47: 0 | H47: 0 | I47: =SUM(RC[1]:RC[4]) -> 17 | J47: 0 | K47: 17 | L47: 0 | M47: 0 | N47: 115
A48: 7 | B48: 2 | C48: 3 | D48: =SUM(RC[1]:RC[4]) -> 273 | E48: 48 | F48: 68 | G48: 87 | H48: 70 | I48: =SUM(RC[1]:RC[4]) -> 39 | J48: 19 | K48: 7 | L48: 8 | M48: 5 | N48: 43
A49: 8 | B49: 2 | C49: 4 | D49: =SUM(RC[1]:RC[4]) -> 260 | E49: 115 | F49: 97 | G49: 48 | H49: 0 | I49: =SUM(RC[1]:RC[4]) -> 40 | J49: 18 | K49: 19 | L49: 3 | M49: 0 | N49: 82
A50: 9 | B50: 3 | C50: 4 | D50: =SUM(RC[1]:RC[4]) -> 197 | E50: 20 | F50: 78 | G50: 0 | H50: 99 | I50: =SUM(RC[1]:RC[4]) -> 22 | J50: 0 | K50: 6 | L50: 10 | M50: 6 | N50: 39
A51: Total | D51: =SUM(R[-10]C:R[-1]C) -> 2000 | E51: — | F51: — | G51: — | H51: — | I51: =SUM(R[-10]C:R[-1]C) -> 300 | J51: — | K51: — | L51: — | M51: —
A53: 36min | B53: O | C53: D | D53: Number of passengers (person) | E53: Reservation slot 1 | F53: Reservation slot 2 | G53: Reservation slot 3 | H53: Reservation slot 4 | I53: Reservation slot 5 | J53: Volume of goods (ton) | K53: Reservation slot 1 | L53: Reservation slot 2 | M53: Reservation slot 3 | N53: Reservation slot 4 | O53: Reservation slot 5 | P53: Distance by rail
A54: 0 | B54: 0 | C54: 1 | D54: =SUM(RC[1]:RC[5]) -> 144 | E54: 57 | F54: 38 | G54: 0 | H54: 49 | I54: 0 | J54: =SUM(RC[1]:RC[5]) -> 18 | K54: 10 | L54: 3 | M54: 0 | N54: 5 | O54: 0 | P54: 50
A55: 1 | B55: 0 | C55: 2 | D55: =SUM(RC[1]:RC[5]) -> 328 | E55: 118 | F55: 61 | G55: 109 | H55: 40 | I55: 0 | J55: =SUM(RC[1]:RC[5]) -> 56 | K55: 12 | L55: 20 | M55: 14 | N55: 10 | O55: 0 | P55: 83
A56: 2 | B56: 0 | C56: 3 | D56: =SUM(RC[1]:RC[5]) -> 237 | E56: 62 | F56: 71 | G56: 104 | H56: 0 | I56: 0 | J56: =SUM(RC[1]:RC[5]) -> 19 | K56: 7 | L56: 0 | M56: 12 | N56: 0 | O56: 0 | P56: 126
A57: 3 | B57: 0 | C57: 4 | D57: =SUM(RC[1]:RC[5]) -> 0 | E57: 0 | F57: 0 | G57: 0 | H57: 0 | I57: 0 | J57: =SUM(RC[1]:RC[5]) -> 0 | K57: 0 | L57: 0 | M57: 0 | N57: 0 | O57: 0 | P57: 165
A58: 4 | B58: 1 | C58: 2 | D58: =SUM(RC[1]:RC[5]) -> 237 | E58: 39 | F58: 0 | G58: 34 | H58: 41 | I58: 123 | J58: =SUM(RC[1]:RC[5]) -> 45 | K58: 17 | L58: 16 | M58: 0 | N58: 5 | O58: 7 | P58: 33
A59: 5 | B59: 1 | C59: 3 | D59: =SUM(RC[1]:RC[5]) -> 264 | E59: 83 | F59: 43 | G59: 0 | H59: 73 | I59: 65 | J59: =SUM(RC[1]:RC[5]) -> 30 | K59: 10 | L59: 20 | M59: 0 | N59: 0 | O59: 0 | P59: 76
A60: 6 | B60: 1 | C60: 4 | D60: =SUM(RC[1]:RC[5]) -> 0 | E60: 0 | F60: 0 | G60: 0 | H60: 0 | I60: 0 | J60: =SUM(RC[1]:RC[5]) -> 15 | K60: 15 | L60: 0 | M60: 0 | N60: 0 | O60: 0 | P60: 115
A61: 7 | B61: 2 | C61: 3 | D61: =SUM(RC[1]:RC[5]) -> 254 | E61: 95 | F61: 0 | G61: 99 | H61: 0 | I61: 60 | J61: =SUM(RC[1]:RC[5]) -> 58 | K61: 13 | L61: 0 | M61: 22 | N61: 16 | O61: 7 | P61: 43
A62: 8 | B62: 2 | C62: 4 | D62: =SUM(RC[1]:RC[5]) -> 351 | E62: 105 | F62: 100 | G62: 48 | H62: 98 | I62: 0 | J62: =SUM(RC[1]:RC[5]) -> 26 | K62: 0 | L62: 0 | M62: 20 | N62: 6 | O62: 0 | P62: 82
A63: 9 | B63: 3 | C63: 4 | D63: =SUM(RC[1]:RC[5]) -> 185 | E63: 0 | F63: 0 | G63: 60 | H63: 53 | I63: 72 | J63: =SUM(RC[1]:RC[5]) -> 33 | K63: 0 | L63: 0 | M63: 5 | N63: 13 | O63: 15 | P63: 39
A64: Total | D64: =SUM(R[-10]C:R[-1]C) -> 2000 | E64: — | F64: — | G64: — | H64: — | I64: — | J64: =SUM(R[-10]C:R[-1]C) -> 300 | K64: — | L64: — | M64: — | N64: — | O64: —
A66: 30min | B66: O | C66: D | D66: Number of passengers (person) | E66: Reservation slot 1 | F66: Reservation slot 2 | G66: Reservation slot 3 | H66: Reservation slot 4 | I66: Reservation slot 5 | J66: Reservation slot 6 | K66: Volume of goods (ton) | L66: Reservation slot 1 | M66: Reservation slot 2 | N66: Reservation slot 3 | O66: Reservation slot 4 | P66: Reservation slot 5 | Q66: Reservation slot 6 | R66: Distance by rail
A67: 0 | B67: 0 | C67: 1 | D67: =SUM(RC[1]:RC[6]) -> 203 | E67: 47 | F67: 76 | G67: 40 | H67: 40 | I67: 0 | J67: 0 | K67: =SUM(RC[1]:RC[6]) -> 24 | L67: 10 | M67: 3 | N67: 0 | O67: 5 | P67: 6 | Q67: 0 | R67: 50
A68: 1 | B68: 0 | C68: 2 | D68: =SUM(RC[1]:RC[6]) -> 240 | E68: 118 | F68: 61 | G68: 31 | H68: 30 | I68: 0 | J68: 0 | K68: =SUM(RC[1]:RC[6]) -> 34 | L68: 0 | M68: 20 | N68: 14 | O68: 0 | P68: 0 | Q68: 0 | R68: 83
A69: 2 | B69: 0 | C69: 3 | D69: =SUM(RC[1]:RC[6]) -> 199 | E69: 62 | F69: 33 | G69: 104 | H69: 0 | I69: 0 | J69: 0 | K69: =SUM(RC[1]:RC[6]) -> 22 | L69: 14 | M69: 0 | N69: 5 | O69: 0 | P69: 3 | Q69: 0 | R69: 126
A70: 3 | B70: 0 | C70: 4 | D70: =SUM(RC[1]:RC[6]) -> 102 | E70: 0 | F70: 0 | G70: 102 | H70: 0 | I70: 0 | J70: 0 | K70: =SUM(RC[1]:RC[6]) -> 24 | L70: 9 | M70: 5 | N70: 3 | O70: 7 | P70: 0 | Q70: 0 | R70: 165
A71: 4 | B71: 1 | C71: 2 | D71: =SUM(RC[1]:RC[6]) -> 293 | E71: 30 | F71: 65 | G71: 34 | H71: 41 | I71: 123 | J71: 0 | K71: =SUM(RC[1]:RC[6]) -> 45 | L71: 17 | M71: 16 | N71: 0 | O71: 5 | P71: 7 | Q71: 0 | R71: 33
A72: 5 | B72: 1 | C72: 3 | D72: =SUM(RC[1]:RC[6]) -> 298 | E72: 83 | F72: 43 | G72: 0 | H72: 73 | I72: 0 | J72: 99 | K72: =SUM(RC[1]:RC[6]) -> 27 | L72: 10 | M72: 0 | N72: 8 | O72: 0 | P72: 9 | Q72: 0 | R72: 76
A73: 6 | B73: 1 | C73: 4 | D73: =SUM(RC[1]:RC[6]) -> 80 | E73: 0 | F73: 0 | G73: 80 | H73: 0 | I73: 0 | J73: 0 | K73: =SUM(RC[1]:RC[6]) -> 23 | L73: 0 | M73: 0 | N73: 13 | O73: 10 | P73: 0 | Q73: 0 | R73: 115
A74: 7 | B74: 2 | C74: 3 | D74: =SUM(RC[1]:RC[6]) -> 224 | E74: 28 | F74: 0 | G74: 0 | H74: 45 | I74: 108 | J74: 43 | K74: =SUM(RC[1]:RC[6]) -> 32 | L74: 0 | M74: 16 | N74: 9 | O74: 0 | P74: 7 | Q74: 0 | R74: 43
A75: 8 | B75: 2 | C75: 4 | D75: =SUM(RC[1]:RC[6]) -> 161 | E75: 15 | F75: 0 | G75: 48 | H75: 98 | I75: 0 | J75: 0 | K75: =SUM(RC[1]:RC[6]) -> 48 | L75: 8 | M75: 0 | N75: 14 | O75: 6 | P75: 20 | Q75: 0 | R75: 82
A76: 9 | B76: 3 | C76: 4 | D76: =SUM(RC[1]:RC[6]) -> 200 | E76: 0 | F76: 0 | G76: 47 | H76: 53 | I76: 0 | J76: 100 | K76: =SUM(RC[1]:RC[6]) -> 21 | L76: 0 | M76: 0 | N76: 5 | O76: 7 | P76: 9 | Q76: 0 | R76: 39
A77: Total | D77: =SUM(R[-10]C:R[-1]C) -> 2000 | E77: — | F77: — | G77: — | H77: — | I77: — | J77: — | K77: =SUM(R[-10]C:R[-1]C) -> 300 | L77: — | M77: — | N77: — | O77: — | P77: — | Q77: —

Sheet: Parameters for small-scale
A1: Parameter | B1: Meaning | C1: Value
B2: Fixed costs of operating a train in m mode, €/ train. | C2: [6000, 5000, 5000, 6000, 6500]
B3: Variable costs of operating a train in m mode, €/ train · km. | C3: [10, 10, 10, 10, 10]
B4: Dwell costs for a train in m mode, €/ train · time. | C4: [600, 500, 500, 600, 650]
B5: Maximum passenger capacity of train k in mode m, person. | C5: [0, 560, 490, 280, 280]
B6: Maximum freight capacity of train k in mode m, ton. | C6: [80, 1, 5, 20, 40]
B7: Earliest departure time of any train from its origin station. | C7: 0
B8: Latest arrival time of any train at its destination station. | C8: 240
B9: Arrival headway between two adjacent trains that arrive at the same station, min. | C9: 5
B10: Departure headway between two adjacent trains that depart from the same station, min. | C10: 5
B11: Departure headway between two adjacent trains at the same origin, min. | C11: 5
B12: Maximum number of times a high-class train can overtake other trains. | C12: 3
B13: Maximum number of times a higher-class train can be overtaken. | C13: 3
B14: Maximum number of times a low-class train can overtake other trains. | C14: 2
B15: Maximum number of times a lower-class train can be overtaken. | C15: 2
B16: Maximum number of stops for a train. | C16: 5
B17: Maximum number of trains that can stop at the same station. | C17: 5
B18: Maximum dwell time of train k at station i, min. | C18: 20
B19: Minimum dwell time of passenger train at station i, min. | C19: 5
B20: Minimum dwell time of freight train at station i, min. | C20: 10
B21: Minimum dwell time of combined train at station i, min. | C21: 8
B22: Average running speed of passenger train, km/h. | C22: 300
B23: Average running speed of freight train, km/h. | C23: 200
B24: Average running speed of combined train, km/h. | C24: 250

Sheet: Hefei-Nanjing
B1: O | C1: D | D1: Number of passengers (person) | E1: Reservation slot 1 | F1: Reservation slot 2 | G1: Reservation slot 3 | H1: Reservation slot 4 | I1: Volume of goods (ton) | J1: Reservation slot 1 | K1: Reservation slot 2 | L1: Reservation slot 3 | M1: Reservation slot 4 | N1: Distance by rail | O1: Station No. | P1: Station name | Q1: Section distance
A2: 0 | B2: 0 | C2: 1 | D2: 558 | E2: 170 | F2: 175 | G2: 213 | H2: 0 | I2: 52 | J2: 13 | K2: 20 | L2: 19 | M2: 0 | N2: 37 | O2: 0 | P2: Hefei South
A3: 1 | B3: 0 | C3: 2 | D3: 279 | E3: 169 | F3: 110 | G3: 0 | H3: 0 | I3: 50 | J3: 20 | K3: 18 | L3: 12 | M3: 0 | N3: 81 | O3: 1 | P3: Feidong | Q3: 37
A4: 2 | B4: 0 | C4: 3 | D4: 810 | E4: 275 | F4: 256 | G4: 279 | H4: 0 | I4: 51 | J4: 18 | K4: 16 | L4: 17 | M4: 0 | N4: 156 | O4: 2 | P4: Quanjiao | Q4: 44
A5: 4 | B5: 1 | C5: 2 | D5: 595 | E5: 202 | F5: 0 | G5: 155 | H5: 238 | I5: 41 | J5: 13 | K5: 0 | L5: 12 | M5: 16 | N5: 44 | O5: 3 | P5: Nanjing South | Q5: 75
A6: 5 | B6: 1 | C6: 3 | D6: 492 | E6: 138 | F6: 141 | G6: 213 | H6: 0 | I6: 38 | J6: 20 | K6: 18 | L6: 0 | M6: 0 | N6: 119 | O6: Total | Q6: 156
A7: 6 | B7: 2 | C7: 3 | D7: 795 | E7: 0 | F7: 268 | G7: 257 | H7: 270 | I7: 20 | J7: 0 | K7: 0 | L7: 0 | M7: 20 | N7: 75
A8: Total | D8: 3529 | E8: — | F8: — | G8: — | H8: — | I8: 252 | J8: — | K8: — | L8: — | M8: —

Sheet: Hangzhou-Ningbo
B1: O | C1: D | D1: Number of passengers (person) | E1: Reservation slot 1 | F1: Reservation slot 2 | G1: Reservation slot 3 | H1: Reservation slot 4 | I1: Volume of goods (ton) | J1: Reservation slot 1 | K1: Reservation slot 2 | L1: Reservation slot 3 | M1: Reservation slot 4 | N1: Distance by rail | O1: Station No. | P1: Station name | Q1: Section distance
A2: 0 | B2: 0 | C2: 1 | D2: 646 | E2: 261 | F2: 122 | G2: 263 | H2: 0 | I2: 40 | J2: 9 | K2: 16 | L2: 15 | M2: 0 | N2: 43 | O2: 0 | P2: Hangzhou East
A3: 1 | B3: 0 | C3: 2 | D3: 602 | E3: 135 | F3: 254 | G3: 213 | H3: 0 | I3: 39 | J3: 18 | K3: 21 | L3: 0 | M3: 0 | N3: 74 | O3: 1 | P3: Shaoxing North | Q3: 43
A4: 2 | B4: 0 | C4: 3 | D4: 258 | E4: 258 | F4: 0 | G4: 0 | H4: 0 | I4: 31 | J4: 17 | K4: 0 | L4: 14 | M4: 0 | N4: 106 | O4: 2 | P4: Shaoxing East | Q4: 31
A5: 3 | B5: 0 | C5: 4 | D5: 254 | E5: 0 | F5: 0 | G5: 254 | H5: 0 | I5: 15 | J5: 0 | K5: 15 | L5: 0 | M5: 0 | N5: 147 | O5: 3 | P5: Yuyao North | Q5: 32
A6: 4 | B6: 0 | C6: 5 | D6: 888 | E6: 276 | F6: 367 | G6: 245 | H6: 0 | I6: 35 | J6: 15 | K6: 0 | L6: 20 | M6: 0 | N6: 156 | O6: 4 | P6: Zhuangqiao | Q6: 41
A7: 5 | B7: 1 | C7: 2 | D7: 105 | E7: 105 | F7: 0 | G7: 0 | H7: 0 | I7: 20 | J7: 20 | K7: 0 | L7: 0 | M7: 0 | N7: 31 | O7: 5 | P7: Ningbo | Q7: 9
A8: 6 | B8: 1 | C8: 3 | D8: 0 | E8: 0 | F8: 0 | G8: 0 | H8: 0 | I8: 20 | J8: 8 | K8: 12 | L8: 0 | M8: 0 | N8: 63 | O8: Total | Q8: 156
A9: 7 | B9: 1 | C9: 4 | D9: 0 | E9: 0 | F9: 0 | G9: 0 | H9: 0 | I9: 15 | J9: 0 | K9: 15 | L9: 0 | M9: 0 | N9: 104
A10: 8 | B10: 1 | C10: 5 | D10: 205 | E10: 0 | F10: 0 | G10: 205 | H10: 0 | I10: 28 | J10: 0 | K10: 10 | L10: 18 | M10: 0 | N10: 113
A11: 9 | B11: 2 | C11: 3 | D11: 507 | E11: 238 | F11: 134 | G11: 0 | H11: 135 | I11: 20 | J11: 0 | K11: 10 | L11: 5 | M11: 5 | N11: 32
A12: 10 | B12: 2 | C12: 4 | D12: 196 | E12: 0 | F12: 0 | G12: 196 | H12: 0 | I12: 0 | J12: 0 | K12: 0 | L12: 0 | M12: 0 | N12: 73
A13: 11 | B13: 2 | C13: 5 | D13: 403 | E13: 121 | F13: 158 | G13: 124 | H13: 0 | I13: 0 | J13: 0 | K13: 0 | L13: 0 | M13: 0 | N13: 82
A14: 12 | B14: 3 | C14: 4 | D14: 145 | E14: 0 | F14: 0 | G14: 0 | H14: 145 | I14: 48 | J14: 30 | K14: 10 | L14: 0 | M14: 8 | N14: 41
A15: 13 | B15: 3 | C15: 5 | D15: 396 | E15: 145 | F15: 251 | G15: 0 | H15: 0 | I15: 35 | J15: 17 | K15: 18 | L15: 0 | M15: 0 | N15: 50
A16: 14 | B16: 4 | C16: 5 | D16: 304 | E16: 0 | F16: 202 | G16: 102 | H16: 0 | I16: 5 | J16: 0 | K16: 0 | L16: 5 | M16: 0 | N16: 9
A17: Total | D17: 4909 | E17: — | F17: — | G17: — | H17: — | I17: 351 | J17: — | K17: — | L17: — | M17: —

Sheet: Shanghai-Hangzhou
B1: O | C1: D | D1: Number of passengers (person) | E1: Reservation slot 1 | F1: Reservation slot 2 | G1: Reservation slot 3 | H1: Reservation slot 4 | I1: Volume of goods (ton) | J1: Reservation slot 1 | K1: Reservation slot 2 | L1: Reservation slot 3 | M1: Reservation slot 4 | N1: Distance by rail | O1: Station No. | P1: Station name | Q1: Section distance
A2: 0 | B2: 0 | C2: 1 | D2: 319 | E2: 213 | F2: 106 | G2: 0 | H2: 0 | I2: 45 | J2: 10 | K2: 20 | L2: 15 | M2: 0 | N2: 29 | O2: 0 | P2: Shanghai Hongqiao
A3: 1 | B3: 0 | C3: 2 | D3: 269 | E3: 125 | F3: 0 | G3: 144 | H3: 0 | I3: 32 | J3: 20 | K3: 0 | L3: 12 | M3: 0 | N3: 73 | O3: 1 | P3: Songjiang South | Q3: 29
A4: 2 | B4: 0 | C4: 3 | D4: 453 | E4: 174 | F4: 0 | G4: 279 | H4: 0 | I4: 50 | J4: 30 | K4: 0 | L4: 20 | M4: 0 | N4: 91 | O4: 2 | P4: Jiashan North | Q4: 44
A5: 3 | B5: 0 | C5: 4 | D5: 471 | E5: 0 | F5: 213 | G5: 258 | H5: 0 | I5: 14 | J5: 0 | K5: 14 | L5: 0 | M5: 0 | N5: 115 | O5: 3 | P5: Jiaxing South | Q5: 18
A6: 4 | B6: 0 | C6: 5 | D6: 200 | E6: 0 | F6: 200 | G6: 0 | H6: 0 | I6: 15 | J6: 0 | K6: 15 | L6: 0 | M6: 0 | N6: 146 | O6: 4 | P6: Tongxiang | Q6: 24
A7: 5 | B7: 0 | C7: 6 | D7: 717 | E7: 405 | F7: 312 | G7: 0 | H7: 0 | I7: 88 | J7: 18 | K7: 40 | L7: 30 | M7: 0 | N7: 158 | O7: 5 | P7: Yuhang | Q7: 31
A8: 6 | B8: 1 | C8: 2 | D8: 124 | E8: 124 | F8: 0 | G8: 0 | H8: 0 | I8: 20 | J8: 20 | K8: 0 | L8: 0 | M8: 0 | N8: 44 | O8: 6 | P8: Hangzhou South | Q8: 12
A9: 7 | B9: 1 | C9: 3 | D9: 150 | E9: 0 | F9: 150 | G9: 0 | H9: 0 | I9: 18 | J9: 0 | K9: 18 | L9: 0 | M9: 0 | N9: 62 | O9: Total | Q9: 158
A10: 8 | B10: 1 | C10: 4 | D10: 362 | E10: 0 | F10: 0 | G10: 92 | H10: 270 | I10: 20 | J10: 0 | K10: 0 | L10: 0 | M10: 20 | N10: 86
A11: 9 | B11: 1 | C11: 5 | D11: 237 | E11: 0 | F11: 237 | G11: 0 | H11: 0 | I11: 0 | J11: 0 | K11: 0 | L11: 0 | M11: 0 | N11: 117
A12: 10 | B12: 1 | C12: 6 | D12: 395 | E12: 0 | F12: 185 | G12: 210 | H12: 0 | I12: 0 | J12: 0 | K12: 0 | L12: 0 | M12: 0 | N12: 129
A13: 11 | B13: 2 | C13: 3 | D13: 360 | E13: 210 | F13: 0 | G13: 150 | H13: 0 | I13: 12 | J13: 0 | K13: 0 | L13: 12 | M13: 0 | N13: 18
A14: 12 | B14: 2 | C14: 4 | D14: 166 | E14: 139 | F14: 0 | G14: 27 | H14: 0 | I14: 9 | J14: 0 | K14: 0 | L14: 9 | M14: 0 | N14: 42
A15: 13 | B15: 2 | C15: 5 | D15: 131 | E15: 0 | F15: 131 | G15: 0 | H15: 0 | I15: 0 | J15: 0 | K15: 0 | L15: 0 | M15: 0 | N15: 73
A16: 14 | B16: 2 | C16: 6 | D16: 95 | E16: 0 | F16: 0 | G16: 95 | H16: 0 | I16: 0 | J16: 0 | K16: 0 | L16: 0 | M16: 0 | N16: 85
A17: 15 | B17: 3 | C17: 4 | D17: 0 | E17: 0 | F17: 0 | G17: 0 | H17: 0 | I17: 30 | J17: 30 | K17: 0 | L17: 0 | M17: 0 | N17: 24
A18: 16 | B18: 3 | C18: 5 | D18: 0 | E18: 0 | F18: 0 | G18: 0 | H18: 0 | I18: 12 | J18: 12 | K18: 0 | L18: 0 | M18: 0 | N18: 55
A19: 17 | B19: 3 | C19: 6 | D19: 0 | E19: 0 | F19: 0 | G19: 0 | H19: 0 | I19: 7 | J19: 0 | K19: 7 | L19: 0 | M19: 0 | N19: 67
A20: 18 | B20: 4 | C20: 5 | D20: 396 | E20: 0 | F20: 125 | G20: 0 | H20: 271 | I20: 0 | J20: 0 | K20: 0 | L20: 0 | M20: 0 | N20: 31
A21: 19 | B21: 4 | C21: 6 | D21: 133 | E21: 0 | F21: 0 | G21: 133 | H21: 0 | I21: 50 | J21: 5 | K21: 30 | L21: 0 | M21: 15 | N21: 43
A22: 20 | B22: 5 | C22: 6 | D22: 250 | E22: 0 | F22: 250 | G22: 0 | H22: 0 | I22: 5 | J22: 0 | K22: 5 | L22: 0 | M22: 0 | N22: 12
A23: Total | D23: 5228 | E23: — | F23: — | G23: — | H23: — | I23: 427 | J23: — | K23: — | L23: — | M23: —

Sheet: Shanghai-Nanjing Intercity
B1: O | C1: D | D1: Number of passengers (person) | E1: Reservation slot 1 | F1: Reservation slot 2 | G1: Reservation slot 3 | H1: Reservation slot 4 | I1: Volume of goods (ton) | J1: Reservation slot 1 | K1: Reservation slot 2 | L1: Reservation slot 3 | M1: Reservation slot 4 | N1: Distance by rail | O1: Station No. | P1: Station name | Q1: Section distance
A2: 0 | B2: 0 | C2: 1 | D2: 319 | E2: 213 | F2: 106 | G2: 0 | H2: 0 | I2: 51 | J2: 10 | K2: 20 | L2: 12 | M2: 9 | N2: 50 | O2: 0 | P2: Shanghai Hongqiao
A3: 1 | B3: 0 | C3: 2 | D3: 269 | E3: 125 | F3: 0 | G3: 144 | H3: 0 | I3: 42 | J3: 22 | K3: 0 | L3: 20 | M3: 0 | N3: 83 | O3: 1 | P3: Kunshan South | Q3: 50
A4: 2 | B4: 0 | C4: 3 | D4: 424 | E4: 174 | F4: 0 | G4: 0 | H4: 250 | I4: 51 | J4: 15 | K4: 11 | L4: 0 | M4: 25 | N4: 126 | O4: 2 | P4: Suzhou | Q4: 33
A5: 3 | B5: 0 | C5: 4 | D5: 571 | E5: 0 | F5: 213 | G5: 182 | H5: 176 | I5: 22 | J5: 8 | K5: 14 | L5: 0 | M5: 0 | N5: 165 | O5: 3 | P5: Wuxi | Q5: 43
A6: 4 | B6: 0 | C6: 5 | D6: 200 | E6: 0 | F6: 200 | G6: 0 | H6: 0 | I6: 35 | J6: 20 | K6: 15 | L6: 0 | M6: 0 | N6: 165 | O6: 4 | P6: Changzhou | Q6: 39
A7: 5 | B7: 0 | C7: 6 | D7: 133 | E7: 109 | F7: 24 | G7: 0 | H7: 0 | I7: 35 | J7: 0 | K7: 15 | L7: 20 | M7: 0 | N7: 237 | O7: 5 | P7: Danyang | Q7: 47
A8: 6 | B8: 0 | C8: 7 | D8: 586 | E8: 211 | F8: 375 | G8: 0 | H8: 0 | I8: 31 | J8: 11 | K8: 20 | L8: 0 | M8: 0 | N8: 315 | O8: 6 | P8: Zhenjiang | Q8: 25
A9: 7 | B9: 1 | C9: 2 | D9: 71 | E9: 71 | F9: 0 | G9: 0 | H9: 0 | I9: 0 | J9: 0 | K9: 0 | L9: 0 | M9: 0 | N9: 33 | O9: 7 | P9: Nanjing South | Q9: 78
A10: 8 | B10: 1 | C10: 3 | D10: 320 | E10: 0 | F10: 150 | G10: 0 | H10: 170 | I10: 0 | J10: 0 | K10: 0 | L10: 0 | M10: 0 | N10: 76 | O10: Total | Q10: 315
A11: 9 | B11: 1 | C11: 4 | D11: 145 | E11: 53 | F11: 0 | G11: 92 | H11: 0 | I11: 0 | J11: 0 | K11: 0 | L11: 0 | M11: 0 | N11: 115
A12: 10 | B12: 1 | C12: 5 | D12: 342 | E12: 237 | F12: 0 | G12: 0 | H12: 105 | I12: 0 | J12: 0 | K12: 0 | L12: 0 | M12: 0 | N12: 162
A13: 11 | B13: 1 | C13: 6 | D13: 546 | E13: 0 | F13: 185 | G13: 210 | H13: 151 | I13: 0 | J13: 0 | K13: 0 | L13: 0 | M13: 0 | N13: 187
A14: 12 | B14: 1 | C14: 7 | D14: 325 | E14: 105 | F14: 220 | G14: 0 | H14: 0 | I14: 0 | J14: 0 | K14: 0 | L14: 0 | M14: 0 | N14: 265
A15: 13 | B15: 2 | C15: 3 | D15: 360 | E15: 210 | F15: 0 | G15: 150 | H15: 0 | I15: 0 | J15: 0 | K15: 0 | L15: 0 | M15: 0 | N15: 43
A16: 14 | B16: 2 | C16: 4 | D16: 66 | E16: 39 | F16: 0 | G16: 27 | H16: 0 | I16: 0 | J16: 0 | K16: 0 | L16: 0 | M16: 0 | N16: 82
A17: 15 | B17: 2 | C17: 5 | D17: 131 | E17: 0 | F17: 131 | G17: 0 | H17: 0 | I17: 0 | J17: 0 | K17: 0 | L17: 0 | M17: 0 | N17: 129
A18: 16 | B18: 2 | C18: 6 | D18: 267 | E18: 0 | F18: 0 | G18: 95 | H18: 172 | I18: 0 | J18: 0 | K18: 0 | L18: 0 | M18: 0 | N18: 154
A19: 17 | B19: 2 | C19: 7 | D19: 433 | E19: 229 | F19: 204 | G19: 0 | H19: 0 | I19: 0 | J19: 0 | K19: 0 | L19: 0 | M19: 0 | N19: 232
A20: 18 | B20: 3 | C20: 4 | D20: 0 | E20: 0 | F20: 0 | G20: 0 | H20: 0 | I20: 42 | J20: 16 | K20: 0 | L20: 16 | M20: 10 | N20: 39
A21: 19 | B21: 3 | C21: 5 | D21: 0 | E21: 0 | F21: 0 | G21: 0 | H21: 0 | I21: 34 | J21: 9 | K21: 0 | L21: 18 | M21: 7 | N21: 86
A22: 20 | B22: 3 | C22: 6 | D22: 0 | E22: 0 | F22: 0 | G22: 0 | H22: 0 | I22: 30 | J22: 0 | K22: 30 | L22: 0 | M22: 0 | N22: 111
A23: 21 | B23: 3 | C23: 7 | D23: 0 | E23: 0 | F23: 0 | G23: 0 | H23: 0 | I23: 78 | J23: 10 | K23: 0 | L23: 38 | M23: 30 | N23: 189
A24: 22 | B24: 4 | C24: 5 | D24: 231 | E24: 0 | F24: 231 | G24: 0 | H24: 0 | I24: 0 | J24: 0 | K24: 0 | L24: 0 | M24: 0 | N24: 47
A25: 23 | B25: 4 | C25: 6 | D25: 273 | E25: 0 | F25: 0 | G25: 97 | H25: 176 | I25: 0 | J25: 0 | K25: 0 | L25: 0 | M25: 0 | N25: 72
A26: 24 | B26: 4 | C26: 7 | D26: 372 | E26: 0 | F26: 0 | G26: 159 | H26: 213 | I26: 0 | J26: 0 | K26: 0 | L26: 0 | M26: 0 | N26: 150
A27: 25 | B27: 5 | C27: 6 | D27: 0 | E27: 0 | F27: 0 | G27: 0 | H27: 0 | I27: 27 | J27: 15 | K27: 12 | L27: 0 | M27: 0 | N27: 25
A28: 26 | B28: 5 | C28: 7 | D28: 0 | E28: 0 | F28: 0 | G28: 0 | H28: 0 | I28: 44 | J28: 34 | K28: 10 | L28: 0 | M28: 0 | N28: 103
A29: 27 | B29: 6 | C29: 7 | D29: 272 | E29: 0 | F29: 272 | G29: 0 | H29: 0 | I29: 0 | J29: 0 | K29: 0 | L29: 0 | M29: 0 | N29: 78
A30: Total | D30: 6656 | E30: — | F30: — | G30: — | H30: — | I30: 522 | J30: — | K30: — | L30: — | M30: —

Sheet: Nanjing-Hangzhou
B1: O | C1: D | D1: Number of passengers (person) | E1: Reservation slot 1 | F1: Reservation slot 2 | G1: Reservation slot 3 | H1: Reservation slot 4 | I1: Volume of goods (ton) | J1: Reservation slot 1 | K1: Reservation slot 2 | L1: Reservation slot 3 | M1: Reservation slot 4 | N1: Distance by rail | O1: Station No. | P1: Station name | Q1: Section distance
A2: 0 | B2: 0 | C2: 1 | D2: 319 | E2: 213 | F2: 106 | G2: 0 | H2: 0 | I2: 51 | J2: 10 | K2: 20 | L2: 12 | M2: 9 | N2: 26 | O2: 0 | P2: Nanjing South
A3: 1 | B3: 0 | C3: 2 | D3: 269 | E3: 125 | F3: 0 | G3: 144 | H3: 0 | I3: 40 | J3: 20 | K3: 0 | L3: 20 | M3: 0 | N3: 59 | O3: 1 | P3: Jurong West | Q3: 26
A4: 2 | B4: 0 | C4: 3 | D4: 424 | E4: 174 | F4: 0 | G4: 0 | H4: 250 | I4: 66 | J4: 30 | K4: 11 | L4: 0 | M4: 25 | N4: 98 | O4: 2 | P4: Lishui | Q4: 33
A5: 3 | B5: 0 | C5: 4 | D5: 571 | E5: 0 | F5: 213 | G5: 182 | H5: 176 | I5: 22 | J5: 8 | K5: 14 | L5: 0 | M5: 0 | N5: 129 | O5: 3 | P5: Liyang | Q5: 39
A6: 4 | B6: 0 | C6: 5 | D6: 200 | E6: 0 | F6: 200 | G6: 0 | H6: 0 | I6: 35 | J6: 20 | K6: 15 | L6: 0 | M6: 0 | N6: 165 | O6: 4 | P6: Yixing | Q6: 31
A7: 5 | B7: 0 | C7: 6 | D7: 133 | E7: 109 | F7: 24 | G7: 0 | H7: 0 | I7: 60 | J7: 0 | K7: 15 | L7: 30 | M7: 15 | N7: 185 | O7: 5 | P7: Changxing | Q7: 36
A8: 6 | B8: 0 | C8: 7 | D8: 330 | E8: 205 | F8: 125 | G8: 0 | H8: 0 | I8: 31 | J8: 11 | K8: 20 | L8: 0 | M8: 0 | N8: 221 | O8: 6 | P8: Huzhou | Q8: 20
A9: 7 | B9: 0 | C9: 8 | D9: 686 | E9: 311 | F9: 375 | G9: 0 | H9: 0 | I9: 31 | J9: 11 | K9: 20 | L9: 0 | M9: 0 | N9: 256 | O9: 7 | P9: Deqing | Q9: 36
A10: 8 | B10: 1 | C10: 2 | D10: 71 | E10: 71 | F10: 0 | G10: 0 | H10: 0 | I10: 0 | J10: 0 | K10: 0 | L10: 0 | M10: 0 | N10: 33 | O10: 8 | P10: Hangzhou East | Q10: 35
A11: 9 | B11: 1 | C11: 3 | D11: 320 | E11: 0 | F11: 150 | G11: 0 | H11: 170 | I11: 0 | J11: 0 | K11: 0 | L11: 0 | M11: 0 | N11: 72 | O11: Total | Q11: 256
A12: 10 | B12: 1 | C12: 4 | D12: 145 | E12: 53 | F12: 0 | G12: 92 | H12: 0 | I12: 0 | J12: 0 | K12: 0 | L12: 0 | M12: 0 | N12: 103
A13: 11 | B13: 1 | C13: 5 | D13: 342 | E13: 237 | F13: 0 | G13: 0 | H13: 105 | I13: 0 | J13: 0 | K13: 0 | L13: 0 | M13: 0 | N13: 139
A14: 12 | B14: 1 | C14: 6 | D14: 546 | E14: 0 | F14: 185 | G14: 210 | H14: 151 | I14: 0 | J14: 0 | K14: 0 | L14: 0 | M14: 0 | N14: 159
A15: 13 | B15: 1 | C15: 7 | D15: 325 | E15: 105 | F15: 220 | G15: 0 | H15: 0 | I15: 0 | J15: 0 | K15: 0 | L15: 0 | M15: 0 | N15: 195
A16: 14 | B16: 1 | C16: 8 | D16: 278 | E16: 76 | F16: 202 | G16: 0 | H16: 0 | I16: 0 | J16: 0 | K16: 0 | L16: 0 | M16: 0 | N16: 230
A17: 15 | B17: 2 | C17: 3 | D17: 360 | E17: 210 | F17: 0 | G17: 150 | H17: 0 | I17: 0 | J17: 0 | K17: 0 | L17: 0 | M17: 0 | N17: 39
A18: 16 | B18: 2 | C18: 4 | D18: 66 | E18: 39 | F18: 0 | G18: 27 | H18: 0 | I18: 0 | J18: 0 | K18: 0 | L18: 0 | M18: 0 | N18: 70
A19: 17 | B19: 2 | C19: 5 | D19: 131 | E19: 0 | F19: 131 | G19: 0 | H19: 0 | I19: 0 | J19: 0 | K19: 0 | L19: 0 | M19: 0 | N19: 106
A20: 18 | B20: 2 | C20: 6 | D20: 267 | E20: 0 | F20: 0 | G20: 95 | H20: 172 | I20: 0 | J20: 0 | K20: 0 | L20: 0 | M20: 0 | N20: 126
A21: 19 | B21: 2 | C21: 7 | D21: 76 | E21: 0 | F21: 76 | G21: 0 | H21: 0 | I21: 0 | J21: 0 | K21: 0 | L21: 0 | M21: 0 | N21: 162
A22: 20 | B22: 2 | C22: 8 | D22: 433 | E22: 229 | F22: 204 | G22: 0 | H22: 0 | I22: 0 | J22: 0 | K22: 0 | L22: 0 | M22: 0 | N22: 197
A23: 21 | B23: 3 | C23: 4 | D23: 0 | E23: 0 | F23: 0 | G23: 0 | H23: 0 | I23: 42 | J23: 16 | K23: 0 | L23: 16 | M23: 10 | N23: 31
A24: 22 | B24: 3 | C24: 5 | D24: 0 | E24: 0 | F24: 0 | G24: 0 | H24: 0 | I24: 34 | J24: 9 | K24: 0 | L24: 18 | M24: 7 | N24: 67
A25: 23 | B25: 3 | C25: 6 | D25: 0 | E25: 0 | F25: 0 | G25: 0 | H25: 0 | I25: 30 | J25: 0 | K25: 30 | L25: 0 | M25: 0 | N25: 87
A26: 24 | B26: 3 | C26: 7 | D26: 0 | E26: 0 | F26: 0 | G26: 0 | H26: 0 | I26: 40 | J26: 10 | K26: 0 | L26: 0 | M26: 30 | N26: 123
A27: 25 | B27: 3 | C27: 8 | D27: 0 | E27: 0 | F27: 0 | G27: 0 | H27: 0 | I27: 78 | J27: 10 | K27: 0 | L27: 38 | M27: 30 | N27: 158
A28: 26 | B28: 4 | C28: 5 | D28: 231 | E28: 0 | F28: 231 | G28: 0 | H28: 0 | I28: 0 | J28: 0 | K28: 0 | L28: 0 | M28: 0 | N28: 36
A29: 27 | B29: 4 | C29: 6 | D29: 273 | E29: 0 | F29: 0 | G29: 97 | H29: 176 | I29: 0 | J29: 0 | K29: 0 | L29: 0 | M29: 0 | N29: 56
A30: 28 | B30: 4 | C30: 7 | D30: 132 | E30: 0 | F30: 0 | G30: 0 | H30: 132 | I30: 0 | J30: 0 | K30: 0 | L30: 0 | M30: 0 | N30: 92
A31: 29 | B31: 4 | C31: 8 | D31: 372 | E31: 0 | F31: 0 | G31: 159 | H31: 213 | I31: 0 | J31: 0 | K31: 0 | L31: 0 | M31: 0 | N31: 127
A32: 30 | B32: 5 | C32: 6 | D32: 272 | E32: 0 | F32: 272 | G32: 0 | H32: 0 | I32: 46 | J32: 34 | K32: 12 | L32: 0 | M32: 0 | N32: 20
A33: 31 | B33: 5 | C33: 7 | D33: 0 | E33: 0 | F33: 0 | G33: 0 | H33: 0 | I33: 5 | J33: 5 | K33: 0 | L33: 0 | M33: 0 | N33: 56
A34: 32 | B34: 5 | C34: 8 | D34: 0 | E34: 0 | F34: 0 | G34: 0 | H34: 0 | I34: 15 | J34: 5 | K34: 10 | L34: 0 | M34: 0 | N34: 91
A35: 33 | B35: 6 | C35: 7 | D35: 315 | E35: 0 | F35: 315 | G35: 0 | H35: 0 | I35: 0 | J35: 0 | K35: 0 | L35: 0 | M35: 0 | N35: 36
A36: 34 | B36: 6 | C36: 8 | D36: 0 | E36: 0 | F36: 0 | G36: 0 | H36: 0 | I36: 0 | J36: 0 | K36: 0 | L36: 0 | M36: 0 | N36: 71
A37: 35 | B37: 7 | C37: 8 | D37: 272 | E37: 0 | F37: 272 | G37: 0 | H37: 0 | I37: 0 | J37: 0 | K37: 0 | L37: 0 | M37: 0 | N37: 35
A38: Total | D38: 7887 | E38: — | F38: — | G38: — | H38: — | I38: 626 | J38: — | K38: — | L38: — | M38: —

Sheet: Shanghai-Nanjing
B1: O | C1: D | D1: Number of passengers (person) | E1: Reservation slot 1 | F1: Reservation slot 2 | G1: Reservation slot 3 | H1: Reservation slot 4 | I1: Volume of goods (ton) | J1: Reservation slot 1 | K1: Reservation slot 2 | L1: Reservation slot 3 | M1: Reservation slot 4 | N1: Distance by rail | O1: Station No. | P1: Station name | Q1: Section distance
A2: 0 | B2: 0 | C2: 1 | D2: 319 | E2: 213 | F2: 106 | G2: 0 | H2: 0 | I2: 52 | J2: 20 | K2: 20 | L2: 12 | M2: 0 | N2: 57 | O2: 0 | P2: Shanghai Hongqiao
A3: 1 | B3: 0 | C3: 2 | D3: 269 | E3: 125 | F3: 0 | G3: 144 | H3: 0 | I3: 40 | J3: 20 | K3: 0 | L3: 20 | M3: 0 | N3: 106 | O3: 1 | P3: Taicang | Q3: 57
A4: 2 | B4: 0 | C4: 3 | D4: 424 | E4: 174 | F4: 0 | G4: 0 | H4: 250 | I4: 52 | J4: 30 | K4: 22 | L4: 0 | M4: 0 | N4: 124 | O4: 2 | P4: Changshu | Q4: 49
A5: 3 | B5: 0 | C5: 4 | D5: 571 | E5: 0 | F5: 213 | G5: 182 | H5: 176 | I5: 22 | J5: 8 | K5: 14 | L5: 0 | M5: 0 | N5: 158 | O5: 3 | P5: Zhangjiagang | Q5: 18
A6: 4 | B6: 0 | C6: 5 | D6: 200 | E6: 0 | F6: 200 | G6: 0 | H6: 0 | I6: 35 | J6: 20 | K6: 15 | L6: 0 | M6: 0 | N6: 208 | O6: 4 | P6: Nantong | Q6: 34
A7: 5 | B7: 0 | C7: 6 | D7: 133 | E7: 109 | F7: 24 | G7: 0 | H7: 0 | I7: 45 | J7: 0 | K7: 15 | L7: 30 | M7: 0 | N7: 222 | O7: 5 | P7: Rugao | Q7: 50
A8: 6 | B8: 0 | C8: 7 | D8: 686 | E8: 311 | F8: 375 | G8: 0 | H8: 0 | I8: 31 | J8: 11 | K8: 20 | L8: 0 | M8: 0 | N8: 276 | O8: 6 | P8: Haian | Q8: 14
A9: 7 | B9: 0 | C9: 8 | D9: 686 | E9: 311 | F9: 375 | G9: 0 | H9: 0 | I9: 50 | J9: 30 | K9: 20 | L9: 0 | M9: 0 | N9: 339 | O9: 7 | P9: Taizhou | Q9: 54
A10: 8 | B10: 0 | C10: 9 | D10: 686 | E10: 311 | F10: 375 | G10: 0 | H10: 0 | I10: 36 | J10: 11 | K10: 25 | L10: 0 | M10: 0 | N10: 441 | O10: 8 | P10: Yangzhou | Q10: 63
A11: 9 | B11: 1 | C11: 2 | D11: 71 | E11: 71 | F11: 0 | G11: 0 | H11: 0 | I11: 0 | J11: 0 | K11: 0 | L11: 0 | M11: 0 | N11: 49 | O11: 9 | P11: Nanjing South | Q11: 102
A12: 10 | B12: 1 | C12: 3 | D12: 320 | E12: 0 | F12: 150 | G12: 0 | H12: 170 | I12: 0 | J12: 0 | K12: 0 | L12: 0 | M12: 0 | N12: 67 | O12: Total | Q12: 441
A13: 11 | B13: 1 | C13: 4 | D13: 245 | E13: 153 | F13: 0 | G13: 92 | H13: 0 | I13: 0 | J13: 0 | K13: 0 | L13: 0 | M13: 0 | N13: 101
A14: 12 | B14: 1 | C14: 5 | D14: 342 | E14: 237 | F14: 0 | G14: 0 | H14: 105 | I14: 0 | J14: 0 | K14: 0 | L14: 0 | M14: 0 | N14: 151
A15: 13 | B15: 1 | C15: 6 | D15: 546 | E15: 0 | F15: 185 | G15: 210 | H15: 151 | I15: 0 | J15: 0 | K15: 0 | L15: 0 | M15: 0 | N15: 165
A16: 14 | B16: 1 | C16: 7 | D16: 325 | E16: 105 | F16: 220 | G16: 0 | H16: 0 | I16: 0 | J16: 0 | K16: 0 | L16: 0 | M16: 0 | N16: 219
A17: 15 | B17: 1 | C17: 8 | D17: 220 | E17: 0 | F17: 220 | G17: 0 | H17: 0 | I17: 0 | J17: 0 | K17: 0 | L17: 0 | M17: 0 | N17: 282
A18: 16 | B18: 1 | C18: 9 | D18: 325 | E18: 105 | F18: 220 | G18: 0 | H18: 0 | I18: 0 | J18: 0 | K18: 0 | L18: 0 | M18: 0 | N18: 384
A19: 17 | B19: 2 | C19: 3 | D19: 360 | E19: 210 | F19: 0 | G19: 150 | H19: 0 | I19: 0 | J19: 0 | K19: 0 | L19: 0 | M19: 0 | N19: 18
A20: 18 | B20: 2 | C20: 4 | D20: 250 | E20: 39 | F20: 0 | G20: 39 | H20: 172 | I20: 0 | J20: 0 | K20: 0 | L20: 0 | M20: 0 | N20: 52
A21: 19 | B21: 2 | C21: 5 | D21: 131 | E21: 0 | F21: 131 | G21: 0 | H21: 0 | I21: 0 | J21: 0 | K21: 0 | L21: 0 | M21: 0 | N21: 102
A22: 20 | B22: 2 | C22: 6 | D22: 95 | E22: 0 | F22: 0 | G22: 95 | H22: 0 | I22: 0 | J22: 0 | K22: 0 | L22: 0 | M22: 0 | N22: 116
A23: 21 | B23: 2 | C23: 7 | D23: 204 | E23: 0 | F23: 204 | G23: 0 | H23: 0 | I23: 0 | J23: 0 | K23: 0 | L23: 0 | M23: 0 | N23: 170
A24: 22 | B24: 2 | C24: 8 | D24: 383 | E24: 179 | F24: 204 | G24: 0 | H24: 0 | I24: 0 | J24: 0 | K24: 0 | L24: 0 | M24: 0 | N24: 233
A25: 23 | B25: 2 | C25: 9 | D25: 530 | E25: 229 | F25: 301 | G25: 0 | H25: 0 | I25: 0 | J25: 0 | K25: 0 | L25: 0 | M25: 0 | N25: 335
A26: 24 | B26: 3 | C26: 4 | D26: 0 | E26: 0 | F26: 0 | G26: 0 | H26: 0 | I26: 32 | J26: 16 | K26: 0 | L26: 16 | M26: 0 | N26: 34
A27: 25 | B27: 3 | C27: 5 | D27: 0 | E27: 0 | F27: 0 | G27: 0 | H27: 0 | I27: 27 | J27: 9 | K27: 0 | L27: 18 | M27: 0 | N27: 84
A28: 26 | B28: 3 | C28: 6 | D28: 0 | E28: 0 | F28: 0 | G28: 0 | H28: 0 | I28: 30 | J28: 0 | K28: 30 | L28: 0 | M28: 0 | N28: 98
A29: 27 | B29: 3 | C29: 7 | D29: 0 | E29: 0 | F29: 0 | G29: 0 | H29: 0 | I29: 48 | J29: 10 | K29: 0 | L29: 38 | M29: 0 | N29: 152
A30: 28 | B30: 3 | C30: 8 | D30: 0 | E30: 0 | F30: 0 | G30: 0 | H30: 0 | I30: 65 | J30: 22 | K30: 0 | L30: 43 | M30: 0 | N30: 215
A31: 29 | B31: 3 | C31: 9 | D31: 0 | E31: 0 | F31: 0 | G31: 0 | H31: 0 | I31: 38 | J31: 0 | K31: 0 | L31: 38 | M31: 0 | N31: 317
A32: 30 | B32: 4 | C32: 5 | D32: 231 | E32: 0 | F32: 231 | G32: 0 | H32: 0 | I32: 0 | J32: 0 | K32: 0 | L32: 0 | M32: 0 | N32: 50
A33: 31 | B33: 4 | C33: 6 | D33: 369 | E33: 0 | F33: 272 | G33: 97 | H33: 0 | I33: 0 | J33: 0 | K33: 0 | L33: 0 | M33: 0 | N33: 64
A34: 32 | B34: 4 | C34: 7 | D34: 0 | E34: 0 | F34: 0 | G34: 0 | H34: 0 | I34: 0 | J34: 0 | K34: 0 | L34: 0 | M34: 0 | N34: 118
A35: 33 | B35: 4 | C35: 8 | D35: 431 | E35: 0 | F35: 272 | G35: 159 | H35: 0 | I35: 0 | J35: 0 | K35: 0 | L35: 0 | M35: 0 | N35: 181
A36: 34 | B36: 4 | C36: 9 | D36: 504 | E36: 132 | F36: 0 | G36: 159 | H36: 213 | I36: 0 | J36: 0 | K36: 0 | L36: 0 | M36: 0 | N36: 283
A37: 35 | B37: 5 | C37: 6 | D37: 0 | E37: 0 | F37: 0 | G37: 0 | H37: 0 | I37: 17 | J37: 5 | K37: 12 | L37: 0 | M37: 0 | N37: 14
A38: 36 | B38: 5 | C38: 7 | D38: 0 | E38: 0 | F38: 0 | G38: 0 | H38: 0 | I38: 24 | J38: 14 | K38: 10 | L38: 0 | M38: 0 | N38: 68
A39: 37 | B39: 5 | C39: 8 | D39: 0 | E39: 0 | F39: 0 | G39: 0 | H39: 0 | I39: 29 | J39: 17 | K39: 12 | L39: 0 | M39: 0 | N39: 131
A40: 38 | B40: 5 | C40: 9 | D40: 0 | E40: 0 | F40: 0 | G40: 0 | H40: 0 | I40: 56 | J40: 34 | K40: 22 | L40: 0 | M40: 0 | N40: 133
A41: 39 | B41: 6 | C41: 7 | D41: 0 | E41: 0 | F41: 0 | G41: 0 | H41: 0 | I41: 0 | J41: 0 | K41: 0 | L41: 0 | M41: 0 | N41: 54
A42: 40 | B42: 6 | C42: 8 | D42: 0 | E42: 0 | F42: 0 | G42: 0 | H42: 0 | I42: 0 | J42: 0 | K42: 0 | L42: 0 | M42: 0 | N42: 117
A43: 41 | B43: 6 | C43: 9 | D43: 0 | E43: 0 | F43: 0 | G43: 0 | H43: 0 | I43: 0 | J43: 0 | K43: 0 | L43: 0 | M43: 0 | N43: 219
A44: 42 | B44: 7 | C44: 8 | D44: 0 | E44: 0 | F44: 0 | G44: 0 | H44: 0 | I44: 0 | J44: 0 | K44: 0 | L44: 0 | M44: 0 | N44: 63
A45: 43 | B45: 7 | C45: 9 | D45: 0 | E45: 0 | F45: 0 | G45: 0 | H45: 0 | I45: 0 | J45: 0 | K45: 0 | L45: 0 | M45: 0 | N45: 165
A46: 44 | B46: 8 | C46: 9 | D46: 0 | E46: 0 | F46: 0 | G46: 0 | H46: 0 | I46: 0 | J46: 0 | K46: 0 | L46: 0 | M46: 0 | N46: 102
A47: Total | D47: 9856 | E47: — | F47: — | G47: — | H47: — | I47: 729 | J47: — | K47: — | L47: — | M47: —

Sheet: Scenario (1-1)
B1: O | C1: D | D1: Number of passengers (person) | E1: Reservation slot 1 | F1: Reservation slot 2 | G1: Reservation slot 3 | H1: Reservation slot 4 | I1: Volume of goods (ton) | J1: Reservation slot 1 | K1: Reservation slot 2 | L1: Reservation slot 3 | M1: Reservation slot 4 | N1: Distance by rail | O1: Station No. | P1: Station name | Q1: Section distance
A2: 0 | B2: 0 | C2: 1 | D2: 319 | E2: 213 | F2: 106 | G2: 0 | H2: 0 | I2: 45 | J2: 10 | K2: 20 | L2: 15 | M2: 0 | N2: 29 | O2: 0 | P2: Shanghai Hongqiao
A3: 1 | B3: 0 | C3: 2 | D3: 269 | E3: 125 | F3: 0 | G3: 144 | H3: 0 | I3: 32 | J3: 20 | K3: 0 | L3: 12 | M3: 0 | N3: 73 | O3: 1 | P3: Songjiang South | Q3: 29
A4: 2 | B4: 0 | C4: 3 | D4: 453 | E4: 174 | F4: 0 | G4: 279 | H4: 0 | I4: 50 | J4: 30 | K4: 0 | L4: 20 | M4: 0 | N4: 91 | O4: 2 | P4: Jiashan North | Q4: 44
A5: 3 | B5: 0 | C5: 4 | D5: 471 | E5: 0 | F5: 213 | G5: 258 | H5: 0 | I5: 14 | J5: 0 | K5: 14 | L5: 0 | M5: 0 | N5: 115 | O5: 3 | P5: Jiaxing South | Q5: 18
A6: 4 | B6: 0 | C6: 5 | D6: 200 | E6: 0 | F6: 200 | G6: 0 | H6: 0 | I6: 15 | J6: 0 | K6: 15 | L6: 0 | M6: 0 | N6: 146 | O6: 4 | P6: Tongxiang | Q6: 24
A7: 5 | B7: 0 | C7: 6 | D7: 717 | E7: 405 | F7: 312 | G7: 0 | H7: 0 | I7: 88 | J7: 18 | K7: 40 | L7: 30 | M7: 0 | N7: 158 | O7: 5 | P7: Yuhang | Q7: 31
A8: 6 | B8: 1 | C8: 2 | D8: 124 | E8: 124 | F8: 0 | G8: 0 | H8: 0 | I8: 20 | J8: 20 | K8: 0 | L8: 0 | M8: 0 | N8: 44 | O8: 6 | P8: Hangzhou South | Q8: 12
A9: 7 | B9: 1 | C9: 3 | D9: 150 | E9: 0 | F9: 150 | G9: 0 | H9: 0 | I9: 18 | J9: 0 | K9: 18 | L9: 0 | M9: 0 | N9: 62 | O9: Total | Q9: 158
A10: 8 | B10: 1 | C10: 4 | D10: 362 | E10: 0 | F10: 0 | G10: 92 | H10: 270 | I10: 20 | J10: 0 | K10: 0 | L10: 0 | M10: 20 | N10: 86
A11: 9 | B11: 1 | C11: 5 | D11: 237 | E11: 0 | F11: 237 | G11: 0 | H11: 0 | I11: 0 | J11: 0 | K11: 0 | L11: 0 | M11: 0 | N11: 117
A12: 10 | B12: 1 | C12: 6 | D12: 395 | E12: 0 | F12: 185 | G12: 210 | H12: 0 | I12: 0 | J12: 0 | K12: 0 | L12: 0 | M12: 0 | N12: 129
A13: 11 | B13: 2 | C13: 3 | D13: 360 | E13: 210 | F13: 0 | G13: 150 | H13: 0 | I13: 12 | J13: 0 | K13: 0 | L13: 12 | M13: 0 | N13: 18
A14: 12 | B14: 2 | C14: 4 | D14: 166 | E14: 139 | F14: 0 | G14: 27 | H14: 0 | I14: 9 | J14: 0 | K14: 0 | L14: 9 | M14: 0 | N14: 42
A15: 13 | B15: 2 | C15: 5 | D15: 131 | E15: 0 | F15: 131 | G15: 0 | H15: 0 | I15: 0 | J15: 0 | K15: 0 | L15: 0 | M15: 0 | N15: 73
A16: 14 | B16: 2 | C16: 6 | D16: 95 | E16: 0 | F16: 0 | G16: 95 | H16: 0 | I16: 0 | J16: 0 | K16: 0 | L16: 0 | M16: 0 | N16: 85
A17: 15 | B17: 3 | C17: 4 | D17: 0 | E17: 0 | F17: 0 | G17: 0 | H17: 0 | I17: 30 | J17: 30 | K17: 0 | L17: 0 | M17: 0 | N17: 24
A18: 16 | B18: 3 | C18: 5 | D18: 0 | E18: 0 | F18: 0 | G18: 0 | H18: 0 | I18: 12 | J18: 12 | K18: 0 | L18: 0 | M18: 0 | N18: 55
A19: 17 | B19: 3 | C19: 6 | D19: 0 | E19: 0 | F19: 0 | G19: 0 | H19: 0 | I19: 7 | J19: 0 | K19: 7 | L19: 0 | M19: 0 | N19: 67
A20: 18 | B20: 4 | C20: 5 | D20: 396 | E20: 0 | F20: 125 | G20: 0 | H20: 271 | I20: 0 | J20: 0 | K20: 0 | L20: 0 | M20: 0 | N20: 31
A21: 19 | B21: 4 | C21: 6 | D21: 133 | E21: 0 | F21: 0 | G21: 133 | H21: 0 | I21: 50 | J21: 5 | K21: 30 | L21: 0 | M21: 15 | N21: 43
A22: 20 | B22: 5 | C22: 6 | D22: 250 | E22: 0 | F22: 250 | G22: 0 | H22: 0 | I22: 5 | J22: 0 | K22: 5 | L22: 0 | M22: 0 | N22: 12
A23: Total | D23: 5228 | E23: — | F23: — | G23: — | H23: — | I23: 427 | J23: — | K23: — | L23: — | M23: —

Sheet: Scenario (1-2)
B1: O | C1: D | D1: Number of passengers (person) | E1: Reservation slot 1 | F1: Reservation slot 2 | G1: Reservation slot 3 | H1: Reservation slot 4 | I1: Volume of goods (ton) | J1: Reservation slot 1 | K1: Reservation slot 2 | L1: Reservation slot 3 | M1: Reservation slot 4 | N1: Distance by rail | O1: Station No. | P1: Station name | Q1: Section distance
A2: 0 | B2: 0 | C2: 1 | D2: 319 | E2: 213 | F2: 106 | G2: 0 | H2: 0 | I2: 55 | J2: 20 | K2: 20 | L2: 15 | M2: 0 | N2: 29 | O2: 0 | P2: Shanghai Hongqiao
A3: 1 | B3: 0 | C3: 2 | D3: 269 | E3: 125 | F3: 0 | G3: 144 | H3: 0 | I3: 32 | J3: 20 | K3: 0 | L3: 12 | M3: 0 | N3: 73 | O3: 1 | P3: Songjiang South | Q3: 29
A4: 2 | B4: 0 | C4: 3 | D4: 453 | E4: 174 | F4: 0 | G4: 279 | H4: 0 | I4: 67 | J4: 47 | K4: 0 | L4: 20 | M4: 0 | N4: 91 | O4: 2 | P4: Jiashan North | Q4: 44
A5: 3 | B5: 0 | C5: 4 | D5: 471 | E5: 0 | F5: 213 | G5: 258 | H5: 0 | I5: 14 | J5: 0 | K5: 14 | L5: 0 | M5: 0 | N5: 115 | O5: 3 | P5: Jiaxing South | Q5: 18
A6: 4 | B6: 0 | C6: 5 | D6: 200 | E6: 0 | F6: 200 | G6: 0 | H6: 0 | I6: 15 | J6: 0 | K6: 15 | L6: 0 | M6: 0 | N6: 146 | O6: 4 | P6: Tongxiang | Q6: 24
A7: 5 | B7: 0 | C7: 6 | D7: 717 | E7: 405 | F7: 312 | G7: 0 | H7: 0 | I7: 123 | J7: 18 | K7: 40 | L7: 65 | M7: 0 | N7: 158 | O7: 5 | P7: Yuhang | Q7: 31
A8: 6 | B8: 1 | C8: 2 | D8: 124 | E8: 124 | F8: 0 | G8: 0 | H8: 0 | I8: 20 | J8: 20 | K8: 0 | L8: 0 | M8: 0 | N8: 44 | O8: 6 | P8: Hangzhou South | Q8: 12
A9: 7 | B9: 1 | C9: 3 | D9: 150 | E9: 0 | F9: 150 | G9: 0 | H9: 0 | I9: 18 | J9: 0 | K9: 18 | L9: 0 | M9: 0 | N9: 62 | O9: Total | Q9: 158
A10: 8 | B10: 1 | C10: 4 | D10: 362 | E10: 0 | F10: 0 | G10: 92 | H10: 270 | I10: 20 | J10: 0 | K10: 0 | L10: 0 | M10: 20 | N10: 86
A11: 9 | B11: 1 | C11: 5 | D11: 237 | E11: 0 | F11: 237 | G11: 0 | H11: 0 | I11: 0 | J11: 0 | K11: 0 | L11: 0 | M11: 0 | N11: 117
A12: 10 | B12: 1 | C12: 6 | D12: 395 | E12: 0 | F12: 185 | G12: 210 | H12: 0 | I12: 0 | J12: 0 | K12: 0 | L12: 0 | M12: 0 | N12: 129
A13: 11 | B13: 2 | C13: 3 | D13: 360 | E13: 210 | F13: 0 | G13: 150 | H13: 0 | I13: 18 | J13: 0 | K13: 0 | L13: 18 | M13: 0 | N13: 18
A14: 12 | B14: 2 | C14: 4 | D14: 166 | E14: 139 | F14: 0 | G14: 27 | H14: 0 | I14: 19 | J14: 0 | K14: 0 | L14: 19 | M14: 0 | N14: 42
A15: 13 | B15: 2 | C15: 5 | D15: 131 | E15: 0 | F15: 131 | G15: 0 | H15: 0 | I15: 0 | J15: 0 | K15: 0 | L15: 0 | M15: 0 | N15: 73
A16: 14 | B16: 2 | C16: 6 | D16: 95 | E16: 0 | F16: 0 | G16: 95 | H16: 0 | I16: 0 | J16: 0 | K16: 0 | L16: 0 | M16: 0 | N16: 85
A17: 15 | B17: 3 | C17: 4 | D17: 0 | E17: 0 | F17: 0 | G17: 0 | H17: 0 | I17: 52 | J17: 52 | K17: 0 | L17: 0 | M17: 0 | N17: 24
A18: 16 | B18: 3 | C18: 5 | D18: 0 | E18: 0 | F18: 0 | G18: 0 | H18: 0 | I18: 12 | J18: 12 | K18: 0 | L18: 0 | M18: 0 | N18: 55
A19: 17 | B19: 3 | C19: 6 | D19: 0 | E19: 0 | F19: 0 | G19: 0 | H19: 0 | I19: 17 | J19: 0 | K19: 17 | L19: 0 | M19: 0 | N19: 67
A20: 18 | B20: 4 | C20: 5 | D20: 396 | E20: 0 | F20: 125 | G20: 0 | H20: 271 | I20: 0 | J20: 0 | K20: 0 | L20: 0 | M20: 0 | N20: 31
A21: 19 | B21: 4 | C21: 6 | D21: 133 | E21: 0 | F21: 0 | G21: 133 | H21: 0 | I21: 68 | J21: 16 | K21: 36 | L21: 0 | M21: 16 | N21: 43
A22: 20 | B22: 5 | C22: 6 | D22: 250 | E22: 0 | F22: 250 | G22: 0 | H22: 0 | I22: 15 | J22: 0 | K22: 15 | L22: 0 | M22: 0 | N22: 12
A23: Total | D23: =SUM(R[-21]C:R[-1]C) -> 5228 | E23: — | F23: — | G23: — | H23: — | I23: =SUM(R[-21]C:R[-1]C) -> 565 | J23: — | K23: — | L23: — | M23: —

Sheet: Scenario (1-3)
B1: O | C1: D | D1: Number of passengers (person) | E1: Reservation slot 1 | F1: Reservation slot 2 | G1: Reservation slot 3 | H1: Reservation slot 4 | I1: Volume of goods (ton) | J1: Reservation slot 1 | K1: Reservation slot 2 | L1: Reservation slot 3 | M1: Reservation slot 4 | N1: Distance by rail | O1: Station No. | P1: Station name | Q1: Section distance
A2: 0 | B2: 0 | C2: 1 | D2: 319 | E2: 213 | F2: 106 | G2: 0 | H2: 0 | I2: 91 | J2: 20 | K2: 52 | L2: 19 | M2: 0 | N2: 29 | O2: 0 | P2: Shanghai Hongqiao
A3: 1 | B3: 0 | C3: 2 | D3: 269 | E3: 125 | F3: 0 | G3: 144 | H3: 0 | I3: 48 | J3: 31 | K3: 0 | L3: 17 | M3: 0 | N3: 73 | O3: 1 | P3: Songjiang South | Q3: 29
A4: 2 | B4: 0 | C4: 3 | D4: 453 | E4: 174 | F4: 0 | G4: 279 | H4: 0 | I4: 67 | J4: 47 | K4: 0 | L4: 20 | M4: 0 | N4: 91 | O4: 2 | P4: Jiashan North | Q4: 44
A5: 3 | B5: 0 | C5: 4 | D5: 471 | E5: 0 | F5: 213 | G5: 258 | H5: 0 | I5: 14 | J5: 0 | K5: 14 | L5: 0 | M5: 0 | N5: 115 | O5: 3 | P5: Jiaxing South | Q5: 18
A6: 4 | B6: 0 | C6: 5 | D6: 200 | E6: 0 | F6: 200 | G6: 0 | H6: 0 | I6: 15 | J6: 0 | K6: 15 | L6: 0 | M6: 0 | N6: 146 | O6: 4 | P6: Tongxiang | Q6: 24
A7: 5 | B7: 0 | C7: 6 | D7: 717 | E7: 405 | F7: 312 | G7: 0 | H7: 0 | I7: 116 | J7: 18 | K7: 40 | L7: 58 | M7: 0 | N7: 158 | O7: 5 | P7: Yuhang | Q7: 31
A8: 6 | B8: 1 | C8: 2 | D8: 124 | E8: 124 | F8: 0 | G8: 0 | H8: 0 | I8: 20 | J8: 20 | K8: 0 | L8: 0 | M8: 0 | N8: 44 | O8: 6 | P8: Hangzhou South | Q8: 12
A9: 7 | B9: 1 | C9: 3 | D9: 150 | E9: 0 | F9: 150 | G9: 0 | H9: 0 | I9: 18 | J9: 0 | K9: 18 | L9: 0 | M9: 0 | N9: 62 | O9: Total | Q9: 158
A10: 8 | B10: 1 | C10: 4 | D10: 362 | E10: 0 | F10: 0 | G10: 92 | H10: 270 | I10: 58 | J10: 0 | K10: 0 | L10: 0 | M10: 58 | N10: 86
A11: 9 | B11: 1 | C11: 5 | D11: 237 | E11: 0 | F11: 237 | G11: 0 | H11: 0 | I11: 0 | J11: 0 | K11: 0 | L11: 0 | M11: 0 | N11: 117
A12: 10 | B12: 1 | C12: 6 | D12: 395 | E12: 0 | F12: 185 | G12: 210 | H12: 0 | I12: 0 | J12: 0 | K12: 0 | L12: 0 | M12: 0 | N12: 129
A13: 11 | B13: 2 | C13: 3 | D13: 360 | E13: 210 | F13: 0 | G13: 150 | H13: 0 | I13: 18 | J13: 0 | K13: 0 | L13: 18 | M13: 0 | N13: 18
A14: 12 | B14: 2 | C14: 4 | D14: 166 | E14: 139 | F14: 0 | G14: 27 | H14: 0 | I14: 19 | J14: 0 | K14: 0 | L14: 19 | M14: 0 | N14: 42
A15: 13 | B15: 2 | C15: 5 | D15: 131 | E15: 0 | F15: 131 | G15: 0 | H15: 0 | I15: 0 | J15: 0 | K15: 0 | L15: 0 | M15: 0 | N15: 73
A16: 14 | B16: 2 | C16: 6 | D16: 95 | E16: 0 | F16: 0 | G16: 95 | H16: 0 | I16: 0 | J16: 0 | K16: 0 | L16: 0 | M16: 0 | N16: 85
A17: 15 | B17: 3 | C17: 4 | D17: 0 | E17: 0 | F17: 0 | G17: 0 | H17: 0 | I17: 52 | J17: 52 | K17: 0 | L17: 0 | M17: 0 | N17: 24
A18: 16 | B18: 3 | C18: 5 | D18: 0 | E18: 0 | F18: 0 | G18: 0 | H18: 0 | I18: 39 | J18: 39 | K18: 0 | L18: 0 | M18: 0 | N18: 55
A19: 17 | B19: 3 | C19: 6 | D19: 0 | E19: 0 | F19: 0 | G19: 0 | H19: 0 | I19: 17 | J19: 0 | K19: 17 | L19: 0 | M19: 0 | N19: 67
A20: 18 | B20: 4 | C20: 5 | D20: 396 | E20: 0 | F20: 125 | G20: 0 | H20: 271 | I20: 0 | J20: 0 | K20: 0 | L20: 0 | M20: 0 | N20: 31
A21: 19 | B21: 4 | C21: 6 | D21: 133 | E21: 0 | F21: 0 | G21: 133 | H21: 0 | I21: 119 | J21: 16 | K21: 36 | L21: 0 | M21: 67 | N21: 43
A22: 20 | B22: 5 | C22: 6 | D22: 250 | E22: 0 | F22: 250 | G22: 0 | H22: 0 | I22: 15 | J22: 0 | K22: 15 | L22: 0 | M22: 0 | N22: 12
A23: Total | D23: =SUM(R[-21]C:R[-1]C) -> 5228 | E23: — | F23: — | G23: — | H23: — | I23: =SUM(R[-21]C:R[-1]C) -> 726 | J23: — | K23: — | L23: — | M23: —

Sheet: Scenario (2-1)
B1: O | C1: D | D1: Number of passengers (person) | E1: Reservation slot 1 | F1: Reservation slot 2 | G1: Reservation slot 3 | H1: Reservation slot 4 | I1: Volume of goods (ton) | J1: Reservation slot 1 | K1: Reservation slot 2 | L1: Reservation slot 3 | M1: Reservation slot 4 | N1: Distance by rail | O1: Station No. | P1: Station name | Q1: Section distance
A2: 0 | B2: 0 | C2: 1 | D2: 218 | E2: 112 | F2: 106 | G2: 0 | H2: 0 | I2: 45 | J2: 10 | K2: 20 | L2: 15 | M2: 0 | N2: 29 | O2: 0 | P2: Shanghai Hongqiao
A3: 1 | B3: 0 | C3: 2 | D3: 269 | E3: 125 | F3: 0 | G3: 144 | H3: 0 | I3: 32 | J3: 20 | K3: 0 | L3: 12 | M3: 0 | N3: 73 | O3: 1 | P3: Songjiang South | Q3: 29
A4: 2 | B4: 0 | C4: 3 | D4: 352 | E4: 73 | F4: 0 | G4: 279 | H4: 0 | I4: 50 | J4: 30 | K4: 0 | L4: 20 | M4: 0 | N4: 91 | O4: 2 | P4: Jiashan North | Q4: 44
A5: 3 | B5: 0 | C5: 4 | D5: 471 | E5: 0 | F5: 213 | G5: 258 | H5: 0 | I5: 14 | J5: 0 | K5: 14 | L5: 0 | M5: 0 | N5: 115 | O5: 3 | P5: Jiaxing South | Q5: 18
A6: 4 | B6: 0 | C6: 5 | D6: 104 | E6: 0 | F6: 104 | G6: 0 | H6: 0 | I6: 15 | J6: 0 | K6: 15 | L6: 0 | M6: 0 | N6: 146 | O6: 4 | P6: Tongxiang | Q6: 24
A7: 5 | B7: 0 | C7: 6 | D7: 506 | E7: 297 | F7: 209 | G7: 0 | H7: 0 | I7: 88 | J7: 18 | K7: 40 | L7: 30 | M7: 0 | N7: 158 | O7: 5 | P7: Yuhang | Q7: 31
A8: 6 | B8: 1 | C8: 2 | D8: 36 | E8: 36 | F8: 0 | G8: 0 | H8: 0 | I8: 20 | J8: 20 | K8: 0 | L8: 0 | M8: 0 | N8: 44 | O8: 6 | P8: Hangzhou South | Q8: 12
A9: 7 | B9: 1 | C9: 3 | D9: 150 | E9: 0 | F9: 150 | G9: 0 | H9: 0 | I9: 18 | J9: 0 | K9: 18 | L9: 0 | M9: 0 | N9: 62 | O9: Total | Q9: 158
A10: 8 | B10: 1 | C10: 4 | D10: 92 | E10: 0 | F10: 0 | G10: 92 | H10: 0 | I10: 20 | J10: 0 | K10: 0 | L10: 0 | M10: 20 | N10: 86
A11: 9 | B11: 1 | C11: 5 | D11: 237 | E11: 0 | F11: 237 | G11: 0 | H11: 0 | I11: 0 | J11: 0 | K11: 0 | L11: 0 | M11: 0 | N11: 117
A12: 10 | B12: 1 | C12: 6 | D12: 395 | E12: 0 | F12: 185 | G12: 210 | H12: 0 | I12: 0 | J12: 0 | K12: 0 | L12: 0 | M12: 0 | N12: 129
A13: 11 | B13: 2 | C13: 3 | D13: 360 | E13: 210 | F13: 0 | G13: 150 | H13: 0 | I13: 12 | J13: 0 | K13: 0 | L13: 12 | M13: 0 | N13: 18
A14: 12 | B14: 2 | C14: 4 | D14: 196 | E14: 139 | F14: 0 | G14: 57 | H14: 0 | I14: 9 | J14: 0 | K14: 0 | L14: 9 | M14: 0 | N14: 42
A15: 13 | B15: 2 | C15: 5 | D15: 101 | E15: 0 | F15: 101 | G15: 0 | H15: 0 | I15: 0 | J15: 0 | K15: 0 | L15: 0 | M15: 0 | N15: 73
A16: 14 | B16: 2 | C16: 6 | D16: 95 | E16: 0 | F16: 0 | G16: 95 | H16: 0 | I16: 0 | J16: 0 | K16: 0 | L16: 0 | M16: 0 | N16: 85
A17: 15 | B17: 3 | C17: 4 | D17: 0 | E17: 0 | F17: 0 | G17: 0 | H17: 0 | I17: 30 | J17: 30 | K17: 0 | L17: 0 | M17: 0 | N17: 24
A18: 16 | B18: 3 | C18: 5 | D18: 0 | E18: 0 | F18: 0 | G18: 0 | H18: 0 | I18: 12 | J18: 12 | K18: 0 | L18: 0 | M18: 0 | N18: 55
A19: 17 | B19: 3 | C19: 6 | D19: 0 | E19: 0 | F19: 0 | G19: 0 | H19: 0 | I19: 7 | J19: 0 | K19: 7 | L19: 0 | M19: 0 | N19: 67
A20: 18 | B20: 4 | C20: 5 | D20: 125 | E20: 0 | F20: 125 | G20: 0 | H20: 0 | I20: 0 | J20: 0 | K20: 0 | L20: 0 | M20: 0 | N20: 31
A21: 19 | B21: 4 | C21: 6 | D21: 133 | E21: 0 | F21: 0 | G21: 133 | H21: 0 | I21: 50 | J21: 5 | K21: 30 | L21: 0 | M21: 15 | N21: 43
A22: 20 | B22: 5 | C22: 6 | D22: 96 | E22: 0 | F22: 96 | G22: 0 | H22: 0 | I22: 5 | J22: 0 | K22: 5 | L22: 0 | M22: 0 | N22: 12
A23: Total | D23: =SUM(R[-21]C:R[-1]C) -> 3936 | E23: — | F23: — | G23: — | H23: — | I23: =SUM(R[-21]C:R[-1]C) -> 427 | J23: — | K23: — | L23: — | M23: —

Sheet: Scenario (2-2)
B1: O | C1: D | D1: Number of passengers (person) | E1: Reservation slot 1 | F1: Reservation slot 2 | G1: Reservation slot 3 | H1: Reservation slot 4 | I1: Volume of goods (ton) | J1: Reservation slot 1 | K1: Reservation slot 2 | L1: Reservation slot 3 | M1: Reservation slot 4 | N1: Distance by rail | O1: Station No. | P1: Station name | Q1: Section distance
A2: 0 | B2: 0 | C2: 1 | D2: 218 | E2: 112 | F2: 106 | G2: 0 | H2: 0 | I2: 55 | J2: 20 | K2: 20 | L2: 15 | M2: 0 | N2: 29 | O2: 0 | P2: Shanghai Hongqiao
A3: 1 | B3: 0 | C3: 2 | D3: 269 | E3: 125 | F3: 0 | G3: 144 | H3: 0 | I3: 32 | J3: 20 | K3: 0 | L3: 12 | M3: 0 | N3: 73 | O3: 1 | P3: Songjiang South | Q3: 29
A4: 2 | B4: 0 | C4: 3 | D4: 352 | E4: 73 | F4: 0 | G4: 279 | H4: 0 | I4: 67 | J4: 47 | K4: 0 | L4: 20 | M4: 0 | N4: 91 | O4: 2 | P4: Jiashan North | Q4: 44
A5: 3 | B5: 0 | C5: 4 | D5: 471 | E5: 0 | F5: 213 | G5: 258 | H5: 0 | I5: 14 | J5: 0 | K5: 14 | L5: 0 | M5: 0 | N5: 115 | O5: 3 | P5: Jiaxing South | Q5: 18
A6: 4 | B6: 0 | C6: 5 | D6: 104 | E6: 0 | F6: 104 | G6: 0 | H6: 0 | I6: 15 | J6: 0 | K6: 15 | L6: 0 | M6: 0 | N6: 146 | O6: 4 | P6: Tongxiang | Q6: 24
A7: 5 | B7: 0 | C7: 6 | D7: 506 | E7: 297 | F7: 209 | G7: 0 | H7: 0 | I7: 123 | J7: 18 | K7: 40 | L7: 65 | M7: 0 | N7: 158 | O7: 5 | P7: Yuhang | Q7: 31
A8: 6 | B8: 1 | C8: 2 | D8: 36 | E8: 36 | F8: 0 | G8: 0 | H8: 0 | I8: 20 | J8: 20 | K8: 0 | L8: 0 | M8: 0 | N8: 44 | O8: 6 | P8: Hangzhou South | Q8: 12
A9: 7 | B9: 1 | C9: 3 | D9: 150 | E9: 0 | F9: 150 | G9: 0 | H9: 0 | I9: 18 | J9: 0 | K9: 18 | L9: 0 | M9: 0 | N9: 62 | O9: Total | Q9: 158
A10: 8 | B10: 1 | C10: 4 | D10: 92 | E10: 0 | F10: 0 | G10: 92 | H10: 0 | I10: 20 | J10: 0 | K10: 0 | L10: 0 | M10: 20 | N10: 86
A11: 9 | B11: 1 | C11: 5 | D11: 237 | E11: 0 | F11: 237 | G11: 0 | H11: 0 | I11: 0 | J11: 0 | K11: 0 | L11: 0 | M11: 0 | N11: 117
A12: 10 | B12: 1 | C12: 6 | D12: 395 | E12: 0 | F12: 185 | G12: 210 | H12: 0 | I12: 0 | J12: 0 | K12: 0 | L12: 0 | M12: 0 | N12: 129
A13: 11 | B13: 2 | C13: 3 | D13: 360 | E13: 210 | F13: 0 | G13: 150 | H13: 0 | I13: 18 | J13: 0 | K13: 0 | L13: 18 | M13: 0 | N13: 18
A14: 12 | B14: 2 | C14: 4 | D14: 196 | E14: 139 | F14: 0 | G14: 57 | H14: 0 | I14: 19 | J14: 0 | K14: 0 | L14: 19 | M14: 0 | N14: 42
A15: 13 | B15: 2 | C15: 5 | D15: 101 | E15: 0 | F15: 101 | G15: 0 | H15: 0 | I15: 0 | J15: 0 | K15: 0 | L15: 0 | M15: 0 | N15: 73
A16: 14 | B16: 2 | C16: 6 | D16: 95 | E16: 0 | F16: 0 | G16: 95 | H16: 0 | I16: 0 | J16: 0 | K16: 0 | L16: 0 | M16: 0 | N16: 85
A17: 15 | B17: 3 | C17: 4 | D17: 0 | E17: 0 | F17: 0 | G17: 0 | H17: 0 | I17: 52 | J17: 52 | K17: 0 | L17: 0 | M17: 0 | N17: 24
A18: 16 | B18: 3 | C18: 5 | D18: 0 | E18: 0 | F18: 0 | G18: 0 | H18: 0 | I18: 12 | J18: 12 | K18: 0 | L18: 0 | M18: 0 | N18: 55
A19: 17 | B19: 3 | C19: 6 | D19: 0 | E19: 0 | F19: 0 | G19: 0 | H19: 0 | I19: 17 | J19: 0 | K19: 17 | L19: 0 | M19: 0 | N19: 67
A20: 18 | B20: 4 | C20: 5 | D20: 125 | E20: 0 | F20: 125 | G20: 0 | H20: 0 | I20: 0 | J20: 0 | K20: 0 | L20: 0 | M20: 0 | N20: 31
A21: 19 | B21: 4 | C21: 6 | D21: 133 | E21: 0 | F21: 0 | G21: 133 | H21: 0 | I21: 68 | J21: 16 | K21: 36 | L21: 0 | M21: 16 | N21: 43
A22: 20 | B22: 5 | C22: 6 | D22: 96 | E22: 0 | F22: 96 | G22: 0 | H22: 0 | I22: 15 | J22: 0 | K22: 15 | L22: 0 | M22: 0 | N22: 12
A23: Total | D23: =SUM(R[-21]C:R[-1]C) -> 3936 | E23: — | F23: — | G23: — | H23: — | I23: =SUM(R[-21]C:R[-1]C) -> 565 | J23: — | K23: — | L23: — | M23: —

Sheet: Scenario (2-3)
B1: O | C1: D | D1: Number of passengers (person) | E1: Reservation slot 1 | F1: Reservation slot 2 | G1: Reservation slot 3 | H1: Reservation slot 4 | I1: Volume of goods (ton) | J1: Reservation slot 1 | K1: Reservation slot 2 | L1: Reservation slot 3 | M1: Reservation slot 4 | N1: Distance by rail | O1: Station No. | P1: Station name | Q1: Section distance
A2: 0 | B2: 0 | C2: 1 | D2: 218 | E2: 112 | F2: 106 | G2: 0 | H2: 0 | I2: 91 | J2: 20 | K2: 52 | L2: 19 | M2: 0 | N2: 29 | O2: 0 | P2: Shanghai Hongqiao
A3: 1 | B3: 0 | C3: 2 | D3: 269 | E3: 125 | F3: 0 | G3: 144 | H3: 0 | I3: 48 | J3: 31 | K3: 0 | L3: 17 | M3: 0 | N3: 73 | O3: 1 | P3: Songjiang South | Q3: 29
A4: 2 | B4: 0 | C4: 3 | D4: 352 | E4: 73 | F4: 0 | G4: 279 | H4: 0 | I4: 67 | J4: 47 | K4: 0 | L4: 20 | M4: 0 | N4: 91 | O4: 2 | P4: Jiashan North | Q4: 44
A5: 3 | B5: 0 | C5: 4 | D5: 471 | E5: 0 | F5: 213 | G5: 258 | H5: 0 | I5: 14 | J5: 0 | K5: 14 | L5: 0 | M5: 0 | N5: 115 | O5: 3 | P5: Jiaxing South | Q5: 18
A6: 4 | B6: 0 | C6: 5 | D6: 104 | E6: 0 | F6: 104 | G6: 0 | H6: 0 | I6: 15 | J6: 0 | K6: 15 | L6: 0 | M6: 0 | N6: 146 | O6: 4 | P6: Tongxiang | Q6: 24
A7: 5 | B7: 0 | C7: 6 | D7: 506 | E7: 297 | F7: 209 | G7: 0 | H7: 0 | I7: 116 | J7: 18 | K7: 40 | L7: 58 | M7: 0 | N7: 158 | O7: 5 | P7: Yuhang | Q7: 31
A8: 6 | B8: 1 | C8: 2 | D8: 36 | E8: 36 | F8: 0 | G8: 0 | H8: 0 | I8: 20 | J8: 20 | K8: 0 | L8: 0 | M8: 0 | N8: 44 | O8: 6 | P8: Hangzhou South | Q8: 12
A9: 7 | B9: 1 | C9: 3 | D9: 150 | E9: 0 | F9: 150 | G9: 0 | H9: 0 | I9: 18 | J9: 0 | K9: 18 | L9: 0 | M9: 0 | N9: 62 | O9: Total | Q9: 158
A10: 8 | B10: 1 | C10: 4 | D10: 92 | E10: 0 | F10: 0 | G10: 92 | H10: 0 | I10: 58 | J10: 0 | K10: 0 | L10: 0 | M10: 58 | N10: 86
A11: 9 | B11: 1 | C11: 5 | D11: 237 | E11: 0 | F11: 237 | G11: 0 | H11: 0 | I11: 0 | J11: 0 | K11: 0 | L11: 0 | M11: 0 | N11: 117
A12: 10 | B12: 1 | C12: 6 | D12: 395 | E12: 0 | F12: 185 | G12: 210 | H12: 0 | I12: 0 | J12: 0 | K12: 0 | L12: 0 | M12: 0 | N12: 129
A13: 11 | B13: 2 | C13: 3 | D13: 360 | E13: 210 | F13: 0 | G13: 150 | H13: 0 | I13: 18 | J13: 0 | K13: 0 | L13: 18 | M13: 0 | N13: 18
A14: 12 | B14: 2 | C14: 4 | D14: 196 | E14: 139 | F14: 0 | G14: 57 | H14: 0 | I14: 19 | J14: 0 | K14: 0 | L14: 19 | M14: 0 | N14: 42
A15: 13 | B15: 2 | C15: 5 | D15: 101 | E15: 0 | F15: 101 | G15: 0 | H15: 0 | I15: 0 | J15: 0 | K15: 0 | L15: 0 | M15: 0 | N15: 73
A16: 14 | B16: 2 | C16: 6 | D16: 95 | E16: 0 | F16: 0 | G16: 95 | H16: 0 | I16: 0 | J16: 0 | K16: 0 | L16: 0 | M16: 0 | N16: 85
A17: 15 | B17: 3 | C17: 4 | D17: 0 | E17: 0 | F17: 0 | G17: 0 | H17: 0 | I17: 52 | J17: 52 | K17: 0 | L17: 0 | M17: 0 | N17: 24
A18: 16 | B18: 3 | C18: 5 | D18: 0 | E18: 0 | F18: 0 | G18: 0 | H18: 0 | I18: 39 | J18: 39 | K18: 0 | L18: 0 | M18: 0 | N18: 55
A19: 17 | B19: 3 | C19: 6 | D19: 0 | E19: 0 | F19: 0 | G19: 0 | H19: 0 | I19: 17 | J19: 0 | K19: 17 | L19: 0 | M19: 0 | N19: 67
A20: 18 | B20: 4 | C20: 5 | D20: 125 | E20: 0 | F20: 125 | G20: 0 | H20: 0 | I20: 0 | J20: 0 | K20: 0 | L20: 0 | M20: 0 | N20: 31
A21: 19 | B21: 4 | C21: 6 | D21: 133 | E21: 0 | F21: 0 | G21: 133 | H21: 0 | I21: 119 | J21: 16 | K21: 36 | L21: 0 | M21: 67 | N21: 43
A22: 20 | B22: 5 | C22: 6 | D22: 96 | E22: 0 | F22: 96 | G22: 0 | H22: 0 | I22: 15 | J22: 0 | K22: 15 | L22: 0 | M22: 0 | N22: 12
A23: Total | D23: =SUM(R[-21]C:R[-1]C) -> 3936 | E23: — | F23: — | G23: — | H23: — | I23: =SUM(R[-21]C:R[-1]C) -> 726 | J23: — | K23: — | L23: — | M23: —

Sheet: Scenario (3-1)
B1: O | C1: D | D1: Number of passengers (person) | E1: Reservation slot 1 | F1: Reservation slot 2 | G1: Reservation slot 3 | H1: Reservation slot 4 | I1: Volume of goods (ton) | J1: Reservation slot 1 | K1: Reservation slot 2 | L1: Reservation slot 3 | M1: Reservation slot 4 | N1: Distance by rail | O1: Station No. | P1: Station name | Q1: Section distance
A2: 0 | B2: 0 | C2: 1 | D2: 218 | E2: 112 | F2: 106 | G2: 0 | H2: 0 | I2: 45 | J2: 10 | K2: 20 | L2: 15 | M2: 0 | N2: 29 | O2: 0 | P2: Shanghai Hongqiao
A3: 1 | B3: 0 | C3: 2 | D3: 269 | E3: 125 | F3: 0 | G3: 144 | H3: 0 | I3: 32 | J3: 20 | K3: 0 | L3: 12 | M3: 0 | N3: 73 | O3: 1 | P3: Songjiang South | Q3: 29
A4: 2 | B4: 0 | C4: 3 | D4: 266 | E4: 0 | F4: 0 | G4: 266 | H4: 0 | I4: 50 | J4: 30 | K4: 0 | L4: 20 | M4: 0 | N4: 91 | O4: 2 | P4: Jiashan North | Q4: 44
A5: 3 | B5: 0 | C5: 4 | D5: 372 | E5: 0 | F5: 213 | G5: 159 | H5: 0 | I5: 14 | J5: 0 | K5: 14 | L5: 0 | M5: 0 | N5: 115 | O5: 3 | P5: Jiaxing South | Q5: 18
A6: 4 | B6: 0 | C6: 5 | D6: 104 | E6: 0 | F6: 104 | G6: 0 | H6: 0 | I6: 15 | J6: 0 | K6: 15 | L6: 0 | M6: 0 | N6: 146 | O6: 4 | P6: Tongxiang | Q6: 24
A7: 5 | B7: 0 | C7: 6 | D7: 416 | E7: 207 | F7: 209 | G7: 0 | H7: 0 | I7: 88 | J7: 18 | K7: 40 | L7: 30 | M7: 0 | N7: 158 | O7: 5 | P7: Yuhang | Q7: 31
A8: 6 | B8: 1 | C8: 2 | D8: 36 | E8: 36 | F8: 0 | G8: 0 | H8: 0 | I8: 20 | J8: 20 | K8: 0 | L8: 0 | M8: 0 | N8: 44 | O8: 6 | P8: Hangzhou South | Q8: 12
A9: 7 | B9: 1 | C9: 3 | D9: 136 | E9: 0 | F9: 136 | G9: 0 | H9: 0 | I9: 18 | J9: 0 | K9: 18 | L9: 0 | M9: 0 | N9: 62 | O9: Total | Q9: 158
A10: 8 | B10: 1 | C10: 4 | D10: 0 | E10: 0 | F10: 0 | G10: 0 | H10: 0 | I10: 20 | J10: 0 | K10: 0 | L10: 0 | M10: 20 | N10: 86
A11: 9 | B11: 1 | C11: 5 | D11: 237 | E11: 0 | F11: 237 | G11: 0 | H11: 0 | I11: 0 | J11: 0 | K11: 0 | L11: 0 | M11: 0 | N11: 117
A12: 10 | B12: 1 | C12: 6 | D12: 185 | E12: 0 | F12: 185 | G12: 0 | H12: 0 | I12: 0 | J12: 0 | K12: 0 | L12: 0 | M12: 0 | N12: 129
A13: 11 | B13: 2 | C13: 3 | D13: 141 | E13: 0 | F13: 0 | G13: 141 | H13: 0 | I13: 12 | J13: 0 | K13: 0 | L13: 12 | M13: 0 | N13: 18
A14: 12 | B14: 2 | C14: 4 | D14: 57 | E14: 0 | F14: 0 | G14: 57 | H14: 0 | I14: 9 | J14: 0 | K14: 0 | L14: 9 | M14: 0 | N14: 42
A15: 13 | B15: 2 | C15: 5 | D15: 0 | E15: 0 | F15: 0 | G15: 0 | H15: 0 | I15: 0 | J15: 0 | K15: 0 | L15: 0 | M15: 0 | N15: 73
A16: 14 | B16: 2 | C16: 6 | D16: 0 | E16: 0 | F16: 0 | G16: 0 | H16: 0 | I16: 0 | J16: 0 | K16: 0 | L16: 0 | M16: 0 | N16: 85
A17: 15 | B17: 3 | C17: 4 | D17: 0 | E17: 0 | F17: 0 | G17: 0 | H17: 0 | I17: 30 | J17: 30 | K17: 0 | L17: 0 | M17: 0 | N17: 24
A18: 16 | B18: 3 | C18: 5 | D18: 0 | E18: 0 | F18: 0 | G18: 0 | H18: 0 | I18: 12 | J18: 12 | K18: 0 | L18: 0 | M18: 0 | N18: 55
A19: 17 | B19: 3 | C19: 6 | D19: 0 | E19: 0 | F19: 0 | G19: 0 | H19: 0 | I19: 7 | J19: 0 | K19: 7 | L19: 0 | M19: 0 | N19: 67
A20: 18 | B20: 4 | C20: 5 | D20: 125 | E20: 0 | F20: 125 | G20: 0 | H20: 0 | I20: 0 | J20: 0 | K20: 0 | L20: 0 | M20: 0 | N20: 31
A21: 19 | B21: 4 | C21: 6 | D21: 0 | E21: 0 | F21: 0 | G21: 0 | H21: 0 | I21: 50 | J21: 5 | K21: 30 | L21: 0 | M21: 15 | N21: 43
A22: 20 | B22: 5 | C22: 6 | D22: 96 | E22: 0 | F22: 96 | G22: 0 | H22: 0 | I22: 5 | J22: 0 | K22: 5 | L22: 0 | M22: 0 | N22: 12
A23: Total | D23: =SUM(R[-21]C:R[-1]C) -> 2658 | E23: — | F23: — | G23: — | H23: — | I23: =SUM(R[-21]C:R[-1]C) -> 427 | J23: — | K23: — | L23: — | M23: —

Sheet: Scenario (3-2)
B1: O | C1: D | D1: Number of passengers (person) | E1: Reservation slot 1 | F1: Reservation slot 2 | G1: Reservation slot 3 | H1: Reservation slot 4 | I1: Volume of goods (ton) | J1: Reservation slot 1 | K1: Reservation slot 2 | L1: Reservation slot 3 | M1: Reservation slot 4 | N1: Distance by rail | O1: Station No. | P1: Station name | Q1: Section distance
A2: 0 | B2: 0 | C2: 1 | D2: 218 | E2: 112 | F2: 106 | G2: 0 | H2: 0 | I2: 55 | J2: 20 | K2: 20 | L2: 15 | M2: 0 | N2: 29 | O2: 0 | P2: Shanghai Hongqiao
A3: 1 | B3: 0 | C3: 2 | D3: 269 | E3: 125 | F3: 0 | G3: 144 | H3: 0 | I3: 32 | J3: 20 | K3: 0 | L3: 12 | M3: 0 | N3: 73 | O3: 1 | P3: Songjiang South | Q3: 29
A4: 2 | B4: 0 | C4: 3 | D4: 266 | E4: 0 | F4: 0 | G4: 266 | H4: 0 | I4: 67 | J4: 47 | K4: 0 | L4: 20 | M4: 0 | N4: 91 | O4: 2 | P4: Jiashan North | Q4: 44
A5: 3 | B5: 0 | C5: 4 | D5: 372 | E5: 0 | F5: 213 | G5: 159 | H5: 0 | I5: 14 | J5: 0 | K5: 14 | L5: 0 | M5: 0 | N5: 115 | O5: 3 | P5: Jiaxing South | Q5: 18
A6: 4 | B6: 0 | C6: 5 | D6: 104 | E6: 0 | F6: 104 | G6: 0 | H6: 0 | I6: 15 | J6: 0 | K6: 15 | L6: 0 | M6: 0 | N6: 146 | O6: 4 | P6: Tongxiang | Q6: 24
A7: 5 | B7: 0 | C7: 6 | D7: 416 | E7: 207 | F7: 209 | G7: 0 | H7: 0 | I7: 123 | J7: 18 | K7: 40 | L7: 65 | M7: 0 | N7: 158 | O7: 5 | P7: Yuhang | Q7: 31
A8: 6 | B8: 1 | C8: 2 | D8: 36 | E8: 36 | F8: 0 | G8: 0 | H8: 0 | I8: 20 | J8: 20 | K8: 0 | L8: 0 | M8: 0 | N8: 44 | O8: 6 | P8: Hangzhou South | Q8: 12
A9: 7 | B9: 1 | C9: 3 | D9: 136 | E9: 0 | F9: 136 | G9: 0 | H9: 0 | I9: 18 | J9: 0 | K9: 18 | L9: 0 | M9: 0 | N9: 62 | O9: Total | Q9: 158
A10: 8 | B10: 1 | C10: 4 | D10: 0 | E10: 0 | F10: 0 | G10: 0 | H10: 0 | I10: 20 | J10: 0 | K10: 0 | L10: 0 | M10: 20 | N10: 86
A11: 9 | B11: 1 | C11: 5 | D11: 237 | E11: 0 | F11: 237 | G11: 0 | H11: 0 | I11: 0 | J11: 0 | K11: 0 | L11: 0 | M11: 0 | N11: 117
A12: 10 | B12: 1 | C12: 6 | D12: 185 | E12: 0 | F12: 185 | G12: 0 | H12: 0 | I12: 0 | J12: 0 | K12: 0 | L12: 0 | M12: 0 | N12: 129
A13: 11 | B13: 2 | C13: 3 | D13: 141 | E13: 0 | F13: 0 | G13: 141 | H13: 0 | I13: 18 | J13: 0 | K13: 0 | L13: 18 | M13: 0 | N13: 18
A14: 12 | B14: 2 | C14: 4 | D14: 57 | E14: 0 | F14: 0 | G14: 57 | H14: 0 | I14: 19 | J14: 0 | K14: 0 | L14: 19 | M14: 0 | N14: 42
A15: 13 | B15: 2 | C15: 5 | D15: 0 | E15: 0 | F15: 0 | G15: 0 | H15: 0 | I15: 0 | J15: 0 | K15: 0 | L15: 0 | M15: 0 | N15: 73
A16: 14 | B16: 2 | C16: 6 | D16: 0 | E16: 0 | F16: 0 | G16: 0 | H16: 0 | I16: 0 | J16: 0 | K16: 0 | L16: 0 | M16: 0 | N16: 85
A17: 15 | B17: 3 | C17: 4 | D17: 0 | E17: 0 | F17: 0 | G17: 0 | H17: 0 | I17: 52 | J17: 52 | K17: 0 | L17: 0 | M17: 0 | N17: 24
A18: 16 | B18: 3 | C18: 5 | D18: 0 | E18: 0 | F18: 0 | G18: 0 | H18: 0 | I18: 12 | J18: 12 | K18: 0 | L18: 0 | M18: 0 | N18: 55
A19: 17 | B19: 3 | C19: 6 | D19: 0 | E19: 0 | F19: 0 | G19: 0 | H19: 0 | I19: 17 | J19: 0 | K19: 17 | L19: 0 | M19: 0 | N19: 67
A20: 18 | B20: 4 | C20: 5 | D20: 125 | E20: 0 | F20: 125 | G20: 0 | H20: 0 | I20: 0 | J20: 0 | K20: 0 | L20: 0 | M20: 0 | N20: 31
A21: 19 | B21: 4 | C21: 6 | D21: 0 | E21: 0 | F21: 0 | G21: 0 | H21: 0 | I21: 68 | J21: 16 | K21: 36 | L21: 0 | M21: 16 | N21: 43
A22: 20 | B22: 5 | C22: 6 | D22: 96 | E22: 0 | F22: 96 | G22: 0 | H22: 0 | I22: 15 | J22: 0 | K22: 15 | L22: 0 | M22: 0 | N22: 12
A23: Total | D23: =SUM(R[-21]C:R[-1]C) -> 2658 | E23: — | F23: — | G23: — | H23: — | I23: =SUM(R[-21]C:R[-1]C) -> 565 | J23: — | K23: — | L23: — | M23: —

Sheet: Scenario (3-3)
B1: O | C1: D | D1: Number of passengers (person) | E1: Reservation slot 1 | F1: Reservation slot 2 | G1: Reservation slot 3 | H1: Reservation slot 4 | I1: Volume of goods (ton) | J1: Reservation slot 1 | K1: Reservation slot 2 | L1: Reservation slot 3 | M1: Reservation slot 4 | N1: Distance by rail | O1: Station No. | P1: Station name | Q1: Section distance
A2: 0 | B2: 0 | C2: 1 | D2: 218 | E2: 112 | F2: 106 | G2: 0 | H2: 0 | I2: 91 | J2: 20 | K2: 52 | L2: 19 | M2: 0 | N2: 29 | O2: 0 | P2: Shanghai Hongqiao
A3: 1 | B3: 0 | C3: 2 | D3: 269 | E3: 125 | F3: 0 | G3: 144 | H3: 0 | I3: 48 | J3: 31 | K3: 0 | L3: 17 | M3: 0 | N3: 73 | O3: 1 | P3: Songjiang South | Q3: 29
A4: 2 | B4: 0 | C4: 3 | D4: 266 | E4: 0 | F4: 0 | G4: 266 | H4: 0 | I4: 67 | J4: 47 | K4: 0 | L4: 20 | M4: 0 | N4: 91 | O4: 2 | P4: Jiashan North | Q4: 44
A5: 3 | B5: 0 | C5: 4 | D5: 372 | E5: 0 | F5: 213 | G5: 159 | H5: 0 | I5: 14 | J5: 0 | K5: 14 | L5: 0 | M5: 0 | N5: 115 | O5: 3 | P5: Jiaxing South | Q5: 18
A6: 4 | B6: 0 | C6: 5 | D6: 104 | E6: 0 | F6: 104 | G6: 0 | H6: 0 | I6: 15 | J6: 0 | K6: 15 | L6: 0 | M6: 0 | N6: 146 | O6: 4 | P6: Tongxiang | Q6: 24
A7: 5 | B7: 0 | C7: 6 | D7: 416 | E7: 207 | F7: 209 | G7: 0 | H7: 0 | I7: 116 | J7: 18 | K7: 40 | L7: 58 | M7: 0 | N7: 158 | O7: 5 | P7: Yuhang | Q7: 31
A8: 6 | B8: 1 | C8: 2 | D8: 36 | E8: 36 | F8: 0 | G8: 0 | H8: 0 | I8: 20 | J8: 20 | K8: 0 | L8: 0 | M8: 0 | N8: 44 | O8: 6 | P8: Hangzhou South | Q8: 12
A9: 7 | B9: 1 | C9: 3 | D9: 136 | E9: 0 | F9: 136 | G9: 0 | H9: 0 | I9: 18 | J9: 0 | K9: 18 | L9: 0 | M9: 0 | N9: 62 | O9: Total | Q9: 158
A10: 8 | B10: 1 | C10: 4 | D10: 0 | E10: 0 | F10: 0 | G10: 0 | H10: 0 | I10: 58 | J10: 0 | K10: 0 | L10: 0 | M10: 58 | N10: 86
A11: 9 | B11: 1 | C11: 5 | D11: 237 | E11: 0 | F11: 237 | G11: 0 | H11: 0 | I11: 0 | J11: 0 | K11: 0 | L11: 0 | M11: 0 | N11: 117
A12: 10 | B12: 1 | C12: 6 | D12: 185 | E12: 0 | F12: 185 | G12: 0 | H12: 0 | I12: 0 | J12: 0 | K12: 0 | L12: 0 | M12: 0 | N12: 129
A13: 11 | B13: 2 | C13: 3 | D13: 141 | E13: 0 | F13: 0 | G13: 141 | H13: 0 | I13: 18 | J13: 0 | K13: 0 | L13: 18 | M13: 0 | N13: 18
A14: 12 | B14: 2 | C14: 4 | D14: 57 | E14: 0 | F14: 0 | G14: 57 | H14: 0 | I14: 19 | J14: 0 | K14: 0 | L14: 19 | M14: 0 | N14: 42
A15: 13 | B15: 2 | C15: 5 | D15: 0 | E15: 0 | F15: 0 | G15: 0 | H15: 0 | I15: 0 | J15: 0 | K15: 0 | L15: 0 | M15: 0 | N15: 73
A16: 14 | B16: 2 | C16: 6 | D16: 0 | E16: 0 | F16: 0 | G16: 0 | H16: 0 | I16: 0 | J16: 0 | K16: 0 | L16: 0 | M16: 0 | N16: 85
A17: 15 | B17: 3 | C17: 4 | D17: 0 | E17: 0 | F17: 0 | G17: 0 | H17: 0 | I17: 52 | J17: 52 | K17: 0 | L17: 0 | M17: 0 | N17: 24
A18: 16 | B18: 3 | C18: 5 | D18: 0 | E18: 0 | F18: 0 | G18: 0 | H18: 0 | I18: 39 | J18: 39 | K18: 0 | L18: 0 | M18: 0 | N18: 55
A19: 17 | B19: 3 | C19: 6 | D19: 0 | E19: 0 | F19: 0 | G19: 0 | H19: 0 | I19: 17 | J19: 0 | K19: 17 | L19: 0 | M19: 0 | N19: 67
A20: 18 | B20: 4 | C20: 5 | D20: 125 | E20: 0 | F20: 125 | G20: 0 | H20: 0 | I20: 0 | J20: 0 | K20: 0 | L20: 0 | M20: 0 | N20: 31
A21: 19 | B21: 4 | C21: 6 | D21: 0 | E21: 0 | F21: 0 | G21: 0 | H21: 0 | I21: 119 | J21: 16 | K21: 36 | L21: 0 | M21: 67 | N21: 43
A22: 20 | B22: 5 | C22: 6 | D22: 96 | E22: 0 | F22: 96 | G22: 0 | H22: 0 | I22: 15 | J22: 0 | K22: 15 | L22: 0 | M22: 0 | N22: 12
A23: Total | D23: =SUM(R[-21]C:R[-1]C) -> 2658 | E23: — | F23: — | G23: — | H23: — | I23: =SUM(R[-21]C:R[-1]C) -> 726 | J23: — | K23: — | L23: — | M23: —

Sheet: Scenario (4-1)
A1: Period 1 | B1: O | C1: D | D1: Number of passengers (person) | E1: Reservation slot 1 | F1: Reservation slot 2 | G1: Reservation slot 3 | H1: Reservation slot 4 | I1: Volume of goods (ton) | J1: Reservation slot 1 | K1: Reservation slot 2 | L1: Reservation slot 3 | M1: Reservation slot 4 | N1: Distance by rail | O1: Station No. | P1: Station name | Q1: Section distance
A2: 0 | B2: 0 | C2: 1 | D2: 319 | E2: 213 | F2: 106 | G2: 0 | H2: 0 | I2: 45 | J2: 10 | K2: 20 | L2: 15 | M2: 0 | N2: 29 | O2: 0 | P2: Shanghai Hongqiao
A3: 1 | B3: 0 | C3: 2 | D3: 269 | E3: 125 | F3: 0 | G3: 144 | H3: 0 | I3: 32 | J3: 20 | K3: 0 | L3: 12 | M3: 0 | N3: 73 | O3: 1 | P3: Songjiang South | Q3: 29
A4: 2 | B4: 0 | C4: 3 | D4: 453 | E4: 174 | F4: 0 | G4: 279 | H4: 0 | I4: 50 | J4: 30 | K4: 0 | L4: 20 | M4: 0 | N4: 91 | O4: 2 | P4: Jiashan North | Q4: 44
A5: 3 | B5: 0 | C5: 4 | D5: 471 | E5: 0 | F5: 213 | G5: 258 | H5: 0 | I5: 14 | J5: 0 | K5: 14 | L5: 0 | M5: 0 | N5: 115 | O5: 3 | P5: Jiaxing South | Q5: 18
A6: 4 | B6: 0 | C6: 5 | D6: 200 | E6: 0 | F6: 200 | G6: 0 | H6: 0 | I6: 15 | J6: 0 | K6: 15 | L6: 0 | M6: 0 | N6: 146 | O6: 4 | P6: Tongxiang | Q6: 24
A7: 5 | B7: 0 | C7: 6 | D7: 717 | E7: 405 | F7: 312 | G7: 0 | H7: 0 | I7: 88 | J7: 18 | K7: 40 | L7: 30 | M7: 0 | N7: 158 | O7: 5 | P7: Yuhang | Q7: 31
A8: 6 | B8: 1 | C8: 2 | D8: 124 | E8: 124 | F8: 0 | G8: 0 | H8: 0 | I8: 20 | J8: 20 | K8: 0 | L8: 0 | M8: 0 | N8: 44 | O8: 6 | P8: Hangzhou South | Q8: 12
A9: 7 | B9: 1 | C9: 3 | D9: 150 | E9: 0 | F9: 150 | G9: 0 | H9: 0 | I9: 18 | J9: 0 | K9: 18 | L9: 0 | M9: 0 | N9: 62 | O9: Total | Q9: 158
A10: 8 | B10: 1 | C10: 4 | D10: 362 | E10: 0 | F10: 0 | G10: 92 | H10: 270 | I10: 20 | J10: 0 | K10: 0 | L10: 0 | M10: 20 | N10: 86
A11: 9 | B11: 1 | C11: 5 | D11: 237 | E11: 0 | F11: 237 | G11: 0 | H11: 0 | I11: 0 | J11: 0 | K11: 0 | L11: 0 | M11: 0 | N11: 117
A12: 10 | B12: 1 | C12: 6 | D12: 395 | E12: 0 | F12: 185 | G12: 210 | H12: 0 | I12: 0 | J12: 0 | K12: 0 | L12: 0 | M12: 0 | N12: 129
A13: 11 | B13: 2 | C13: 3 | D13: 360 | E13: 210 | F13: 0 | G13: 150 | H13: 0 | I13: 12 | J13: 0 | K13: 0 | L13: 12 | M13: 0 | N13: 18
A14: 12 | B14: 2 | C14: 4 | D14: 166 | E14: 139 | F14: 0 | G14: 27 | H14: 0 | I14: 9 | J14: 0 | K14: 0 | L14: 9 | M14: 0 | N14: 42
A15: 13 | B15: 2 | C15: 5 | D15: 131 | E15: 0 | F15: 131 | G15: 0 | H15: 0 | I15: 0 | J15: 0 | K15: 0 | L15: 0 | M15: 0 | N15: 73
A16: 14 | B16: 2 | C16: 6 | D16: 95 | E16: 0 | F16: 0 | G16: 95 | H16: 0 | I16: 0 | J16: 0 | K16: 0 | L16: 0 | M16: 0 | N16: 85
A17: 15 | B17: 3 | C17: 4 | D17: 0 | E17: 0 | F17: 0 | G17: 0 | H17: 0 | I17: 30 | J17: 30 | K17: 0 | L17: 0 | M17: 0 | N17: 24
A18: 16 | B18: 3 | C18: 5 | D18: 0 | E18: 0 | F18: 0 | G18: 0 | H18: 0 | I18: 12 | J18: 12 | K18: 0 | L18: 0 | M18: 0 | N18: 55
A19: 17 | B19: 3 | C19: 6 | D19: 0 | E19: 0 | F19: 0 | G19: 0 | H19: 0 | I19: 7 | J19: 0 | K19: 7 | L19: 0 | M19: 0 | N19: 67
A20: 18 | B20: 4 | C20: 5 | D20: 396 | E20: 0 | F20: 125 | G20: 0 | H20: 271 | I20: 0 | J20: 0 | K20: 0 | L20: 0 | M20: 0 | N20: 31
A21: 19 | B21: 4 | C21: 6 | D21: 133 | E21: 0 | F21: 0 | G21: 133 | H21: 0 | I21: 50 | J21: 5 | K21: 30 | L21: 0 | M21: 15 | N21: 43
A22: 20 | B22: 5 | C22: 6 | D22: 250 | E22: 0 | F22: 250 | G22: 0 | H22: 0 | I22: 5 | J22: 0 | K22: 5 | L22: 0 | M22: 0 | N22: 12
A23: Total | D23: 5228 | E23: — | F23: — | G23: — | H23: — | I23: 427 | J23: — | K23: — | L23: — | M23: —

Sheet: Scenario (4-2)
A1: Period 1 | B1: O | C1: D | D1: Number of passengers (person) | E1: Reservation slot 1 | F1: Reservation slot 2 | G1: Volume of goods (ton) | H1: Reservation slot 1 | I1: Reservation slot 2 | J1: Distance by rail | K1: Station No. | L1: Station name | M1: Section distance
A2: 0 | B2: 0 | C2: 1 | D2: 319 | E2: 213 | F2: 106 | G2: 30 | H2: 10 | I2: 20 | J2: 29 | K2: 0 | L2: Shanghai Hongqiao
A3: 1 | B3: 0 | C3: 2 | D3: 125 | E3: 125 | F3: 0 | G3: 20 | H3: 20 | I3: 0 | J3: 73 | K3: 1 | L3: Songjiang South | M3: 29
A4: 2 | B4: 0 | C4: 3 | D4: 174 | E4: 174 | F4: 0 | G4: 30 | H4: 30 | I4: 0 | J4: 91 | K4: 2 | L4: Jiashan North | M4: 44
A5: 3 | B5: 0 | C5: 4 | D5: 213 | E5: 0 | F5: 213 | G5: 14 | H5: 0 | I5: 14 | J5: 115 | K5: 3 | L5: Jiaxing South | M5: 18
A6: 4 | B6: 0 | C6: 5 | D6: 200 | E6: 0 | F6: 200 | G6: 15 | H6: 0 | I6: 15 | J6: 146 | K6: 4 | L6: Tongxiang | M6: 24
A7: 5 | B7: 0 | C7: 6 | D7: 717 | E7: 405 | F7: 312 | G7: 58 | H7: 18 | I7: 40 | J7: 158 | K7: 5 | L7: Yuhang | M7: 31
A8: 6 | B8: 1 | C8: 2 | D8: 124 | E8: 124 | F8: 0 | G8: 20 | H8: 20 | I8: 0 | J8: 44 | K8: 6 | L8: Hangzhou South | M8: 12
A9: 7 | B9: 1 | C9: 3 | D9: 150 | E9: 0 | F9: 150 | G9: 18 | H9: 0 | I9: 18 | J9: 62 | K9: Total | M9: 158
A10: 8 | B10: 1 | C10: 4 | D10: 0 | E10: 0 | F10: 0 | G10: 0 | H10: 0 | I10: 0 | J10: 86
A11: 9 | B11: 1 | C11: 5 | D11: 237 | E11: 0 | F11: 237 | G11: 0 | H11: 0 | I11: 0 | J11: 117
A12: 10 | B12: 1 | C12: 6 | D12: 185 | E12: 0 | F12: 185 | G12: 0 | H12: 0 | I12: 0 | J12: 129
A13: 11 | B13: 2 | C13: 3 | D13: 210 | E13: 210 | F13: 0 | G13: 0 | H13: 0 | I13: 0 | J13: 18
A14: 12 | B14: 2 | C14: 4 | D14: 139 | E14: 139 | F14: 0 | G14: 0 | H14: 0 | I14: 0 | J14: 42
A15: 13 | B15: 2 | C15: 5 | D15: 131 | E15: 0 | F15: 131 | G15: 0 | H15: 0 | I15: 0 | J15: 73
A16: 14 | B16: 2 | C16: 6 | D16: 0 | E16: 0 | F16: 0 | G16: 0 | H16: 0 | I16: 0 | J16: 85
A17: 15 | B17: 3 | C17: 4 | D17: 0 | E17: 0 | F17: 0 | G17: 30 | H17: 30 | I17: 0 | J17: 24
A18: 16 | B18: 3 | C18: 5 | D18: 0 | E18: 0 | F18: 0 | G18: 12 | H18: 12 | I18: 0 | J18: 55
A19: 17 | B19: 3 | C19: 6 | D19: 0 | E19: 0 | F19: 0 | G19: 7 | H19: 0 | I19: 7 | J19: 67
A20: 18 | B20: 4 | C20: 5 | D20: 125 | E20: 0 | F20: 125 | G20: 0 | H20: 0 | I20: 0 | J20: 31
A21: 19 | B21: 4 | C21: 6 | D21: 0 | E21: 0 | F21: 0 | G21: 35 | H21: 5 | I21: 30 | J21: 43
A22: 20 | B22: 5 | C22: 6 | D22: 250 | E22: 0 | F22: 250 | G22: 5 | H22: 0 | I22: 5 | J22: 12
A23: Total | D23: =SUM(R[-21]C:R[-1]C) -> 3299 | E23: — | F23: — | G23: =SUM(R[-21]C:R[-1]C) -> 294 | H23: — | I23: —
A25: Period 2 | B25: O | C25: D | D25: Number of passengers (person) | E25: Reservation slot 3 | F25: Reservation slot 4 | G25: Volume of goods (ton) | H25: Reservation slot 3 | I25: Reservation slot 4 | J25: Distance by rail
A26: 0 | B26: 0 | C26: 1 | D26: 0 | E26: 0 | F26: 0 | G26: 15 | H26: 15 | I26: 0 | J26: 29
A27: 1 | B27: 0 | C27: 2 | D27: 144 | E27: 144 | F27: 0 | G27: 12 | H27: 12 | I27: 0 | J27: 73
A28: 2 | B28: 0 | C28: 3 | D28: 279 | E28: 279 | F28: 0 | G28: 20 | H28: 20 | I28: 0 | J28: 91
A29: 3 | B29: 0 | C29: 4 | D29: 258 | E29: 258 | F29: 0 | G29: 0 | H29: 0 | I29: 0 | J29: 115
A30: 4 | B30: 0 | C30: 5 | D30: 0 | E30: 0 | F30: 0 | G30: 0 | H30: 0 | I30: 0 | J30: 146
A31: 5 | B31: 0 | C31: 6 | D31: 0 | E31: 0 | F31: 0 | G31: 30 | H31: 30 | I31: 0 | J31: 158
A32: 6 | B32: 1 | C32: 2 | D32: 0 | E32: 0 | F32: 0 | G32: 0 | H32: 0 | I32: 0 | J32: 44
A33: 7 | B33: 1 | C33: 3 | D33: 0 | E33: 0 | F33: 0 | G33: 0 | H33: 0 | I33: 0 | J33: 62
A34: 8 | B34: 1 | C34: 4 | D34: 362 | E34: 92 | F34: 270 | G34: 20 | H34: 0 | I34: 20 | J34: 86
A35: 9 | B35: 1 | C35: 5 | D35: 0 | E35: 0 | F35: 0 | G35: 0 | H35: 0 | I35: 0 | J35: 117
A36: 10 | B36: 1 | C36: 6 | D36: 210 | E36: 210 | F36: 0 | G36: 0 | H36: 0 | I36: 0 | J36: 129
A37: 11 | B37: 2 | C37: 3 | D37: 150 | E37: 150 | F37: 0 | G37: 12 | H37: 12 | I37: 0 | J37: 18
A38: 12 | B38: 2 | C38: 4 | D38: 27 | E38: 27 | F38: 0 | G38: 9 | H38: 9 | I38: 0 | J38: 42
A39: 13 | B39: 2 | C39: 5 | D39: 0 | E39: 0 | F39: 0 | G39: 0 | H39: 0 | I39: 0 | J39: 73
A40: 14 | B40: 2 | C40: 6 | D40: 95 | E40: 95 | F40: 0 | G40: 0 | H40: 0 | I40: 0 | J40: 85
A41: 15 | B41: 3 | C41: 4 | D41: 0 | E41: 0 | F41: 0 | G41: 0 | H41: 0 | I41: 0 | J41: 24
A42: 16 | B42: 3 | C42: 5 | D42: 0 | E42: 0 | F42: 0 | G42: 0 | H42: 0 | I42: 0 | J42: 55
A43: 17 | B43: 3 | C43: 6 | D43: 0 | E43: 0 | F43: 0 | G43: 0 | H43: 0 | I43: 0 | J43: 67
A44: 18 | B44: 4 | C44: 5 | D44: 271 | E44: 0 | F44: 271 | G44: 0 | H44: 0 | I44: 0 | J44: 31
A45: 19 | B45: 4 | C45: 6 | D45: 133 | E45: 133 | F45: 0 | G45: 15 | H45: 0 | I45: 15 | J45: 43
A46: 20 | B46: 5 | C46: 6 | D46: 0 | E46: 0 | F46: 0 | G46: 0 | H46: 0 | I46: 0 | J46: 12
A47: Total | D47: =SUM(R[-21]C:R[-1]C) -> 1929 | E47: — | F47: — | G47: =SUM(R[-21]C:R[-1]C) -> 133 | H47: — | I47: —

Sheet: Scenario (4-3)
A1: Period 1 | B1: O | C1: D | D1: Number of passengers (person) | E1: Reservation slot 1 | F1: Volume of goods (ton) | G1: Reservation slot 1 | H1: Distance by rail | I1: Station No. | J1: Station name | K1: Section distance
A2: 0 | B2: 0 | C2: 1 | D2: 213 | E2: 213 | F2: 10 | G2: 10 | H2: 29 | I2: 0 | J2: Shanghai Hongqiao
A3: 1 | B3: 0 | C3: 2 | D3: 125 | E3: 125 | F3: 20 | G3: 20 | H3: 73 | I3: 1 | J3: Songjiang South | K3: 29
A4: 2 | B4: 0 | C4: 3 | D4: 174 | E4: 174 | F4: 30 | G4: 30 | H4: 91 | I4: 2 | J4: Jiashan North | K4: 44
A5: 3 | B5: 0 | C5: 4 | D5: 0 | E5: 0 | F5: 0 | G5: 0 | H5: 115 | I5: 3 | J5: Jiaxing South | K5: 18
A6: 4 | B6: 0 | C6: 5 | D6: 0 | E6: 0 | F6: 0 | G6: 0 | H6: 146 | I6: 4 | J6: Tongxiang | K6: 24
A7: 5 | B7: 0 | C7: 6 | D7: 405 | E7: 405 | F7: 18 | G7: 18 | H7: 158 | I7: 5 | J7: Yuhang | K7: 31
A8: 6 | B8: 1 | C8: 2 | D8: 124 | E8: 124 | F8: 20 | G8: 20 | H8: 44 | I8: 6 | J8: Hangzhou South | K8: 12
A9: 7 | B9: 1 | C9: 3 | D9: 0 | E9: 0 | F9: 0 | G9: 0 | H9: 62 | I9: Total | K9: 158
A10: 8 | B10: 1 | C10: 4 | D10: 0 | E10: 0 | F10: 0 | G10: 0 | H10: 86
A11: 9 | B11: 1 | C11: 5 | D11: 0 | E11: 0 | F11: 0 | G11: 0 | H11: 117
A12: 10 | B12: 1 | C12: 6 | D12: 0 | E12: 0 | F12: 0 | G12: 0 | H12: 129
A13: 11 | B13: 2 | C13: 3 | D13: 210 | E13: 210 | F13: 0 | G13: 0 | H13: 18
A14: 12 | B14: 2 | C14: 4 | D14: 139 | E14: 139 | F14: 0 | G14: 0 | H14: 42
A15: 13 | B15: 2 | C15: 5 | D15: 0 | E15: 0 | F15: 0 | G15: 0 | H15: 73
A16: 14 | B16: 2 | C16: 6 | D16: 0 | E16: 0 | F16: 0 | G16: 0 | H16: 85
A17: 15 | B17: 3 | C17: 4 | D17: 0 | E17: 0 | F17: 30 | G17: 30 | H17: 24
A18: 16 | B18: 3 | C18: 5 | D18: 0 | E18: 0 | F18: 12 | G18: 12 | H18: 55
A19: 17 | B19: 3 | C19: 6 | D19: 0 | E19: 0 | F19: 0 | G19: 0 | H19: 67
A20: 18 | B20: 4 | C20: 5 | D20: 0 | E20: 0 | F20: 0 | G20: 0 | H20: 31
A21: 19 | B21: 4 | C21: 6 | D21: 0 | E21: 0 | F21: 5 | G21: 5 | H21: 43
A22: 20 | B22: 5 | C22: 6 | D22: 0 | E22: 0 | F22: 0 | G22: 0 | H22: 12
A23: Total | D23: =SUM(R[-21]C:R[-1]C) -> 1390 | E23: — | F23: =SUM(R[-21]C:R[-1]C) -> 145 | G23: —
A25: Period 2 | B25: O | C25: D | D25: Number of passengers (person) | E25: Reservation slot 2 | F25: Volume of goods (ton) | G25: Reservation slot 2 | H25: Distance by rail
A26: 0 | B26: 0 | C26: 1 | D26: 106 | E26: 106 | F26: 20 | G26: 20 | H26: 29
A27: 1 | B27: 0 | C27: 2 | D27: 0 | E27: 0 | F27: 0 | G27: 0 | H27: 73
A28: 2 | B28: 0 | C28: 3 | D28: 0 | E28: 0 | F28: 0 | G28: 0 | H28: 91
A29: 3 | B29: 0 | C29: 4 | D29: 213 | E29: 213 | F29: 14 | G29: 14 | H29: 115
A30: 4 | B30: 0 | C30: 5 | D30: 200 | E30: 200 | F30: 15 | G30: 15 | H30: 146
A31: 5 | B31: 0 | C31: 6 | D31: 312 | E31: 312 | F31: 40 | G31: 40 | H31: 158
A32: 6 | B32: 1 | C32: 2 | D32: 0 | E32: 0 | F32: 0 | G32: 0 | H32: 44
A33: 7 | B33: 1 | C33: 3 | D33: 150 | E33: 150 | F33: 18 | G33: 18 | H33: 62
A34: 8 | B34: 1 | C34: 4 | D34: 0 | E34: 0 | F34: 0 | G34: 0 | H34: 86
A35: 9 | B35: 1 | C35: 5 | D35: 237 | E35: 237 | F35: 0 | G35: 0 | H35: 117
A36: 10 | B36: 1 | C36: 6 | D36: 185 | E36: 185 | F36: 0 | G36: 0 | H36: 129
A37: 11 | B37: 2 | C37: 3 | D37: 0 | E37: 0 | F37: 0 | G37: 0 | H37: 18
A38: 12 | B38: 2 | C38: 4 | D38: 0 | E38: 0 | F38: 0 | G38: 0 | H38: 42
A39: 13 | B39: 2 | C39: 5 | D39: 131 | E39: 131 | F39: 0 | G39: 0 | H39: 73
A40: 14 | B40: 2 | C40: 6 | D40: 0 | E40: 0 | F40: 0 | G40: 0 | H40: 85
A41: 15 | B41: 3 | C41: 4 | D41: 0 | E41: 0 | F41: 0 | G41: 0 | H41: 24
A42: 16 | B42: 3 | C42: 5 | D42: 0 | E42: 0 | F42: 0 | G42: 0 | H42: 55
A43: 17 | B43: 3 | C43: 6 | D43: 0 | E43: 0 | F43: 7 | G43: 7 | H43: 67
A44: 18 | B44: 4 | C44: 5 | D44: 125 | E44: 125 | F44: 0 | G44: 0 | H44: 31
A45: 19 | B45: 4 | C45: 6 | D45: 0 | E45: 0 | F45: 30 | G45: 30 | H45: 43
A46: 20 | B46: 5 | C46: 6 | D46: 250 | E46: 250 | F46: 5 | G46: 5 | H46: 12
A47: Total | D47: =SUM(R[-21]C:R[-1]C) -> 1909 | E47: — | F47: =SUM(R[-21]C:R[-1]C) -> 149 | G47: —
A49: Period 3 | B49: O | C49: D | D49: Number of passengers (person) | E49: Reservation slot 3 | F49: Volume of goods (ton) | G49: Reservation slot 3 | H49: Distance by rail
A50: 0 | B50: 0 | C50: 1 | D50: 0 | E50: 0 | F50: 15 | G50: 15 | H50: 29
A51: 1 | B51: 0 | C51: 2 | D51: 144 | E51: 144 | F51: 12 | G51: 12 | H51: 73
A52: 2 | B52: 0 | C52: 3 | D52: 279 | E52: 279 | F52: 20 | G52: 20 | H52: 91
A53: 3 | B53: 0 | C53: 4 | D53: 258 | E53: 258 | F53: 0 | G53: 0 | H53: 115
A54: 4 | B54: 0 | C54: 5 | D54: 0 | E54: 0 | F54: 0 | G54: 0 | H54: 146
A55: 5 | B55: 0 | C55: 6 | D55: 0 | E55: 0 | F55: 30 | G55: 30 | H55: 158
A56: 6 | B56: 1 | C56: 2 | D56: 0 | E56: 0 | F56: 0 | G56: 0 | H56: 44
A57: 7 | B57: 1 | C57: 3 | D57: 0 | E57: 0 | F57: 0 | G57: 0 | H57: 62
A58: 8 | B58: 1 | C58: 4 | D58: 92 | E58: 92 | F58: 0 | G58: 0 | H58: 86
A59: 9 | B59: 1 | C59: 5 | D59: 0 | E59: 0 | F59: 0 | G59: 0 | H59: 117
A60: 10 | B60: 1 | C60: 6 | D60: 210 | E60: 210 | F60: 0 | G60: 0 | H60: 129
A61: 11 | B61: 2 | C61: 3 | D61: 150 | E61: 150 | F61: 12 | G61: 12 | H61: 18
A62: 12 | B62: 2 | C62: 4 | D62: 27 | E62: 27 | F62: 9 | G62: 9 | H62: 42
A63: 13 | B63: 2 | C63: 5 | D63: 0 | E63: 0 | F63: 0 | G63: 0 | H63: 73
A64: 14 | B64: 2 | C64: 6 | D64: 95 | E64: 95 | F64: 0 | G64: 0 | H64: 85
A65: 15 | B65: 3 | C65: 4 | D65: 0 | E65: 0 | F65: 0 | G65: 0 | H65: 24
A66: 16 | B66: 3 | C66: 5 | D66: 0 | E66: 0 | F66: 0 | G66: 0 | H66: 55
A67: 17 | B67: 3 | C67: 6 | D67: 0 | E67: 0 | F67: 0 | G67: 0 | H67: 67
A68: 18 | B68: 4 | C68: 5 | D68: 0 | E68: 0 | F68: 0 | G68: 0 | H68: 31
A69: 19 | B69: 4 | C69: 6 | D69: 133 | E69: 133 | F69: 0 | G69: 0 | H69: 43
A70: 20 | B70: 5 | C70: 6 | D70: 0 | E70: 0 | F70: 0 | G70: 0 | H70: 12
A71: Total | D71: =SUM(R[-21]C:R[-1]C) -> 1388 | E71: — | F71: =SUM(R[-21]C:R[-1]C) -> 98 | G71: —
A73: Period 4 | B73: O | C73: D | D73: Number of passengers (person) | E73: Reservation slot 4 | F73: Volume of goods (ton) | G73: Reservation slot 4 | H73: Distance by rail
A74: 0 | B74: 0 | C74: 1 | D74: 0 | E74: 0 | F74: 0 | G74: 0 | H74: 29
A75: 1 | B75: 0 | C75: 2 | D75: 0 | E75: 0 | F75: 0 | G75: 0 | H75: 73
A76: 2 | B76: 0 | C76: 3 | D76: 0 | E76: 0 | F76: 0 | G76: 0 | H76: 91
A77: 3 | B77: 0 | C77: 4 | D77: 0 | E77: 0 | F77: 0 | G77: 0 | H77: 115
A78: 4 | B78: 0 | C78: 5 | D78: 0 | E78: 0 | F78: 0 | G78: 0 | H78: 146
A79: 5 | B79: 0 | C79: 6 | D79: 0 | E79: 0 | F79: 0 | G79: 0 | H79: 158
A80: 6 | B80: 1 | C80: 2 | D80: 0 | E80: 0 | F80: 0 | G80: 0 | H80: 44
A81: 7 | B81: 1 | C81: 3 | D81: 0 | E81: 0 | F81: 0 | G81: 0 | H81: 62
A82: 8 | B82: 1 | C82: 4 | D82: 270 | E82: 270 | F82: 20 | G82: 20 | H82: 86
A83: 9 | B83: 1 | C83: 5 | D83: 0 | E83: 0 | F83: 0 | G83: 0 | H83: 117
A84: 10 | B84: 1 | C84: 6 | D84: 0 | E84: 0 | F84: 0 | G84: 0 | H84: 129
A85: 11 | B85: 2 | C85: 3 | D85: 0 | E85: 0 | F85: 0 | G85: 0 | H85: 18
A86: 12 | B86: 2 | C86: 4 | D86: 0 | E86: 0 | F86: 0 | G86: 0 | H86: 42
A87: 13 | B87: 2 | C87: 5 | D87: 0 | E87: 0 | F87: 0 | G87: 0 | H87: 73
A88: 14 | B88: 2 | C88: 6 | D88: 0 | E88: 0 | F88: 0 | G88: 0 | H88: 85
A89: 15 | B89: 3 | C89: 4 | D89: 0 | E89: 0 | F89: 0 | G89: 0 | H89: 24
A90: 16 | B90: 3 | C90: 5 | D90: 0 | E90: 0 | F90: 0 | G90: 0 | H90: 55
A91: 17 | B91: 3 | C91: 6 | D91: 0 | E91: 0 | F91: 0 | G91: 0 | H91: 67
A92: 18 | B92: 4 | C92: 5 | D92: 271 | E92: 271 | F92: 0 | G92: 0 | H92: 31
A93: 19 | B93: 4 | C93: 6 | D93: 0 | E93: 0 | F93: 15 | G93: 15 | H93: 43
A94: 20 | B94: 5 | C94: 6 | D94: 0 | E94: 0 | F94: 0 | G94: 0 | H94: 12
A95: Total | D95: =SUM(R[-21]C:R[-1]C) -> 541 | E95: — | F95: =SUM(R[-21]C:R[-1]C) -> 35 | G95: —

Sheet: Scenario (4-4)
A1: Period 1 | B1: O | C1: D | D1: Number of passengers (person) | E1: Reservation slot 1 | F1: Volume of goods (ton) | G1: Reservation slot 1 | H1: Distance by rail | I1: Station No. | J1: Station name | K1: Section distance
A2: 0 | B2: 0 | C2: 1 | D2: 142 | E2: 142 | F2: 7 | G2: 7 | H2: 29 | I2: 0 | J2: Shanghai Hongqiao
A3: 1 | B3: 0 | C3: 2 | D3: 83 | E3: 83 | F3: 13 | G3: 13 | H3: 73 | I3: 1 | J3: Songjiang South | K3: 29
A4: 2 | B4: 0 | C4: 3 | D4: 116 | E4: 116 | F4: 20 | G4: 20 | H4: 91 | I4: 2 | J4: Jiashan North | K4: 44
A5: 3 | B5: 0 | C5: 4 | D5: 0 | E5: 0 | F5: 0 | G5: 0 | H5: 115 | I5: 3 | J5: Jiaxing South | K5: 18
A6: 4 | B6: 0 | C6: 5 | D6: 0 | E6: 0 | F6: 0 | G6: 0 | H6: 146 | I6: 4 | J6: Tongxiang | K6: 24
A7: 5 | B7: 0 | C7: 6 | D7: 270 | E7: 270 | F7: 12 | G7: 12 | H7: 158 | I7: 5 | J7: Yuhang | K7: 31
A8: 6 | B8: 1 | C8: 2 | D8: 82 | E8: 82 | F8: 13 | G8: 13 | H8: 44 | I8: 6 | J8: Hangzhou South | K8: 12
A9: 7 | B9: 1 | C9: 3 | D9: 0 | E9: 0 | F9: 0 | G9: 0 | H9: 62 | I9: Total | K9: 158
A10: 8 | B10: 1 | C10: 4 | D10: 0 | E10: 0 | F10: 0 | G10: 0 | H10: 86
A11: 9 | B11: 1 | C11: 5 | D11: 0 | E11: 0 | F11: 0 | G11: 0 | H11: 117
A12: 10 | B12: 1 | C12: 6 | D12: 0 | E12: 0 | F12: 0 | G12: 0 | H12: 129
A13: 11 | B13: 2 | C13: 3 | D13: 140 | E13: 140 | F13: 0 | G13: 0 | H13: 18
A14: 12 | B14: 2 | C14: 4 | D14: 92 | E14: 92 | F14: 0 | G14: 0 | H14: 42
A15: 13 | B15: 2 | C15: 5 | D15: 0 | E15: 0 | F15: 0 | G15: 0 | H15: 73
A16: 14 | B16: 2 | C16: 6 | D16: 0 | E16: 0 | F16: 0 | G16: 0 | H16: 85
A17: 15 | B17: 3 | C17: 4 | D17: 0 | E17: 0 | F17: 20 | G17: 20 | H17: 24
A18: 16 | B18: 3 | C18: 5 | D18: 0 | E18: 0 | F18: 9 | G18: 9 | H18: 55
A19: 17 | B19: 3 | C19: 6 | D19: 0 | E19: 0 | F19: 0 | G19: 0 | H19: 67
A20: 18 | B20: 4 | C20: 5 | D20: 125 | E20: 125 | F20: 0 | G20: 0 | H20: 31
A21: 19 | B21: 4 | C21: 6 | D21: 0 | E21: 0 | F21: 0 | G21: 0 | H21: 43
A22: 20 | B22: 5 | C22: 6 | D22: 0 | E22: 0 | F22: 0 | G22: 0 | H22: 12
A23: Total | D23: =SUM(R[-21]C:R[-1]C) -> 1050 | E23: — | F23: =SUM(R[-21]C:R[-1]C) -> 94 | G23: —
A25: Period 2 | B25: O | C25: D | D25: Number of passengers (person) | E25: Reservation slot 2 | F25: Volume of goods (ton) | G25: Reservation slot 2 | H25: Distance by rail
A26: 0 | B26: 0 | C26: 1 | D26: 147 | E26: 147 | F26: 9 | G26: 9 | H26: 29
A27: 1 | B27: 0 | C27: 2 | D27: 0 | E27: 0 | F27: 0 | G27: 0 | H27: 73
A28: 2 | B28: 0 | C28: 3 | D28: 0 | E28: 0 | F28: 0 | G28: 0 | H28: 91
A29: 3 | B29: 0 | C29: 4 | D29: 96 | E29: 96 | F29: 16 | G29: 16 | H29: 115
A30: 4 | B30: 0 | C30: 5 | D30: 89 | E30: 89 | F30: 7 | G30: 7 | H30: 146
A31: 5 | B31: 0 | C31: 6 | D31: 139 | E31: 139 | F31: 18 | G31: 18 | H31: 158
A32: 6 | B32: 1 | C32: 2 | D32: 0 | E32: 0 | F32: 0 | G32: 0 | H32: 44
A33: 7 | B33: 1 | C33: 3 | D33: 167 | E33: 167 | F33: 8 | G33: 8 | H33: 62
A34: 8 | B34: 1 | C34: 4 | D34: 0 | E34: 0 | F34: 0 | G34: 0 | H34: 86
A35: 9 | B35: 1 | C35: 5 | D35: 105 | E35: 105 | F35: 0 | G35: 0 | H35: 117
A36: 10 | B36: 1 | C36: 6 | D36: 82 | E36: 82 | F36: 0 | G36: 0 | H36: 129
A37: 11 | B37: 2 | C37: 3 | D37: 0 | E37: 0 | F37: 0 | G37: 0 | H37: 18
A38: 12 | B38: 2 | C38: 4 | D38: 0 | E38: 0 | F38: 0 | G38: 0 | H38: 42
A39: 13 | B39: 2 | C39: 5 | D39: 158 | E39: 158 | F39: 0 | G39: 0 | H39: 73
A40: 14 | B40: 2 | C40: 6 | D40: 0 | E40: 0 | F40: 0 | G40: 0 | H40: 85
A41: 15 | B41: 3 | C41: 4 | D41: 0 | E41: 0 | F41: 0 | G41: 0 | H41: 24
A42: 16 | B42: 3 | C42: 5 | D42: 0 | E42: 0 | F42: 0 | G42: 0 | H42: 55
A43: 17 | B43: 3 | C43: 6 | D43: 0 | E43: 0 | F43: 0 | G43: 0 | H43: 67
A44: 18 | B44: 4 | C44: 5 | D44: 97 | E44: 97 | F44: 10 | G44: 10 | H44: 31
A45: 19 | B45: 4 | C45: 6 | D45: 0 | E45: 0 | F45: 13 | G45: 13 | H45: 43
A46: 20 | B46: 5 | C46: 6 | D46: 111 | E46: 111 | F46: 18 | G46: 18 | H46: 12
A47: Total | D47: =SUM(R[-21]C:R[-1]C) -> 1191 | E47: — | F47: =SUM(R[-21]C:R[-1]C) -> 99 | G47: —
A49: Period 3 | B49: O | C49: D | D49: Number of passengers (person) | E49: Reservation slot 3 | F49: Volume of goods (ton) | G49: Reservation slot 3 | H49: Distance by rail
A50: 0 | B50: 0 | C50: 1 | D50: 128 | E50: 128 | F50: 15 | G50: 15 | H50: 29
A51: 1 | B51: 0 | C51: 2 | D51: 170 | E51: 170 | F51: 12 | G51: 12 | H51: 73
A52: 2 | B52: 0 | C52: 3 | D52: 97 | E52: 97 | F52: 20 | G52: 20 | H52: 91
A53: 3 | B53: 0 | C53: 4 | D53: 0 | E53: 0 | F53: 0 | G53: 0 | H53: 115
A54: 4 | B54: 0 | C54: 5 | D54: 0 | E54: 0 | F54: 0 | G54: 0 | H54: 146
A55: 5 | B55: 0 | C55: 6 | D55: 132 | E55: 132 | F55: 20 | G55: 20 | H55: 158
A56: 6 | B56: 1 | C56: 2 | D56: 269 | E56: 269 | F56: 0 | G56: 0 | H56: 44
A57: 7 | B57: 1 | C57: 3 | D57: 0 | E57: 0 | F57: 0 | G57: 0 | H57: 62
A58: 8 | B58: 1 | C58: 4 | D58: 0 | E58: 0 | F58: 0 | G58: 0 | H58: 86
A59: 9 | B59: 1 | C59: 5 | D59: 0 | E59: 0 | F59: 0 | G59: 0 | H59: 117
A60: 10 | B60: 1 | C60: 6 | D60: 0 | E60: 0 | F60: 0 | G60: 0 | H60: 129
A61: 11 | B61: 2 | C61: 3 | D61: 117 | E61: 117 | F61: 15 | G61: 15 | H61: 18
A62: 12 | B62: 2 | C62: 4 | D62: 145 | E62: 145 | F62: 19 | G62: 19 | H62: 42
A63: 13 | B63: 2 | C63: 5 | D63: 0 | E63: 0 | F63: 0 | G63: 0 | H63: 73
A64: 14 | B64: 2 | C64: 6 | D64: 0 | E64: 0 | F64: 0 | G64: 0 | H64: 85
A65: 15 | B65: 3 | C65: 4 | D65: 0 | E65: 0 | F65: 0 | G65: 0 | H65: 24
A66: 16 | B66: 3 | C66: 5 | D66: 0 | E66: 0 | F66: 0 | G66: 0 | H66: 55
A67: 17 | B67: 3 | C67: 6 | D67: 0 | E67: 0 | F67: 0 | G67: 0 | H67: 67
A68: 18 | B68: 4 | C68: 5 | D68: 0 | E68: 0 | F68: 0 | G68: 0 | H68: 31
A69: 19 | B69: 4 | C69: 6 | D69: 0 | E69: 0 | F69: 0 | G69: 0 | H69: 43
A70: 20 | B70: 5 | C70: 6 | D70: 0 | E70: 0 | F70: 0 | G70: 0 | H70: 12
A71: Total | D71: =SUM(R[-21]C:R[-1]C) -> 1058 | E71: — | F71: =SUM(R[-21]C:R[-1]C) -> 101 | G71: —
A73: Period 4 | B73: O | C73: D | D73: Number of passengers (person) | E73: Reservation slot 4 | F73: Volume of goods (ton) | G73: Reservation slot 4 | H73: Distance by rail
A74: 0 | B74: 0 | C74: 1 | D74: 0 | E74: 0 | F74: 10 | G74: 10 | H74: 29
A75: 1 | B75: 0 | C75: 2 | D75: 96 | E75: 96 | F75: 8 | G75: 8 | H75: 73
A76: 2 | B76: 0 | C76: 3 | D76: 186 | E76: 186 | F76: 13 | G76: 13 | H76: 91
A77: 3 | B77: 0 | C77: 4 | D77: 172 | E77: 172 | F77: 0 | G77: 0 | H77: 115
A78: 4 | B78: 0 | C78: 5 | D78: 0 | E78: 0 | F78: 0 | G78: 0 | H78: 146
A79: 5 | B79: 0 | C79: 6 | D79: 0 | E79: 0 | F79: 20 | G79: 20 | H79: 158
A80: 6 | B80: 1 | C80: 2 | D80: 0 | E80: 0 | F80: 0 | G80: 0 | H80: 44
A81: 7 | B81: 1 | C81: 3 | D81: 0 | E81: 0 | F81: 0 | G81: 0 | H81: 62
A82: 8 | B82: 1 | C82: 4 | D82: 61 | E82: 61 | F82: 0 | G82: 0 | H82: 86
A83: 9 | B83: 1 | C83: 5 | D83: 0 | E83: 0 | F83: 0 | G83: 0 | H83: 117
A84: 10 | B84: 1 | C84: 6 | D84: 140 | E84: 140 | F84: 0 | G84: 0 | H84: 129
A85: 11 | B85: 2 | C85: 3 | D85: 100 | E85: 100 | F85: 8 | G85: 8 | H85: 18
A86: 12 | B86: 2 | C86: 4 | D86: 18 | E86: 18 | F86: 6 | G86: 6 | H86: 42
A87: 13 | B87: 2 | C87: 5 | D87: 0 | E87: 0 | F87: 0 | G87: 0 | H87: 73
A88: 14 | B88: 2 | C88: 6 | D88: 63 | E88: 63 | F88: 0 | G88: 0 | H88: 85
A89: 15 | B89: 3 | C89: 4 | D89: 0 | E89: 0 | F89: 0 | G89: 0 | H89: 24
A90: 16 | B90: 3 | C90: 5 | D90: 0 | E90: 0 | F90: 0 | G90: 0 | H90: 55
A91: 17 | B91: 3 | C91: 6 | D91: 0 | E91: 0 | F91: 0 | G91: 0 | H91: 67
A92: 18 | B92: 4 | C92: 5 | D92: 0 | E92: 0 | F92: 0 | G92: 0 | H92: 31
A93: 19 | B93: 4 | C93: 6 | D93: 89 | E93: 89 | F93: 0 | G93: 0 | H93: 43
A94: 20 | B94: 5 | C94: 6 | D94: 0 | E94: 0 | F94: 0 | G94: 0 | H94: 12
A95: Total | D95: =SUM(R[-21]C:R[-1]C) -> 925 | E95: — | F95: =SUM(R[-21]C:R[-1]C) -> 65 | G95: —
A97: Period 5 | B97: O | C97: D | D97: Number of passengers (person) | E97: Reservation slot 5 | F97: Volume of goods (ton) | G97: Reservation slot 5 | H97: Distance by rail
A98: 0 | B98: 0 | C98: 1 | D98: 0 | E98: 0 | F98: 0 | G98: 0 | H98: 29
A99: 1 | B99: 0 | C99: 2 | D99: 0 | E99: 0 | F99: 0 | G99: 0 | H99: 73
A100: 2 | B100: 0 | C100: 3 | D100: 0 | E100: 0 | F100: 0 | G100: 0 | H100: 91
A101: 3 | B101: 0 | C101: 4 | D101: 0 | E101: 0 | F101: 0 | G101: 0 | H101: 115
A102: 4 | B102: 0 | C102: 5 | D102: 0 | E102: 0 | F102: 0 | G102: 0 | H102: 146
A103: 5 | B103: 0 | C103: 6 | D103: 0 | E103: 0 | F103: 0 | G103: 0 | H103: 158
A104: 6 | B104: 1 | C104: 2 | D104: 0 | E104: 0 | F104: 0 | G104: 0 | H104: 44
A105: 7 | B105: 1 | C105: 3 | D105: 0 | E105: 0 | F105: 0 | G105: 0 | H105: 62
A106: 8 | B106: 1 | C106: 4 | D106: 270 | E106: 270 | F106: 20 | G106: 20 | H106: 86
A107: 9 | B107: 1 | C107: 5 | D107: 0 | E107: 0 | F107: 0 | G107: 0 | H107: 117
A108: 10 | B108: 1 | C108: 6 | D108: 0 | E108: 0 | F108: 0 | G108: 0 | H108: 129
A109: 11 | B109: 2 | C109: 3 | D109: 0 | E109: 0 | F109: 0 | G109: 0 | H109: 18
A110: 12 | B110: 2 | C110: 4 | D110: 0 | E110: 0 | F110: 0 | G110: 0 | H110: 42
A111: 13 | B111: 2 | C111: 5 | D111: 0 | E111: 0 | F111: 0 | G111: 0 | H111: 73
A112: 14 | B112: 2 | C112: 6 | D112: 0 | E112: 0 | F112: 0 | G112: 0 | H112: 85
A113: 15 | B113: 3 | C113: 4 | D113: 0 | E113: 0 | F113: 0 | G113: 0 | H113: 24
A114: 16 | B114: 3 | C114: 5 | D114: 0 | E114: 0 | F114: 0 | G114: 0 | H114: 55
A115: 17 | B115: 3 | C115: 6 | D115: 0 | E115: 0 | F115: 0 | G115: 0 | H115: 67
A116: 18 | B116: 4 | C116: 5 | D116: 271 | E116: 271 | F116: 0 | G116: 0 | H116: 31
A117: 19 | B117: 4 | C117: 6 | D117: 0 | E117: 0 | F117: 15 | G117: 15 | H117: 43
A118: 20 | B118: 5 | C118: 6 | D118: 0 | E118: 0 | F118: 0 | G118: 0 | H118: 12
A119: Total | D119: =SUM(R[-21]C:R[-1]C) -> 541 | E119: — | F119: =SUM(R[-21]C:R[-1]C) -> 35 | G119: —
A121: Period 6 | B121: O | C121: D | D121: Number of passengers (person) | E121: Reservation slot 6 | F121: Volume of goods (ton) | G121: Reservation slot 6 | H121: Distance by rail
A122: 0 | B122: 0 | C122: 1 | D122: 0 | E122: 0 | F122: 0 | G122: 0 | H122: 29
A123: 1 | B123: 0 | C123: 2 | D123: 0 | E123: 0 | F123: 0 | G123: 0 | H123: 73
A124: 2 | B124: 0 | C124: 3 | D124: 0 | E124: 0 | F124: 0 | G124: 0 | H124: 91
A125: 3 | B125: 0 | C125: 4 | D125: 0 | E125: 0 | F125: 0 | G125: 0 | H125: 115
A126: 4 | B126: 0 | C126: 5 | D126: 0 | E126: 0 | F126: 0 | G126: 0 | H126: 146
A127: 5 | B127: 0 | C127: 6 | D127: 0 | E127: 0 | F127: 0 | G127: 0 | H127: 158
A128: 6 | B128: 1 | C128: 2 | D128: 0 | E128: 0 | F128: 0 | G128: 0 | H128: 44
A129: 7 | B129: 1 | C129: 3 | D129: 0 | E129: 0 | F129: 0 | G129: 0 | H129: 62
A130: 8 | B130: 1 | C130: 4 | D130: 270 | E130: 270 | F130: 20 | G130: 20 | H130: 86
A131: 9 | B131: 1 | C131: 5 | D131: 0 | E131: 0 | F131: 0 | G131: 0 | H131: 117
A132: 10 | B132: 1 | C132: 6 | D132: 0 | E132: 0 | F132: 0 | G132: 0 | H132: 129
A133: 11 | B133: 2 | C133: 3 | D133: 0 | E133: 0 | F133: 0 | G133: 0 | H133: 18
A134: 12 | B134: 2 | C134: 4 | D134: 0 | E134: 0 | F134: 0 | G134: 0 | H134: 42
A135: 13 | B135: 2 | C135: 5 | D135: 0 | E135: 0 | F135: 0 | G135: 0 | H135: 73
A136: 14 | B136: 2 | C136: 6 | D136: 0 | E136: 0 | F136: 0 | G136: 0 | H136: 85
A137: 15 | B137: 3 | C137: 4 | D137: 0 | E137: 0 | F137: 0 | G137: 0 | H137: 24
A138: 16 | B138: 3 | C138: 5 | D138: 0 | E138: 0 | F138: 0 | G138: 0 | H138: 55
A139: 17 | B139: 3 | C139: 6 | D139: 0 | E139: 0 | F139: 0 | G139: 0 | H139: 67
A140: 18 | B140: 4 | C140: 5 | D140: 193 | E140: 193 | F140: 0 | G140: 0 | H140: 31
A141: 19 | B141: 4 | C141: 6 | D141: 0 | E141: 0 | F141: 13 | G141: 13 | H141: 43
A142: 20 | B142: 5 | C142: 6 | D142: 0 | E142: 0 | F142: 0 | G142: 0 | H142: 12
A143: Total | D143: =SUM(R[-21]C:R[-1]C) -> 463 | E143: — | F143: =SUM(R[-21]C:R[-1]C) -> 33 | G143: —

Sheet: Scenario (4-5)
A1: Period 1 | B1: O | C1: D | D1: Number of passengers (person) | E1: Reservation slot 1 | F1: Volume of goods (ton) | G1: Reservation slot 1 | H1: Distance by rail | I1: Station No. | J1: Station name | K1: Section distance
A2: 0 | B2: 0 | C2: 1 | D2: 107 | E2: 107 | F2: 5 | G2: 5 | H2: 29 | I2: 0 | J2: Shanghai Hongqiao
A3: 1 | B3: 0 | C3: 2 | D3: 63 | E3: 63 | F3: 10 | G3: 10 | H3: 73 | I3: 1 | J3: Songjiang South | K3: 29
A4: 2 | B4: 0 | C4: 3 | D4: 87 | E4: 87 | F4: 15 | G4: 15 | H4: 91 | I4: 2 | J4: Jiashan North | K4: 44
A5: 3 | B5: 0 | C5: 4 | D5: 0 | E5: 0 | F5: 0 | G5: 0 | H5: 115 | I5: 3 | J5: Jiaxing South | K5: 18
A6: 4 | B6: 0 | C6: 5 | D6: 0 | E6: 0 | F6: 0 | G6: 0 | H6: 146 | I6: 4 | J6: Tongxiang | K6: 24
A7: 5 | B7: 0 | C7: 6 | D7: 203 | E7: 203 | F7: 9 | G7: 9 | H7: 158 | I7: 5 | J7: Yuhang | K7: 31
A8: 6 | B8: 1 | C8: 2 | D8: 62 | E8: 62 | F8: 10 | G8: 10 | H8: 44 | I8: 6 | J8: Hangzhou South | K8: 12
A9: 7 | B9: 1 | C9: 3 | D9: 0 | E9: 0 | F9: 0 | G9: 0 | H9: 62 | I9: Total | K9: 158
A10: 8 | B10: 1 | C10: 4 | D10: 0 | E10: 0 | F10: 0 | G10: 0 | H10: 86
A11: 9 | B11: 1 | C11: 5 | D11: 0 | E11: 0 | F11: 0 | G11: 0 | H11: 117
A12: 10 | B12: 1 | C12: 6 | D12: 0 | E12: 0 | F12: 0 | G12: 0 | H12: 129
A13: 11 | B13: 2 | C13: 3 | D13: 105 | E13: 105 | F13: 0 | G13: 0 | H13: 18
A14: 12 | B14: 2 | C14: 4 | D14: 70 | E14: 70 | F14: 0 | G14: 0 | H14: 42
A15: 13 | B15: 2 | C15: 5 | D15: 0 | E15: 0 | F15: 0 | G15: 0 | H15: 73
A16: 14 | B16: 2 | C16: 6 | D16: 0 | E16: 0 | F16: 0 | G16: 0 | H16: 85
A17: 15 | B17: 3 | C17: 4 | D17: 0 | E17: 0 | F17: 15 | G17: 15 | H17: 24
A18: 16 | B18: 3 | C18: 5 | D18: 0 | E18: 0 | F18: 6 | G18: 6 | H18: 55
A19: 17 | B19: 3 | C19: 6 | D19: 0 | E19: 0 | F19: 0 | G19: 0 | H19: 67
A20: 18 | B20: 4 | C20: 5 | D20: 0 | E20: 0 | F20: 0 | G20: 0 | H20: 31
A21: 19 | B21: 4 | C21: 6 | D21: 0 | E21: 0 | F21: 3 | G21: 3 | H21: 43
A22: 20 | B22: 5 | C22: 6 | D22: 0 | E22: 0 | F22: 0 | G22: 0 | H22: 12
A23: Total | D23: =SUM(R[-21]C:R[-1]C) -> 697 | E23: — | F23: =SUM(R[-21]C:R[-1]C) -> 73 | G23: —
A25: Period 2 | B25: O | C25: D | D25: Number of passengers (person) | E25: Reservation slot 2 | F25: Volume of goods (ton) | G25: Reservation slot 2 | H25: Distance by rail
A26: 0 | B26: 0 | C26: 1 | D26: 106 | E26: 106 | F26: 5 | G26: 5 | H26: 29
A27: 1 | B27: 0 | C27: 2 | D27: 62 | E27: 62 | F27: 10 | G27: 10 | H27: 73
A28: 2 | B28: 0 | C28: 3 | D28: 87 | E28: 87 | F28: 15 | G28: 15 | H28: 91
A29: 3 | B29: 0 | C29: 4 | D29: 0 | E29: 0 | F29: 0 | G29: 0 | H29: 115
A30: 4 | B30: 0 | C30: 5 | D30: 0 | E30: 0 | F30: 0 | G30: 0 | H30: 146
A31: 5 | B31: 0 | C31: 6 | D31: 202 | E31: 202 | F31: 9 | G31: 9 | H31: 158
A32: 6 | B32: 1 | C32: 2 | D32: 62 | E32: 62 | F32: 10 | G32: 10 | H32: 44
A33: 7 | B33: 1 | C33: 3 | D33: 0 | E33: 0 | F33: 0 | G33: 0 | H33: 62
A34: 8 | B34: 1 | C34: 4 | D34: 0 | E34: 0 | F34: 0 | G34: 0 | H34: 86
A35: 9 | B35: 1 | C35: 5 | D35: 0 | E35: 0 | F35: 0 | G35: 0 | H35: 117
A36: 10 | B36: 1 | C36: 6 | D36: 0 | E36: 0 | F36: 0 | G36: 0 | H36: 129
A37: 11 | B37: 2 | C37: 3 | D37: 105 | E37: 105 | F37: 0 | G37: 0 | H37: 18
A38: 12 | B38: 2 | C38: 4 | D38: 69 | E38: 69 | F38: 0 | G38: 0 | H38: 42
A39: 13 | B39: 2 | C39: 5 | D39: 0 | E39: 0 | F39: 0 | G39: 0 | H39: 73
A40: 14 | B40: 2 | C40: 6 | D40: 0 | E40: 0 | F40: 0 | G40: 0 | H40: 85
A41: 15 | B41: 3 | C41: 4 | D41: 0 | E41: 0 | F41: 15 | G41: 15 | H41: 24
A42: 16 | B42: 3 | C42: 5 | D42: 0 | E42: 0 | F42: 6 | G42: 6 | H42: 55
A43: 17 | B43: 3 | C43: 6 | D43: 0 | E43: 0 | F43: 0 | G43: 0 | H43: 67
A44: 18 | B44: 4 | C44: 5 | D44: 0 | E44: 0 | F44: 0 | G44: 0 | H44: 31
A45: 19 | B45: 4 | C45: 6 | D45: 0 | E45: 0 | F45: 2 | G45: 2 | H45: 43
A46: 20 | B46: 5 | C46: 6 | D46: 0 | E46: 0 | F46: 0 | G46: 0 | H46: 12
A47: Total | D47: =SUM(R[-21]C:R[-1]C) -> 693 | E47: — | F47: =SUM(R[-21]C:R[-1]C) -> 72 | G47: —
A49: Period 3 | B49: O | C49: D | D49: Number of passengers (person) | E49: Reservation slot 3 | F49: Volume of goods (ton) | G49: Reservation slot 3 | H49: Distance by rail
A50: 0 | B50: 0 | C50: 1 | D50: 53 | E50: 53 | F50: 10 | G50: 10 | H50: 29
A51: 1 | B51: 0 | C51: 2 | D51: 0 | E51: 0 | F51: 0 | G51: 0 | H51: 73
A52: 2 | B52: 0 | C52: 3 | D52: 0 | E52: 0 | F52: 0 | G52: 0 | H52: 91
A53: 3 | B53: 0 | C53: 4 | D53: 107 | E53: 107 | F53: 7 | G53: 7 | H53: 115
A54: 4 | B54: 0 | C54: 5 | D54: 100 | E54: 100 | F54: 8 | G54: 8 | H54: 146
A55: 5 | B55: 0 | C55: 6 | D55: 156 | E55: 156 | F55: 20 | G55: 20 | H55: 158
A56: 6 | B56: 1 | C56: 2 | D56: 0 | E56: 0 | F56: 0 | G56: 0 | H56: 44
A57: 7 | B57: 1 | C57: 3 | D57: 75 | E57: 75 | F57: 9 | G57: 9 | H57: 62
A58: 8 | B58: 1 | C58: 4 | D58: 0 | E58: 0 | F58: 0 | G58: 0 | H58: 86
A59: 9 | B59: 1 | C59: 5 | D59: 119 | E59: 119 | F59: 0 | G59: 0 | H59: 117
A60: 10 | B60: 1 | C60: 6 | D60: 93 | E60: 93 | F60: 0 | G60: 0 | H60: 129
A61: 11 | B61: 2 | C61: 3 | D61: 0 | E61: 0 | F61: 0 | G61: 0 | H61: 18
A62: 12 | B62: 2 | C62: 4 | D62: 0 | E62: 0 | F62: 0 | G62: 0 | H62: 42
A63: 13 | B63: 2 | C63: 5 | D63: 67 | E63: 67 | F63: 0 | G63: 0 | H63: 73
A64: 14 | B64: 2 | C64: 6 | D64: 0 | E64: 0 | F64: 0 | G64: 0 | H64: 85
A65: 15 | B65: 3 | C65: 4 | D65: 0 | E65: 0 | F65: 0 | G65: 0 | H65: 24
A66: 16 | B66: 3 | C66: 5 | D66: 0 | E66: 0 | F66: 0 | G66: 0 | H66: 55
A67: 17 | B67: 3 | C67: 6 | D67: 0 | E67: 0 | F67: 4 | G67: 4 | H67: 67
A68: 18 | B68: 4 | C68: 5 | D68: 63 | E68: 63 | F68: 0 | G68: 0 | H68: 31
A69: 19 | B69: 4 | C69: 6 | D69: 0 | E69: 0 | F69: 15 | G69: 15 | H69: 43
A70: 20 | B70: 5 | C70: 6 | D70: 125 | E70: 125 | F70: 3 | G70: 3 | H70: 12
A71: Total | D71: =SUM(R[-21]C:R[-1]C) -> 958 | E71: — | F71: =SUM(R[-21]C:R[-1]C) -> 76 | G71: —
A73: Period 4 | B73: O | C73: D | D73: Number of passengers (person) | E73: Reservation slot 4 | F73: Volume of goods (ton) | G73: Reservation slot 4 | H73: Distance by rail
A74: 0 | B74: 0 | C74: 1 | D74: 53 | E74: 53 | F74: 10 | G74: 10 | H74: 29
A75: 1 | B75: 0 | C75: 2 | D75: 0 | E75: 0 | F75: 0 | G75: 0 | H75: 73
A76: 2 | B76: 0 | C76: 3 | D76: 0 | E76: 0 | F76: 0 | G76: 0 | H76: 91
A77: 3 | B77: 0 | C77: 4 | D77: 106 | E77: 106 | F77: 7 | G77: 7 | H77: 115
A78: 4 | B78: 0 | C78: 5 | D78: 100 | E78: 100 | F78: 7 | G78: 7 | H78: 146
A79: 5 | B79: 0 | C79: 6 | D79: 156 | E79: 156 | F79: 20 | G79: 20 | H79: 158
A80: 6 | B80: 1 | C80: 2 | D80: 0 | E80: 0 | F80: 0 | G80: 0 | H80: 44
A81: 7 | B81: 1 | C81: 3 | D81: 75 | E81: 75 | F81: 9 | G81: 9 | H81: 62
A82: 8 | B82: 1 | C82: 4 | D82: 0 | E82: 0 | F82: 0 | G82: 0 | H82: 86
A83: 9 | B83: 1 | C83: 5 | D83: 118 | E83: 118 | F83: 0 | G83: 0 | H83: 117
A84: 10 | B84: 1 | C84: 6 | D84: 92 | E84: 92 | F84: 0 | G84: 0 | H84: 129
A85: 11 | B85: 2 | C85: 3 | D85: 0 | E85: 0 | F85: 0 | G85: 0 | H85: 18
A86: 12 | B86: 2 | C86: 4 | D86: 0 | E86: 0 | F86: 0 | G86: 0 | H86: 42
A87: 13 | B87: 2 | C87: 5 | D87: 65 | E87: 65 | F87: 0 | G87: 0 | H87: 73
A88: 14 | B88: 2 | C88: 6 | D88: 0 | E88: 0 | F88: 0 | G88: 0 | H88: 85
A89: 15 | B89: 3 | C89: 4 | D89: 0 | E89: 0 | F89: 0 | G89: 0 | H89: 24
A90: 16 | B90: 3 | C90: 5 | D90: 0 | E90: 0 | F90: 0 | G90: 0 | H90: 55
A91: 17 | B91: 3 | C91: 6 | D91: 0 | E91: 0 | F91: 3 | G91: 3 | H91: 67
A92: 18 | B92: 4 | C92: 5 | D92: 62 | E92: 62 | F92: 0 | G92: 0 | H92: 31
A93: 19 | B93: 4 | C93: 6 | D93: 0 | E93: 0 | F93: 15 | G93: 15 | H93: 43
A94: 20 | B94: 5 | C94: 6 | D94: 125 | E94: 125 | F94: 2 | G94: 2 | H94: 12
A95: Total | D95: =SUM(R[-21]C:R[-1]C) -> 952 | E95: — | F95: =SUM(R[-21]C:R[-1]C) -> 73 | G95: —
A97: Period 5 | B97: O | C97: D | D97: Number of passengers (person) | E97: Reservation slot 5 | F97: Volume of goods (ton) | G97: Reservation slot 5 | H97: Distance by rail
A98: 0 | B98: 0 | C98: 1 | D98: 0 | E98: 0 | F98: 8 | G98: 8 | H98: 29
A99: 1 | B99: 0 | C99: 2 | D99: 72 | E99: 72 | F99: 6 | G99: 6 | H99: 73
A100: 2 | B100: 0 | C100: 3 | D100: 140 | E100: 140 | F100: 10 | G100: 10 | H100: 91
A101: 3 | B101: 0 | C101: 4 | D101: 129 | E101: 129 | F101: 0 | G101: 0 | H101: 115
A102: 4 | B102: 0 | C102: 5 | D102: 0 | E102: 0 | F102: 0 | G102: 0 | H102: 146
A103: 5 | B103: 0 | C103: 6 | D103: 0 | E103: 0 | F103: 15 | G103: 15 | H103: 158
A104: 6 | B104: 1 | C104: 2 | D104: 0 | E104: 0 | F104: 0 | G104: 0 | H104: 44
A105: 7 | B105: 1 | C105: 3 | D105: 0 | E105: 0 | F105: 0 | G105: 0 | H105: 62
A106: 8 | B106: 1 | C106: 4 | D106: 46 | E106: 46 | F106: 0 | G106: 0 | H106: 86
A107: 9 | B107: 1 | C107: 5 | D107: 0 | E107: 0 | F107: 0 | G107: 0 | H107: 117
A108: 10 | B108: 1 | C108: 6 | D108: 105 | E108: 105 | F108: 0 | G108: 0 | H108: 129
A109: 11 | B109: 2 | C109: 3 | D109: 75 | E109: 75 | F109: 6 | G109: 6 | H109: 18
A110: 12 | B110: 2 | C110: 4 | D110: 14 | E110: 14 | F110: 5 | G110: 5 | H110: 42
A111: 13 | B111: 2 | C111: 5 | D111: 0 | E111: 0 | F111: 0 | G111: 0 | H111: 73
A112: 14 | B112: 2 | C112: 6 | D112: 48 | E112: 48 | F112: 0 | G112: 0 | H112: 85
A113: 15 | B113: 3 | C113: 4 | D113: 0 | E113: 0 | F113: 0 | G113: 0 | H113: 24
A114: 16 | B114: 3 | C114: 5 | D114: 0 | E114: 0 | F114: 0 | G114: 0 | H114: 55
A115: 17 | B115: 3 | C115: 6 | D115: 0 | E115: 0 | F115: 0 | G115: 0 | H115: 67
A116: 18 | B116: 4 | C116: 5 | D116: 0 | E116: 0 | F116: 0 | G116: 0 | H116: 31
A117: 19 | B117: 4 | C117: 6 | D117: 67 | E117: 67 | F117: 0 | G117: 0 | H117: 43
A118: 20 | B118: 5 | C118: 6 | D118: 0 | E118: 0 | F118: 0 | G118: 0 | H118: 12
A119: Total | D119: =SUM(R[-21]C:R[-1]C) -> 696 | E119: — | F119: =SUM(R[-21]C:R[-1]C) -> 50 | G119: —
A121: Period 6 | B121: O | C121: D | D121: Number of passengers (person) | E121: Reservation slot 6 | F121: Volume of goods (ton) | G121: Reservation slot 6 | H121: Distance by rail
A122: 0 | B122: 0 | C122: 1 | D122: 0 | E122: 0 | F122: 7 | G122: 7 | H122: 29
A123: 1 | B123: 0 | C123: 2 | D123: 72 | E123: 72 | F123: 6 | G123: 6 | H123: 73
A124: 2 | B124: 0 | C124: 3 | D124: 139 | E124: 139 | F124: 10 | G124: 10 | H124: 91
A125: 3 | B125: 0 | C125: 4 | D125: 129 | E125: 129 | F125: 0 | G125: 0 | H125: 115
A126: 4 | B126: 0 | C126: 5 | D126: 0 | E126: 0 | F126: 0 | G126: 0 | H126: 146
A127: 5 | B127: 0 | C127: 6 | D127: 0 | E127: 0 | F127: 15 | G127: 15 | H127: 158
A128: 6 | B128: 1 | C128: 2 | D128: 0 | E128: 0 | F128: 0 | G128: 0 | H128: 44
A129: 7 | B129: 1 | C129: 3 | D129: 0 | E129: 0 | F129: 0 | G129: 0 | H129: 62
A130: 8 | B130: 1 | C130: 4 | D130: 46 | E130: 46 | F130: 0 | G130: 0 | H130: 86
A131: 9 | B131: 1 | C131: 5 | D131: 0 | E131: 0 | F131: 0 | G131: 0 | H131: 117
A132: 10 | B132: 1 | C132: 6 | D132: 105 | E132: 105 | F132: 0 | G132: 0 | H132: 129
A133: 11 | B133: 2 | C133: 3 | D133: 75 | E133: 75 | F133: 6 | G133: 6 | H133: 18
A134: 12 | B134: 2 | C134: 4 | D134: 13 | E134: 13 | F134: 4 | G134: 4 | H134: 42
A135: 13 | B135: 2 | C135: 5 | D135: 0 | E135: 0 | F135: 0 | G135: 0 | H135: 73
A136: 14 | B136: 2 | C136: 6 | D136: 47 | E136: 47 | F136: 0 | G136: 0 | H136: 85
A137: 15 | B137: 3 | C137: 4 | D137: 0 | E137: 0 | F137: 0 | G137: 0 | H137: 24
A138: 16 | B138: 3 | C138: 5 | D138: 0 | E138: 0 | F138: 0 | G138: 0 | H138: 55
A139: 17 | B139: 3 | C139: 6 | D139: 0 | E139: 0 | F139: 0 | G139: 0 | H139: 67
A140: 18 | B140: 4 | C140: 5 | D140: 0 | E140: 0 | F140: 0 | G140: 0 | H140: 31
A141: 19 | B141: 4 | C141: 6 | D141: 66 | E141: 66 | F141: 0 | G141: 0 | H141: 43
A142: 20 | B142: 5 | C142: 6 | D142: 0 | E142: 0 | F142: 0 | G142: 0 | H142: 12
A143: Total | D143: =SUM(R[-21]C:R[-1]C) -> 692 | E143: — | F143: =SUM(R[-21]C:R[-1]C) -> 48 | G143: —
A145: Period 7 | B145: O | C145: D | D145: Number of passengers (person) | E145: Reservation slot 7 | F145: Volume of goods (ton) | G145: Reservation slot 7 | H145: Distance by rail
A146: 0 | B146: 0 | C146: 1 | D146: 0 | E146: 0 | F146: 0 | G146: 0 | H146: 29
A147: 1 | B147: 0 | C147: 2 | D147: 0 | E147: 0 | F147: 0 | G147: 0 | H147: 73
A148: 2 | B148: 0 | C148: 3 | D148: 0 | E148: 0 | F148: 0 | G148: 0 | H148: 91
A149: 3 | B149: 0 | C149: 4 | D149: 0 | E149: 0 | F149: 0 | G149: 0 | H149: 115
A150: 4 | B150: 0 | C150: 5 | D150: 0 | E150: 0 | F150: 0 | G150: 0 | H150: 146
A151: 5 | B151: 0 | C151: 6 | D151: 0 | E151: 0 | F151: 0 | G151: 0 | H151: 158
A152: 6 | B152: 1 | C152: 2 | D152: 0 | E152: 0 | F152: 0 | G152: 0 | H152: 44
A153: 7 | B153: 1 | C153: 3 | D153: 0 | E153: 0 | F153: 0 | G153: 0 | H153: 62
A154: 8 | B154: 1 | C154: 4 | D154: 135 | E154: 135 | F154: 10 | G154: 10 | H154: 86
A155: 9 | B155: 1 | C155: 5 | D155: 0 | E155: 0 | F155: 0 | G155: 0 | H155: 117
A156: 10 | B156: 1 | C156: 6 | D156: 0 | E156: 0 | F156: 0 | G156: 0 | H156: 129
A157: 11 | B157: 2 | C157: 3 | D157: 0 | E157: 0 | F157: 0 | G157: 0 | H157: 18
A158: 12 | B158: 2 | C158: 4 | D158: 0 | E158: 0 | F158: 0 | G158: 0 | H158: 42
A159: 13 | B159: 2 | C159: 5 | D159: 0 | E159: 0 | F159: 0 | G159: 0 | H159: 73
A160: 14 | B160: 2 | C160: 6 | D160: 0 | E160: 0 | F160: 0 | G160: 0 | H160: 85
A161: 15 | B161: 3 | C161: 4 | D161: 0 | E161: 0 | F161: 0 | G161: 0 | H161: 24
A162: 16 | B162: 3 | C162: 5 | D162: 0 | E162: 0 | F162: 0 | G162: 0 | H162: 55
A163: 17 | B163: 3 | C163: 6 | D163: 0 | E163: 0 | F163: 0 | G163: 0 | H163: 67
A164: 18 | B164: 4 | C164: 5 | D164: 136 | E164: 136 | F164: 0 | G164: 0 | H164: 31
A165: 19 | B165: 4 | C165: 6 | D165: 0 | E165: 0 | F165: 8 | G165: 8 | H165: 43
A166: 20 | B166: 5 | C166: 6 | D166: 0 | E166: 0 | F166: 0 | G166: 0 | H166: 12
A167: Total | D167: =SUM(R[-21]C:R[-1]C) -> 271 | E167: — | F167: =SUM(R[-21]C:R[-1]C) -> 18 | G167: —
A169: Period 8 | B169: O | C169: D | D169: Number of passengers (person) | E169: Reservation slot 8 | F169: Volume of goods (ton) | G169: Reservation slot 8 | H169: Distance by rail
A170: 0 | B170: 0 | C170: 1 | D170: 0 | E170: 0 | F170: 0 | G170: 0 | H170: 29
A171: 1 | B171: 0 | C171: 2 | D171: 0 | E171: 0 | F171: 0 | G171: 0 | H171: 73
A172: 2 | B172: 0 | C172: 3 | D172: 0 | E172: 0 | F172: 0 | G172: 0 | H172: 91
A173: 3 | B173: 0 | C173: 4 | D173: 0 | E173: 0 | F173: 0 | G173: 0 | H173: 115
A174: 4 | B174: 0 | C174: 5 | D174: 0 | E174: 0 | F174: 0 | G174: 0 | H174: 146
A175: 5 | B175: 0 | C175: 6 | D175: 0 | E175: 0 | F175: 0 | G175: 0 | H175: 158
A176: 6 | B176: 1 | C176: 2 | D176: 0 | E176: 0 | F176: 0 | G176: 0 | H176: 44
A177: 7 | B177: 1 | C177: 3 | D177: 0 | E177: 0 | F177: 0 | G177: 0 | H177: 62
A178: 8 | B178: 1 | C178: 4 | D178: 135 | E178: 135 | F178: 10 | G178: 10 | H178: 86
A179: 9 | B179: 1 | C179: 5 | D179: 0 | E179: 0 | F179: 0 | G179: 0 | H179: 117
A180: 10 | B180: 1 | C180: 6 | D180: 0 | E180: 0 | F180: 0 | G180: 0 | H180: 129
A181: 11 | B181: 2 | C181: 3 | D181: 0 | E181: 0 | F181: 0 | G181: 0 | H181: 18
A182: 12 | B182: 2 | C182: 4 | D182: 0 | E182: 0 | F182: 0 | G182: 0 | H182: 42
A183: 13 | B183: 2 | C183: 5 | D183: 0 | E183: 0 | F183: 0 | G183: 0 | H183: 73
A184: 14 | B184: 2 | C184: 6 | D184: 0 | E184: 0 | F184: 0 | G184: 0 | H184: 85
A185: 15 | B185: 3 | C185: 4 | D185: 0 | E185: 0 | F185: 0 | G185: 0 | H185: 24
A186: 16 | B186: 3 | C186: 5 | D186: 0 | E186: 0 | F186: 0 | G186: 0 | H186: 55
A187: 17 | B187: 3 | C187: 6 | D187: 0 | E187: 0 | F187: 0 | G187: 0 | H187: 67
A188: 18 | B188: 4 | C188: 5 | D188: 135 | E188: 135 | F188: 0 | G188: 0 | H188: 31
A189: 19 | B189: 4 | C189: 6 | D189: 0 | E189: 0 | F189: 7 | G189: 7 | H189: 43
A190: 20 | B190: 5 | C190: 6 | D190: 0 | E190: 0 | F190: 0 | G190: 0 | H190: 12
A191: Total | D191: =SUM(R[-21]C:R[-1]C) -> 270 | E191: — | F191: =SUM(R[-21]C:R[-1]C) -> 17 | G191: —

Sheet: Parameters for large-scale
A1: Parameter | B1: Meaning | C1: Value
B2: Fixed costs of operating a train in m mode, €/ train. | C2: [6000, 5000, 5000, 6000, 6500]
B3: Variable costs of operating a train in m mode, €/ train · km. | C3: [10, 10, 10, 10, 10]
B4: Dwell costs for a train in m mode, €/ train · time. | C4: [600, 500, 500, 600, 650]
B5: Maximum passenger capacity of train k in mode m, person. | C5: [0, 560, 490, 280, 280]
B6: Maximum freight capacity of train k in mode m, ton. | C6: [80, 1, 5, 20, 40]
B7: Earliest departure time of any train from its origin station. | C7: 0
B8: Latest arrival time of any train at its destination station. | C8: 300
B9: Arrival headway between two adjacent trains that arrive at the same station, min. | C9: 3
B10: Departure headway between two adjacent trains that depart from the same station, min. | C10: 3
B11: Departure headway between two adjacent trains at the same origin, min. | C11: 5
B12: Maximum number of times a high-class train can overtake other trains. | C12: 5
B13: Maximum number of times a higher-class train can be overtaken. | C13: 5
B14: Maximum number of times a low-class train can overtake other trains. | C14: 3
B15: Maximum number of times a lower-class train can be overtaken. | C15: 3
B16: Maximum number of stops for a train. | C16: 10
B17: Maximum number of trains that can stop at the same station. | C17: 10
B18: Maximum dwell time of train k at station i, min. | C18: 20
B19: Minimum dwell time of passenger train at station i, min. | C19: 5
B20: Minimum dwell time of freight train at station i, min. | C20: 10
B21: Minimum dwell time of combined train at station i, min. | C21: 8
B22: Average running speed of passenger train, km/h. | C22: 300
B23: Average running speed of freight train, km/h. | C23: 200
B24: Average running speed of combined train, km/h. | C24: 250